,comments,scores
92,Ah! So the Congressmen quickly issued bipartisan support for the relief? That's what they do when they know their fingerprints are all over the fiasco. <br/><br/>Investigate who gave campaign donations to these politicians. How did the law get made that allowed the taxpayers to be fleeced without accountability?,0.4857
93,Well many republican leaders and pundits have acknowledged that the republican party is indeed the stupid party.   ,0.4767
94,Because the lobbyists for the right to be armed are more powerful than the lobbyists for mental health advocacy.,0.4754
95,State and local politicians of both parties have long found it easier to provide deferred compensation rather than appropriate current compensation.  It is called kicking the can down the road.  Republicans hypocritically complain about a practice they have embraced.  What else is new?,0.4588
96,Well said Mr. President. I applaud the tenacity of Ms. Eaton and the countless millions that have fought for the fundamental right to vote. Ws cannot have the clock rolled back just because so many are unhappy with the constantly evolving face of our country. We must continue to fight for liberty for all. There should be every effort made to allow one to vote and not have countless roadblocks thrown up to undermine ones desire to practice their civil duty.,0.4472
97,"One would think Senator Reid's comments reflect simple common sense. Alas, he's faced with an opposition party with one segment that has no common sense. And in the end, it's the fight between the two wings of the Republican party that has stymied responsible legislation in Congress (just as it has in so many states, see NC for example).<br/><br/>When they took control of Congress, the Republican leadership promised to show us how they would govern. For the most, they have displayed instead an inability to govern (look at the temporary extension of highway funding), even when Democrats compromise. So let's give up notions that the Republicans are even vaguely competent and turn them as soon as possible out of office or at least out of the majority.",0.4404
98,Yeah because the same people who vote Donald Trump President of the United States would side with the 8% approval rating establishment corporate lackey Congress that they've hated for nearly a decade.<br/><br/>And then you woke up. ,0.4404
99,"Agree with you 99.97%.<br/><br/>But, we aren't spending a trillion ""because 3000 people died"".  That trillion is being spent because the corporations who benefit call the political ""plays"".  <br/><br/>Inadequate campaign finance regulation (read Citizens United...brought to you by the $80b Brothers) is what fuels our national madness!",0.4389
100,"For people that purport to love America so much, the Republicans sure do hate democracy, don't they?",0.4215
101,"Donald Trump is bringing out the worst in all of the candidates with his hateful diatribe, which seems to just roll off his back.  But this country is not made up of only hateful right wing republicans.  There are normal republicans without the hate.  There are democrats who want everybody to just get along, have enough to eat and get medical care.  And then there are the independents, people who actually look at the issues before determining which candidate they will vote for.  It is my hope that the independents see through the loud, hateful talk.  We will never build a wall and we all know it.  The easiest way to curb illegal immigration is to have the employer verify citizenship before they hire someone.  We all know that.  But the business lobby will not allow that.  So this is all talk.  Nothing will come of it.  But it is fun to watch.",0.4114
102,Perhaps they are voicing disapproval of a 'bad' deal. It seems that that the polls show that the cross party population of Americans also feel that this is a 'bad' deal. Republican legislators are simply representing the citizens of the US.,0.4019
103,"Evidence: Cooperative Congressional Election Survey showed 6.2% of non-citizens voted in the 2008 election.  Without that, it is unlikely that we would have had one party rule for the next two years.  The NYT seems to have a blackout on allowing mention of this piece of evidence.",0.4019
104,"The majority, yes.",0.4019
105,"These laws are not ""a disgrace to democracy.""<br/><br/>These laws are designed by an oligarchs and enacted by a bigots<br/>to obstruct and dismantle democratic processes.",0.3875
106,"Uh, didn't anybody ever tell you about the primaries, Mr. Brooks?  First you have to win your party's nomination and then you reset for the general election.  Reaching out to the middle only seems hypocritical if you've allowed yourself to fully pander to an extreme element.  Liberal democrats and center right republicans have been with us  a long time.   The hardliners are a more recent development.",0.3818
107,"Dear Arctos,<br/>My response to your plea is, 'We will continue trying to repeal Obamacare.""<br/>Sincerely,<br/>John Boehner<br/>Speaker, U.S. House of Representatives",0.3818
108,"Dudley, probably not. They maybe more practical. Here it happened to be THE Republican position. Republicans can be right too, not always wrong.",0.3724
109,"America deserved better than his ex-CIA Director father and his neocon brother, but he's got a long way to go to prove he's unrelated to their principles - or lack thereof. What he has in his favor is Hillie/Billy Clinton. For once a Democratic choice is worse than the opposition and if the Clintons are the Democratic choice I'd vote for Bush despite his right wing friends and ideas.<br/><br/>If only Bernie Sanders could make it....",0.3716
110,"That's what the election is about for you and great.  But just as it is so for me and everyone else, it's not always about you.",0.3716
111,"No, I don't think Corbyn and Obama are similar in the sense that they share the same political views. Their characters seem similar, however. Both are genuine; that is, they come across as real, speak their minds and mean what they say. They both possess the quality of radiating goodwill toward everyone. Obama's political enemies have said everything negative it is possible to say about a person. Corbyn is now on the receiving end of such comments. They are similar in this sense. As for their politics, well, Obama isn't quite so moderate as all that, having secured what has eluded all progressive Democrats since WWII -- something like a universal healthcare program. He has other accomplishments that go beyond ""moderate"", the latest being the first real action by a US president to begin to address climate change problems. What Corbyn might do, I can't say, but it wouldn't likely be the same kind of mild Toryism favored by the Blairites. ",0.3716
112,"It's a long way from polling a piece of a fraction of the Republican electorate to ""the voters of this country agree with me""",0.3612
113,He sounds like a Democrat. ,0.3612
114,"I think the big victory goes to the American people. President Obama has health insurance, as do members of Congress who have opposed Obamacare. Their health insurance is paid for courtesy of the American people, many of whom can now afford health insurance for the first time. ",0.3612
115,Having done ballot security all through the 1990s in New York City for Republicans I never did see any voter fraud but what I did see was minority voter suppression in the guise of that security and Mr. Christie knows that's what it's all about.,0.34
116,"Obama could have supported legislation to change the name back when he was a Senator, too...but didn't....",0.3182
117,"Well, that would be the likeliest scenario for Democrats to recapture a filibuster-proof Senate majority and a House majority to boot.",0.2732
118,"This is a very sad history. But, as well as, difficult news which does not make sense in the 21 st. century. Americans who pride themselves that Democracy is the mother of politics in the United States are totally wrong in this case.<br/><br/>So to all of those Americans, including President George W Bush, who want to implant the full meaning of ""democracy""  abroad, better start working at home to implement a ""national voting system"" which gives the voting right to every individual no matter the color of his/her skin. Otherwise, your talk about democracy is pure hypocrisy. ",0.2649
119,And the Democrats aren't consumed with silliness? Did you not notice that guy Sharpton standing in front of you?,0.2561
120,"Hear, hear (or is it ""here, here"")!<br/><br/>By the way, if you had been from New York and been ""represented"" by Charles ""Chuck"" Schumer, you'd have been just as disappointed and ignored, had you written him an email (or two or three) or even posted a letter asking him to absent himself from Netanyahu's audience, given him by the Republican congressional majority, when the latter bloviated to the Congress of the United States in spite of the strenuous objection of the President Obama and his administration, a President ostensibly from his (Schumer's) own party, for crying out loud!<br/><br/>As always, our ""representatives"" are responsive almost exclusively to those who make substantial donations to their campaign funds and cannot be bothered to even respond intelligently to any stray constituent who happens to write them. I suppose there may be exceptions, but I can't think of one.",0.2535
121,"Jindal was absolutely right, the republican party is the party of stupid.",0.25
122,"OTOH, as many Dems seem to think she's Republican lite, perhaps not.<br/><br/>Anyway, she has an interesting history of accomplishment and all the focus on discrediting her has not completely tarnished her record.<br/><br/>I love Bernie, but aside from her terrible record on tar sands and fracking, she's not so bad. Hopefully she will get the message about climate change as things are hotting up in a hurry.",0.2451
123,"Why wouldn't you vote for Bernie? I find it hard to believe so many people would vote against their own self interests. Unless, of course, you're a 1%er?",0.2406
124,"...So King v. Bromwell will play out like Roe v. Wade, with members of Congress and state legislatures looking to leave it to die by a million cuts.  Imagine if political figures turned their priorities and energies into improving legitimate flaws rather than simply cutting it and letting the chips fall as they may.  That would be leadership, not political posturing. ",0.2023
125,"You are correct!   The essential answer to these outrages is to vote.  Every right thinking person must register and vote.  Do not let the gerrymandering, voter suppressing republican win again.   We must all rise up and do our duty.",0.2003
126,"The Democrats are what my old football coach used to call ""gutless wonders.""  They do OK when the odds are strongly in their favor, but lose their nerve when the going gets tough.  They also lose many elections they could win.  Just review the list of Democratic presidential candidates since 1984 including the present 2-termer.  Notice any gutless wonders?",0.1819
127,"Whenever a municipality asks for local control, it never ends well for the ""minority"" population in that political jurisdiction. In NYC the minority rights would probably be the republican voters.  Imagine what life would be like for women in some of the US states without the ""adult"" supervision of the Federal Government ? ",0.1744
128,"Bill, I'm sure you are genuine.  But saying ""bipartisan fix"" makes it seem that you have been reanimated from a cryogenic chamber where you spent the last 6 plus years.",0.1655
129,"Maybe a Biden-Webb ticket ? All ""Bases"" would be covered ( liberals, foreign policy, congressional expertise, women vote,  criminal justice, veteran vote) yeah, far from perfect no doubt, but both of 'em forgot more about the gearings  of this republic than any those knuckleheads debating next week...",0.1531
130,"Sure Greece is a democracy just as we are. The  word that is no where mentioned in the US Constitution. We preach it to others and yet practice it our selves. For all that matters, we are a REPUBLIC. Government of the people, by the people and for the people.  In realty all the people  are hardly being represented  in the US Senate or the House of Representative.  Two Senators from  each state  irrespective of the population is  absolutely totally undemocratic,  Alaska and  some 15 other states have less then 2 million people ( Alaska has less the a million.  CA,TX, FL  have 38, 24 and 19 million each. Every two years   Congressional Districts are gerrymandered for representation in the House.  The self interest, self righteous politicians neither care about the nation or the people. ",0.1461
131,"""Evenwel v. Abbott challenges the inclusion of noncitizens among those who are to be counted for the purpose of redistricting. The case reflects a cynical effort to maximize the voting power of Anglo Republicans in Texas""<br/><br/>Considering how many Anglo Republican Texans like making noises about not being part of the U.S., perhaps they might want to back away from putting this issue into the Court's sights.",0.128
132,"so Dems should settle for HC b/c she's a women? that is the best argument? The Clintons are sleazbags and if Dems cant muster at least one more candidate, they deserve to lose. ",0.0926
133,"Progressive voters know very well that they can't count on Hillary, no matter how may scratches she writes onto her yellow notepad on her staged ""just plain folks"" tour of small-town diners and cafés. <br/><br/>""Just plain voters"" do not have the skin of a Democratic senator or congressman in the game. As a result, Hillary can't count on voters any more than they can on her, and that ain't much.",0.0754
134,"I e-mailed my senior senator yesterday to express my disappointment with his recent positions on Cuba and Iran.  Told him New Jersey does no need a blue-dog Democrat in the senate, and that his position on these two issues would result in my supporting a primary challenger against him in 2018 (assuming he isn't forced to leave office before then because of corruption charges), and/or my not pulling the lever for him in 2018 if he is nominated.  I received an acknowledgement, but have not received a substantive response to date.",0.068
135,I'd say a good part of the problem in getting somewhere with this act is the way the Senate manages to gum up anything it does with procedural votes and cloture rules and on and on.  Time to reorganize that body along the lines of getting things done.,0.0516
136,"People don't think politics is up to the task facing our major crises, inequality and a deteriorating Climate. Politicians are being financially supported by people who absolutely don't want them to tackle these issues so we are left feeling that Politicians are ineffective and becoming more irrelevant. Don't mistake that for people not being passionate, they are. but we are looking for leaders who are not compromised by fossil fuel money and new structures of organizing power that may look very different from traditional politics as you would recognize it.",0.0417
137,UN's a joke because the General assembly has no real democratic power.,0.0
138,"If Republicans are swooning, they should be able to get this passed in the House. They do have the majority, right? Where is John Boehner on this??",0.0
139,Carly Fiorina is also a businessperson.  If that's your only criterion why not vote for her?   ,0.0
140,"Gerry, did you notice that she was not there to meet them?",0.0
141,"""bring down the government""? We are not a parliamentary democracy. Indeed sometimes I wonder if we are still a democracy.",0.0
142,Democrats don't have Obama on the ticket so they need something to galvanize their minority voters.,0.0
143,Which exactly describes any citizen who would vote for a Republican for ANY office. ,0.0
144,Come on.  There are a million reasons to not vote Republican.  This is really nickpicking,0.0
145,being opposed to Congressional control of the central bank does not one a Fed apologist.,0.0
146,Another thing republicans have never done when in control of all branches of government; enact the policies that get them elected such as abortion and bans on gay...anything.<br/>That the rubes who vote for them don't wake up and notice that little tidbit says all we need to know about the republican base.,0.0
147,Did you really expect The Times to be even handed in its treatment of Republicans and Democrats and the personal views of their presidential candidates?,0.0
148,"If only ""march to zero"" was a reference to Kansas' allotment of electoral college votes.",0.0
149,For almost 7 years this President has treated his own democrat congressmen as second-class citizens---this is just some of the payback.,0.0
150,"Republicans never get to say ""If I only knew then what I know now."" They didn't know it then and still don't know it.",0.0
151,"The way I heard it, he said ""Madam, that is not enough. I need a majority.""",0.0
152,"Unfortunately!<br/><br/>Then I won't be voting for a Democrat, if it is Clinton.<br/><br/>Before you start on the anti-women thing, I must mention that I am<br/>a woman.",0.0
153,"The Republicans believe that millions of people will lose health insurance, and that they will either not vote, or will even support Republicans for doing so.",0.0
154,So who you voteing for?,0.0
155,I'd rather say they're making citizens who vote.,0.0
156,Did you really expect The Times to be even handed in its treatment of Republicans and Democrats and the personal views of their presidential candidates?,0.0
157,Who invariably doesn't vote!,0.0
158,It was Republican Idol!,0.0
159,A pox on all their houses.,0.0
160,"should have to show proof of citizenship to vote...we show ID for many things, from getting on a plane to cashing a check...insanity to let non citizens vote",0.0
161,"Actually, I believe Chuck Schumer's Senator career should be OVER!  I won't vote for him again.  ",0.0
162,"Not software, but TPA and TPP. Our current Republican President will see to it.",0.0
163,"""So many Americans are incredibly stupid.""<br/><br/>Well, people did vote for Mr. Obama twice so I concede your point.<br/><br/>Luckily, you can vote for that ""independent"" -- Hillary Clinton -- for President.",0.0
164,"Do you really think facts , even those established by science, much less economic stats, really sway Republicans?",0.0
165,"Democrats who voted for cloture:<br/><br/>Michael Bennet of Colorado, Maria Cantwell of Washington, Thomas Carper of Delaware, Chris Coons of Delaware, Dianne Feinstein of California, Heidi Heitkamp of North Dakota, Tim Kaine of Virginia, Claire McCaskill of Missouri, Patty Murray of Washington, Bill Nelson of Florida, Jeanne Shaheen of New Hampshire, Mark Warner of Virginia and Ron Wyden of Oregon.",0.0
166,And yet you keep voting for democrats.,0.0
167,"""I resent having veterans in Congress.""<br/><br/>Veterans are citizens. Their status as veterans doesn't exclude them from participation in the activities afforded a citizen including running for a seat in the Congress. Perhaps you think they shouldn't be allowed to vote either? ",-0.0088
168,"Ah yes, you will note that except for Ms. Richardson, these were all absentee ballots, that you don't state who they were cast for, and to switch the vote in Ohio would have required over 103,000 votes or a 3% swing, your .0001% is a little shy of moving an election.",-0.0276
169,"Democrats found out the hard way the price of ignoring their constituents out of loyalty to Obama. They lost both houses because of their blind loyalty and many a Democrat's political career was ended.<br/>Now, it is Republican's who are ignoring their base out of loyalty to their corporate owners. The very Party who promised to stop Obama has done nothing except to rubber stamp his agenda since becoming the majority in both Houses. They will pay a handsome price for their betrayal come 2016 when enough of their base stays home or votes for a Democrat to spite the GOP for stabbing them in the back. Let's face it, both Party's are full of corrupt traitors. Americans don't have a representative Government.",-0.037
170,"How can you say, ""She has proved in recent years that she is a talented and thoughtful politician and has found ways to connect with voters on various issues."" She ran a horrible campaign for the Senate, lost miserably, and alienated almost everyone who watched her. Some talent.",-0.0516
171,MW - President Obama has done a good job despite Republican opposition and has remained gracious in the face of an appalling amount of hatred and bigotry.,-0.0516
172,"You very own favorite administration, Dubya's, filed a report in 2008 stating that voter fraud was all but a figment of the right-wont's imagination.<br/>Even Fox says your claims are bogus.<br/><br/><a href=""http://www.foxnews.com/politics/2011/09/24/voter-id-laws-target-rarely-occurring-voter-fraud/"" title=""http://www.foxnews.com/politics/2011/09/24/voter-id-laws-target-rarely-occurring-voter-fraud/"" target=""_blank"">http://www.foxnews.com/politics/2011/09/24/voter-id-laws-target-rarely-o...</a>",-0.0672
173,President Obama has learned “how military action can result in unintended consequences.”  It's unfortunate that we have an entire political party that hasn't.,-0.0772
174,"You want to get rid of vote fraud?  Get rid of absentee ballots, the easiest way to steal an election wholesale.  But of course that would cause certain inconveniences for all those Ohio retirees who are snug in their Florida condos come November.  ",-0.09
175,"Worst people attracted to the Republicans?  Plenty of 'worst people' affiliated with the Democrats.  For example, why is it perfectly okay for 'wealth redistribution' advocates like Senators Sanders and Warren--basically, legalized Government stealing--to wrap themselves in the cloak of 'populist social justice' and thus escape the 'worst people' label?  There is plenty bad with thievery of personal property.  There are a lot of 'worst people' attracted to both parties.  And good people too.  Not all Republicans are racist gun-toting reactionaries.  Not all Democrats are knee-jerk limousine plantation mentality liberals.  Because someone wants to identify with one party or another, or one cause or another for that matter, doesn't necessarily means they are wanted.",-0.0926
176,"Exactly correct.<br/>Yes it is dangerous, to the politicians who support it.",-0.1027
177,"I am a long-time Democratic supporter, and I am deeply disappointed in my own party. I will cancel my membership if this is not getting passed, and I will spread the word that currently, Democrats are actively working to undermine American leadership in the world. ",-0.1263
178,I have always heard they grow it strong out there.   I have seen precients in Louisiana report 125% turnout.  I know people personally who admitted that they  kept registrations in multiple precients and cast multiple ballots before systems were put in place to stop it.  I personally have seen poll records with the fresh signature of long dead people having signed and cast their ballot.  More than two.,-0.128
179,"Getting a gun isn't as easy as getting an Elections Identification Certificate, which is free.",-0.1295
180,Thank you for such an in-depth study of the insanity of ideologically-driven politics. But you get what you vote for.,-0.1531
181,"Problem is how do you stop it? Really stop it, that is.<br/><br/>What we need is direct democracy. Representative democracy was based on the notion of expediency: you couldn't get important time-sensitve stuff done in a horse and buggy world. But with the internet you can. So why not? Who here can claim that our congressional representatives are our betters in terms of representing us in a responsive manner? The people need to take the reigns.",-0.162
182,"It’s curious that Mr. Obama had stubbornly refused to become involved in pubic policy debates until now. His leadership has not been poor, it’s been non-existent, and the consequences have been dire: with no opposition, the GOP has come from the edge of extinction to become the dominant force in the land. Now Mr. Obama suddenly appears on the scene to advance this particular legislation, despite apoplectic opposition from what remains of the unions. Hooray again for Nancy Pelosi, the last mensch still standing.",-0.1645
183,"If the Pope were invited to address Congress so he could urge the members to reject legislation proposed by a Democratic President and a leading Democratic senator did the Pope's bidding, I guarantee you that the senator's religion would enter the discussion. ",-0.1779
184,"Dick Durbin should be the next Majority Leader, not Chuck Schumer. Shame on Harry Reid if he doesn't support Durbin, who's supported him for years.",-0.1788
185,"I'm surprised that no one has pointed out that we have a constitutional precedent regarding this topic. The founding fathers awarded slaves 3/5ths representation in the house, despite them assuredly having no right to vote. I don't see how that logic wouldn't apply in this case as well. Even if you can't vote, you deserve representation (we can even add the qualifier ""...if you are here legally"" to make the nativists happy).<br/><br/>Further, are people who are legally allowed to vote but choose not to or just can't on voting day less deserving of representation? Should we find out beforehand who is actually going to vote just to ""get it right""? Tactics like this are incredibly dishonest and pernicious. Rather than sway voters to support them with logic and sound policy, they simply try to exclude them from the democratic process altogether when it's to their advantage (and the reverse when it's not, like 200 years ago). Disgusting.",-0.2002
