,comments,scores
186,"Rima, that's is a fair point but if you really want to go down that road you should consider what the unconscionable black abortion rate, abetted by the democratic party,does do electoral clout. Lots of black babies missing because democrats convince their parents they can't do any better.",-0.2191
187,Your argument would be slightly more compelling if Republicans in many of these states hadn't actually admitted that the measures are designed to reduce voting among presumed Democratic constituencies.,-0.2219
188,"So, the people in these banana-republic states are just unfortunate passive victims, unable to do anything to improve their lot?<br/><br/>Maybe we should give them the vote!<br/><br/>Oh, wait...",-0.2244
189,I suspect his real aim is to ensure a Democrat victory by making a mockery of the Republican primary process.  Something is really fishy and underhanded going on  here.,-0.2263
190,"Apparently you don't vote or you watch Fox News as your only source of truth. If you vote, I fear too for what you vote for including the country.",-0.2263
191,"He is all about the base.<br/>Still, even primary voters can still only vote once, so I guess he is pushing someone less ridiculous under the bus. <br/><br/>He did get a shout-out from America Ferrar for making voter registration among the difficult demographic of young Latin voters much easier for the get out the vote crowd. Silver lining.",-0.228
192,Student IDs are not considered acceptable because of the possibility of being registered in two voting districts or even two states. ,-0.2411
193,"""Of course, saying things like that means that I should be jailed for life.""<br/><br/>No... The WSJ, to someone like me, doesn't mean Diddley.<br/><br/>What meant the world to me was your staunch defense of Keynesianism at a time it meant the difference between a depression and coming out of its brink. But, slowly, over the last two years, you've made your pivot back into Clintonian territory when it comes to your analyses; more by omission than by analytical mention, praising Hillary Clinton when she doesn't yet deserve it, and not mentioning her in the same breath as others you criticized when she should have been.<br/><br/>Then again, the Times isn't what it used to be when it comes to its coverage and analysis of the coming election cycle and we all lose out. I know I am not alone in feeling a sense of foreboding. We are about to turn a corner as a nation and I can't yet tell that we will either choose the right one or that we will be given sufficient light to see the precipice in time.<br/><br/>The Libertarians don't matter. Jeb Bush and Scott Walker don't matter. Who Democrats pick matters. Whether or not Democrats wake up and follow Bernie's lead with a real southern strategy will make all the difference. Who is elected president matters only if he or she has a Congress they can work with and, in turn, your economic prescriptions will matter again.",-0.2681
194,FINALLY!  someone gets it!  It's the Congress(both parties) and Presidents that need their feet held to the fire.   The(their) corporations are only doing what their politicians allow them to do.  ,-0.2695
195,"If you don't like it, move to Kansas and vote.",-0.2755
196,"Some brave Republican Senators stood with women today, joining the Democrats in blocking the Republican bill to defund Planned Parenthood.<br/><br/>This is the official point at which the Republican Party has thrown the switch on a Third Rail of Politics, aiming to end contraception and abortion availability for women and their families in all walks of life throughout the United States.<br/><br/>Get this: McConnell voted NO on the bill so he could bring it up for a vote again when the Senate reconvenes. More evidence that Republicans can't win without cheating.",-0.2798
197,"Voting shouldn't be allowed long before election day.  Voters are supposed to consider what is said and done during the voting campaign season.  How can they do that if they vote before it is over?  What is there is a late-breaking scandal or other information?<br/><br/>The logic of the Democrats argument is that they should be allowed to extend the voting period as early as they want.  100 days before the election, 200 days, where does it end?  What if they allow Democratic partisans to vote for the *next* election when they go to the polls for the previous one?  Or just to vote straight-ticket Democratic for the rest of their life, with the pull of a lever  Or just make a legal presumption that every African-American has voted Democratic unless he or she indicates otherwise?<br/><br/>As a matter of law, it cannot be that Democrats can make the voting period ever longer, and then make their actions irrevocable by suing under the Voting Rights Act whenever Republicans attempt simply to undo what they have done.<br/><br/>There is no reason for North Carolina to have a long early voting period when New York has none.<br/><br/>States have valid reasons not to have political parties given a long period of time to observe whether a voter has voted yet, and perhaps offer that voter corrupt incentives to vote a certain way, by absentee ballot, or assisted in the polling booth.  That is why all voting by able-bodied, in-state people should be done at the polls on election day.",-0.2869
198,"Bernie Sanders can't win the 2016 election.  The Middle West &amp; VA &amp; perhaps a a couple of intermountain states(CO &amp; NV) need to vote Democratic as well as the Coasts-Northeast &amp; West.  Bernie-a jewish socialist from Vermont- could win the Coasts, but not most of the other states.  Likewise for Joe Biden.<br/>Hillary can win those states with a liberal agenda &amp; a strong turnout of female votes for her  from Independents &amp; some Rep. women.   ",-0.2914
199,I'm 60 years old. No Congressional Representative or Senator has ever asked me how they should vote on any particular bill. Has anyone ever asked you?,-0.296
200,There is no cure for Republican Voter Syndrome.,-0.296
201,Electoral College tie throws the election into Congress and Selina loses to become ambassador to Luxembourg.,-0.3182
202,I can't fault the Texas legislature in this one. Women who voted in these republican clowns voted to give over their bodies to the states and let the state decide on this most personal of all decisions. Wendy Davis got nowhere fast in her efforts to change the system. Let this be a notice to Texas women.....Voting to give your men uncontrolled access to guns and voting to restrict minority rights as many of you undoubtedly did have consequences.,-0.3274
203,Would you a congressional committee to supervise them?<br/>I doubt it.,-0.3612
204,"First and foremost, they need to revise the tax law so that hedge fund managers that make over a billion dollars a year (with a B) are paying the same percentage as someone making $60,000/yr.  The only taxpayers who should be getting a break are ones at or close to the poverty level.  Politicians, both Democrats and Republicans, keep letting the big fish off the hook, because they're all big fish too.  That's not just aimed at the GOP.  Every time the Dems get a majority in congress, you don't see them easing the taxes on us little guys, but when the GOP get a majority, they point the finger for not doing just that.  Don't think I'm a Republican, because I've been a registered  Democrat since I turned 21 (and I'm 65 now).",-0.3653
205,"Republicans, who have railed against all things Obama since day one will perhaps rue the day they pushed to take this healthcare right away from Americans who never had health care before.  These Americans still have the vote, and the 2016 election is right around the corner.",-0.3875
206,"Seriously, Ross? Vote for Jeb because he's a ""safe harbor?"" The man appears to be as dumb as a rock, but because he isn't The Weird Donald, he somehow deserves your vote?<br/><br/>The challenge the Republicans face is to convince the nation that electing a know-nothing with no ideas except to roll back the clock to the early 20th century is a good idea. It's a hideous slate of candidates that makes one long for the likes of Eisenhower, Rockefeller Javits -- even Goldwater had most of a brain.<br/><br/>And the idea, current in all Republican circles, that Fundamentalist Christianity should be forced to some extent upon everybody is too bizarre to even imagine happening in 2015.<br/><br/>There are ample reasons why this crop of Republicans has been called a Clown Car. Except there's nothing funny about it.",-0.3964
207,In Britain like in the U.S. the sluggish recovery has been good for a small fringe of the population while the big majority struggles to make ends meet. Despite the sufferings of a large majority of ordinary people we keep electing politicians who genuinely don't care about the wellbeing of their co-citizens in the Congress or the House of Commons. It's sad to say but we have the politicians that we deserve...   ,-0.4145
208,Omg the Republicans are making it so hard for us to vote for them when they put dinosaurs like McCain and Graham.  These two might just be the stupidest conservatives in the Senate.,-0.4149
209,"""Many DO vote.  This is the issue.""  <br/><br/>The fact is that actual cases of voter fraud are almost non-existent.  Please show us the sources for your statement, other than the talk in the barber shop and opinion guys on Fox News.",-0.4173
210,I guess I should be elated about the SC decision but is seeing the Republicans failing in their role as saboteurs of American Democracy such an accomplishment?,-0.431
211,"Eh, it's not just Republicans.  It's Democrats, too.  If you think only one side of the aisle is bought by industry lobbies - I have many, many bridges to sell you.<br/><br/>If you had to pin blame, it'd be on our federal system, in which agrarian states effectively wield super-votes at the cost of coastal states and American citizenry at large.  Sure, they tend to elect Republicans more often, but their Democrats behave the same way.<br/><br/>Lobbying is here to stay, but we need a national strategy to defeat these ""angelic"" farmer lobby and their corporate enablers.",-0.4497
212,"I don't trust anyone or anything in Washington to do the right thing for the common American worker. Our system is so rigged by special interest, our laws are written by lobbyists to suit big business. What is said and what is actually done are two different things completely. No one in the political class other than maybe Bernie Saunders has the regular guy's interests at heart. No one.",-0.4526
213,"Maintenance is invisible, what corrupt (all) member of Congress would vote to spend money where it cannot be seen, where he cannot stand at a ribbon cutting. Besides more tax cuts for $Billionaires are far more import than our parks, just ask Reagan and the GOP forward.",-0.4549
214,"These Republicans are awful, period.",-0.4588
215,"Many the scoundrel who has tried to sway voters with appeals based on (choose one)... the veterans, the children, the police, the firefighters, the elderly... you name it...<br/>Just one of the many hypocritical tactics that skews our politics and adds to our dysfunction...<br/>When there are so many 'sacred cows' everyone gets gored....",-0.4588
216,A wrong narrative here for the proponents: A vote against TPP is a vote for China,-0.4767
217,Exactly where did the Republicans say that the poor and the earth be kept out of religion? I don't think that statement is reflective of Republican beliefs and I am not a Republican.,-0.4767
218,This is despicable - i work to see this man defeated in the next election <br/><br/>Jerry NYC  ,-0.4767
219,"Walker will say whatever his funders tell him to say. He's a fundamentalist Christian, endlessly greedy, endlessly power-hungry---and beyond that, absolutely nothing. He has ruined his state and will now do the same for the entire country if the electorate is stupid enough to vote for him.",-0.4847
220,Nothing very remarkable.  They're the same sort of people who support UKIP and the Front Nationale.  Their ceiling is 20 or 22 percent of the electorate.  They're not particularly affluent and they're not very sharp.  They live on their peewee resentments.  That's the deal.,-0.5173
221,"This is not a good bill.  President Obama has hailed it only in the most vague and general terms, and it's a bill in which no specifics have been revealed.  So how could anyone vote for it?  ",-0.5266
222,"Anna, voter fraud is virtually non-existent in this country. That's just an excuse.",-0.5423
223,The number of voter ID fraud cases  is so tiny as to be non-existent.  Whereas these voter ID laws disenfranchise thousands of  eligible voters.,-0.5423
224,"Not just old, but white and male.  That's something democrats only have trouble with when it refers to republicans.<br/><br/>Maybe now they'll give it a rest with identity politics.",-0.5499
225,"Those who argue that the General Assembly and not the Security Council should be the prime U.N. decision-making body are living in a fantasy world of pseudo-democracy. I expect many of them simultaneously do not like that there are two Senators representing the half million people of Wyoming and two Senators representing the thirty million people of California.<br/><br/>For the U.N. to be effective at all, it needs to represent the world as it is, not the way we would like the world to become.",-0.5508
226,"Get off their duffs? It is gerrymandering, lack of transportation, no voting by mail or early polling, and deliberate suppression of non-Republican votes, not a matter of not getting off their duffs. It's asking to take off from behind the grill or counter an hour early, walking to the bus station, riding 20 minutes, walking 20 more to the basement of a church, and standing in line for two more hours before you get home to cook dinner. ",-0.5535
227,Unethical? Got it!  She should be a congressperson then.,-0.5562
228,Until now I never fully appreciated how spot on Bobby Jindal was when he called the GOP the Party of Stupid.,-0.5601
229,"I think this a time wasting ridiculous debate and essentially a non issue being that al voter has to do is get an ID card which is a very convenient and instant proof of identity which genuinely eases one's way through society in general, not just in casting a vote. Instead of all this energy being put into protest we could be forming a plan to help people acquire an ID. If they are citizens there should be no problem.",-0.5754
230,"Obama's a leader, but he doesn't get a vote, Congress does. The President doesn't write any legislation, doesn't get to vote on it, doesn't appropriate money, Congress does. Obama has been very disciplined at achieving and setting up things that he could get done. Not posturing over ideas  or negotiating points that he knew he would have to abandon. He's a very practical guy. ",-0.5927
231,You deniers really think people commit fraud everywhere except in voting for elections?<br/><br/>Really??,-0.6093
232,"If Republicans were serious about representative voting, they would acknowledge that the problem is with low voter turnout, not excessive ballots in need of restrictions. ",-0.6249
233,"The ACA is a seminal step forward in health care.  Its main accomplishment is and will be to provide insurance to the previously uninsured.  From the Republican standpoint the ACA is an abandonment of the free market and represents creeping socialism at its worst.  As an ideological matter, Republicans were bound to challenge the ACA.  Democrats know that the ACA is better serving the public and believe that's the end of the argument.    Republicans have a deep distrust of the government and believe that the ACA's inefficiency, in the long run, will render it an unwise program.  Some government programs are great.  Some are fiascos.  I'm sick of those who share my liberal beliefs who dismiss Republicans as evil because of justifiable opposition to government activism.  True, Republicans go overboard in criticizing Democrats.  Democrats should take the higher road.  They don't. ",-0.6249
234,"One thing that Reagan did better than almost anyone was win two presidential elections with landslide electoral college majorities.  He also managed to lie and deny and propagate myths with impunity.  As the actor that he was, he could say things with conviction (Cadillac Welfare Queens) that had little substance in reality.  Compared with his predecessor, the somber nuclear engineer who suffered oil shocks with huge inflation and a hostage situation, Reagan promised a return to previous American Glory.  In the meantime he surreptitiously employed the Southern Strategy which turned Dixiecrats to Republicans, and greatly harmed minority populations and contributed to current political polarization.  His dealing with Iran via Oliver North and the Iran-Contra scandal has been forgotten while Hillary Clinton is repeatedly pilloried for ""Benghazi"".<br/>I'm not sure how he and the Republican propaganda machine did it then and do it now, but I admire (in a negative way) their effectiveness. ",-0.626
235,"Never thought I'd read it: DEMOCRATS spurn President Obama. What will this do to the knee-jerk instincts on the left to blame the washed for all set-backs? REPUBLICANS can't be blamed for this? How did THAT happen?<br/><br/>It happened not because the TPP probably wouldn't have been in our interests, but because Mr. Obama's politically infantile inability to tee up a policy priority and effectively SELL it to America has gotten SO bad that it's even turning off his fellow travelers.<br/><br/>The TPP may still pass the Senate, though not as fast as he'd hoped -- and he'd better put down the golf clubs and start shmoozing senators, or it won't be ratified at all. But the implications of this failure reverberate globally. Other leaders see how weak he is with Congress, on which he must rely for much of what he wishes to do -- even his own party! -- and conclude that it could be time to even more assiduously challenge him to secure their own interests at our loss.",-0.6342
236,"As far as I am concerned, rile up the ""minority"" voters.<br/>Let them know how their right as citizens are being undermined by the GOP legislatures in those states.<br/><br/>Where is CORE, SNCC, and La Raza. Organize and get those people registered to vote, and if there re problem, take them to court.",-0.6369
237,"I think many less well-educated, middle-class and lower middle-class citizens elect Republicans because Republican candidates excel at playing (preying?) upon the fears of this demographic (e.g., ""big government [think Democrats] will control their lives and erode freedoms through excessive regulation""; ""Democrats will raise your taxes""; ""illegal immigrants are stealing American jobs""; ""our Homeland is threatened by rabid Islamic extremists"", etc.).<br/><br/>These tropes and corresponding rhetoric are used with skill and great effect.",-0.6369
238,"Well, if the immoral and illegal Hillary is all the Dems got, they are going to need the illegal vote to win this one.  ",-0.6486
239,And all of the justices in the majority who voted for this ugly decision -- ironically! -- are Catholic!  ,-0.6661
240,"The political penalty for being consistently wrong about many things has been greatly diluted by the conservative media which forges ahead with its ideological preferences regardless of the facts. Many republican controlled states are grappling with huge budget deficits that their own foolish policies have created, but some republicans still deny any connection between those policies and their suddenly bloated deficits. That is ""Derptitude"" in full flower.",-0.6757
241,"The ACA, i.e. Obamacare, is available in Virginia, as it is in every state. What has not happened in Virginia is the expansion of Medicaid. Governor McAuliffe has pushed hard for this but has been persistently blocked by the republican majority in the House and, to a lesser extent, in the Senate. They would rather reject billions of dollars in federal aid and leave thousands with inadequate health care.",-0.6956
242,Of course the Republicans are against it. They just obstruct and block. They are just negative all the time. it is getting tiresome.<br/>They even admit they are bound to a policy of obstruction.<br/>Despicable.,-0.7003
243,"The Constitution is extremely explicit about who gets to count and not count for determining representatives.  You count everybody, and you get to exclude exactly one, explicitly described category: ""Indians not taxed.""  That's it.  Immigrants count.  Prisoners count.  Kids count.  Black people count as five fifths of a person no more no less as does everybody else in the district except Indians not taxed.<br/><br/>But somehow, Justice Thomas is a bit slow on the uptake whenever it advantages the Republican party.",-0.7332
244,"""Can Our Transit System Get Any Worse?""<br/><br/>Why, of course it can.  Put it in the hands of Republicans and you'll see how much worse.  Or you can achieve the same sorry result by handing it over to a market-drunk Democrat fearful a Republican will brow-beat him or her over public spending.  <br/><br/>Way to go, Boomers!  (And your parents.)  Eat your seed corn.  It's good.  And future generations are going to spit on your graves.",-0.7345
245,"Republicans do not believe that voter fraud is significant, and the justices do not believe that racism is dead.  They all know that those assertions are nonsense; they just want to suppress the votes of people who are likely to vote for Democrats.",-0.7511
246,"It is somewhat understandable that people would consider only the short term effect of voting for a party that will make the environment worse rather than work to repair the damage already done if they are steeped in the GOP ideology &amp; propaganda ,but why are there ANY female GOP voters ? <br/><br/>Why would a female vote to make themselves &amp; their daughters second class citizens ?<br/>The answer seems to be a lack of critical thinking skills. eg. Per 8 separate Gallup polls , on average, 45% of US adults believe that the earth is less than 10,000 yrs old &amp; that evolution didn`t happen. This doesn`t auger well for a rational decision process.",-0.7514
247,"I really wish some of you Obamites would open your eyes and minds so you can see it is Ron Wyden D-OR who is the major cheerleader for the disaster known as the TPP.  Chuck Schumer D-NY is so in the pocket of the 1% he is known as ""Wall Street's senator"" and he likes that.<br/><br/>Both parties have abandoned the American people in favor of handouts from the oligarchs who now largely run the world.<br/><br/>Now, if folks would wake up, do some reading, and then stop re-electing these weasels who have killed the American dream for us and for those we love.  Re-Elect No One!  It is the only path out of this horrific mess.",-0.775
248,"I suspect the apathy is a product of the American system of public education, seemingly in decline for decades and under political sabotage since the 1980s or earlier.",-0.7783
249,"I find the voting rules in mostly ""red,"" mostly ""southern"" states to be unimaginable -- perhaps because I live in the bubble of California?<br/><br/>I registered to vote at the age of 18 where I was asked to provide my birth certificate or my CA driver license or social security card -- any of which would have back-up documentation to prove being a citizen.  I voted for Jimmy Carter in my first election.  SInce then, I have mailed a change-of-address to the voting registrar 3 times.  Each time, voting materials were sent to the new address.<br/><br/>Since I was 18, I have voted in probably more than 100 elections at all-levels.  I have never had to ""re-register,"" show an ID at the polls, or otherwise be made to prove who I am.  Simply being ""registered"" was enough.  I walk into the polls, announce my name and current address, the poll worker finds me on the list, I sign for the ballot -- and that's it.  There is rarely a wait of more than 10 minutes.  In CA we can even vote by mail, or absentee by mail.<br/><br/>The rules have never changed.  There are no claims of ""voter-fraud,"" no one screaming that voting is unfair, no one asking for a voter ID card.  In California it is about the ""numbers"" at the polls, not ""who.""  Voting is respected as the ""right"" of all citizens.  When I see lines of 6-hours in Florida, or the official result from that state 3-days after every other state has reported, I think it speaks more to the incompatency of how those states are run.",-0.7845
250,"Well all I really need to ask is are we better off now than when Obama first went into office? In some ways yes, many who didn't have health insurance are now insured but is that the same as having health care? As a enrolled beneficiary of Soc Sec I still can't afford to see a doctor. The war in the Middle East is no longer claiming half a dozen American lives or so a week but the daily death tole there is appalling. The American unemployment rate has declined but no one ever mentions the drop outs that are uncounted. Our schools are an embarrassment and our infrastructure is still crumbling. Wall Street is still using the same practices that destroyed the hopes of millions of home buyers. Income inequality is rising as fast as the ground in California is sinking.<br/>WE Have tried your reasoned compromise and found that all that it accomplishes against the growing power of the oligarchy is to stall and disperse the efforts to strengthen our democratic principals that supported this nation against all perils, both foreign and domestic for closing on two hundred years.<br/>As Senator Sanders has often said Enough Is Enough. A revolution is pending. Let us do it in the ballot box or surely it will happen in the streets.",-0.7851
