,comments,scores
28,"Restricting voting rights isn't solely a matter of race, but part of a broader intellectual movement that distrusts democracy. I say intellectual because its roots lie in a group of highly acclaimed (in some circles) intellectuals who came to America from Germany and Austria. It's understandable that they might distrust democracy based on their own experience (after all, the Nazis were elected to office), but they also distrusted democracy for reasons that are unique to America. In their view, liberal democracy in America will lead to a value-free aimlessness and a hedonistic permissive egalitarianism. They look to not only to ancient philosophers for support for their view, Plato and Aristotle, but to America's founders, who restricted voting rights to those they deemed qualified to determine their representatives in government. This view can be seen in comments that warn that certain voters will support politicians who promise them ""free stuff"". Restricting voting rights doesn't undermine democracy, it preserves democracy. It's equivalent to destroying the village in order to save it. ",0.8932
29,"Roth said  (After all, when does Congress not seek improvement?) <br/><br/>How about each and every vote to repeal the ACA rather than replace it?<br/><br/>In fact, I might ask when the Republicans do seek improvement. They seem mostly to be against things that a majority of the members of this republic desire such as sensible restrictions on guns, a higher minimum wage, universal health care, Social Security etc.",0.8924
30,"Given that a lot of Republicans like to oversimplify Federal fiscal policy, insisting that Federal decisions on spending should mirror family unit decisions on spending, Rubio's budgetary and fiscal difficulties should disqualify him from the Republican nomination.<br/><br/>My late father, a Democrat, was a great supporter of Nelson Rockefeller.   His theory was that Rockefeller had so much personal wealth that he was immune to bribery or other financial temptations.  I can imagine what he would have thought of Rubio.",0.8901
31,"With 60% of the electorate a the greatest voting and most of these voting according to their intuitions instead of according to reasonable considerations of their interests, of course the elected officials tend not to be accountable to the people the represent. We don't need a new political system so much as an electorate that pays attention and demands the best representation that they can find.",0.886
32,"Well spoken, as head of a company whose principal clients are the financial community itself.  Yes, I am sure that most Americans you know will benefit mightily.  But neither Mr. Obama, advocates in Congress, or members of the business elite like yourself have provided the 99% of us outsiders with any hard evidence to back up your assertions.  Another secret bill, which by all accounts has not even been read by the people in Congress who approved it.",0.886
33,The three REPUBLICAN Supreme Court Justices who voted to allow Jerusalem be declared part of Israel simply exposed themselves as as the politicians they are knowing full well that their pro-Israel vote will serve the Republican Party and candidates well keeping the money flowing their way.,0.8779
34,"Of course the Republicans on the S.E.C. voted against the workers and for the richest of the rich.  They represent billionaires like the Koch brothers, not the peasants who have to work for a living.",0.8591
35,"This is a rather vague comment - can you expand upon what it is that 'appalled' you about the emergence of Corbyn?<br/><br/>For me, it is a tremendous breath of fresh air that a man of authenticity and compassion, who is prepared to face down economic myths rather than pander to them, has emerged as a potential leader of the opposition. <br/><br/>He has reinvigorated the moribund Labour left. No longer will triangulation and focus groups overcome anything resembling genuine principled policy. #corbyn4leader!",0.8439
36,"Krugman is right. There are no independents or very few. 35 years of identity politics and the final playing out of the Southern Strategy have put all the conservatives and liberals in their correct respective boxes and given us the most reliably polarized US electorate within living memory. The Democratic party of today is dominated by a socially and economically progressive coalition of millenials, minorities, and wealthy educated whites (many of them strictly secular). This is the party of Obama and Clinton. She just needs to get them to turn out by appealing to their core beliefs and highlighting the exclusionist, retrograde and occasionally insane aspects of the Republican policy agenda. This shouldn't be too difficult.",0.8403
37,"Actually, I know a lot of military leaders who have an excellent understanding of the    ""historoc ethnicity, and religious components of the problem."" You don't know what advice they are giving to our political leaders. It's really the political leaders who want to protect the established national borders in the region. That's because they have longstanding relationships with regional leaders who can reliably deliver oil.",0.8402
38,There is little uncertainty that Clinton will win the primary. She is spending her time doing what she should. Focusing on core democratic voters and guaranteeing turnout. <br/><br/>There are so many challengers in the GOP field that it doesn't make sense for her to focus on expanding the reach of the Dems until she knows who her opponent is. If she stands off against Scott Walker or one of the GOP's more right-wing members. She won't have much need to expand the base. Demographics alone will win her that fight. Bush or Rubio might complicate matters for her.<br/><br/>I think before she commits to changing strategy she'll need to see a front-runner clearly emerge out of the GOP primary.,0.8347
39,"We are becoming more and more like developing country by the day. The US claims to be the Mecca of Democracy but yet allows the rich to buy elections, lobbyist to dictate what laws are passed, denies that climate change exists, seeks to repeal environmental protection laws, says corporations are people, and wants to go back to a health care and education system that caters to those that can afford it. Voter ID laws are meant to discourage those whose voice would disrupt all of the above, However, if we are truly a democracy all that is needed is to be born in the US or a Naturalized Citizen. And since we keep records on all births and Naturalizations these people should automatically be registered to vote.",0.8261
40,"If you are waiting for clear coherent and sensible policy from the Republican field of candidates, get comfortable, stock up your provisions, it is going to be a long wait. It is unfortunate that you and most in your party have allowed it to sink so low in the quest for sane ideas and instead have settled for policies that sound great on a bumper sticker but in real life don't deliver. The result of this is that you have turned your party over the ultra-rich oligarchs and the fringe right. ",0.8204
41,"Of course he is looking for votes--he's running for POTUS. But, at the same time, the other cowards in Congress are also looking for votes, by taking the ""safe"" route, being cowards, and hoping that the sheep will still vote for them. On this issue Rand Paul is leading, and I commend him for it. But still, he would not have my vote for POTUS, but whoever does get my vote will have to be as progressive and out front as Paul is being to earn my vote.",0.8201
42,"Steve, congratulations!  Please work to register voters &amp; work of E-day in 2016 to make sure every voter is counted.  Please you are a in a state  rhat is very critical to 2016 elections",0.8176
43,"Well boo boo.  The NYT supported Cuomo, as did enough partisan voters in the last election, even though this attitude and type of behavior was his normal procedure in his entire last term. But no, we had to have a Democrat in the Governor's Mansion no matter what.   So he was re-elected and there you go!  So much also for the ""useful idiots"" who have stated they didn't like him but voted for him anyway ""hoping he heard their message"" about their disapproval of his conduct.  Well politicians only hear the end vote count, so such wishful thinking is laughable. <br/><br/>You can't blame Cuomo for the lunacy of the electorate. He didn't suddenly change his spots. You got what you put in office. ",0.8142
44,"If you support abortion, vote the straight Democrat ticket in 2016.  Oh, to have a Democrat and democratic White House, House of Representatives, Senate and -- Supreme Court.",0.802
45,"What's the point of this piece? To make the argument that non-partisan drawing of districts is a worthless undertaking? I would hope not. Sure, Florida is a special case, given the extreme segregation of voters based on party affiliation and geography. But, that's not to say that Florida should just stick with partisan gerrymandering.<br/><br/>Gerrymandering is out of control across the US, and arguably the primary root cause of the ultra-partisan, ultra-dysfunctional governance we now have. If confidence in America's democracy is ever to be restored, eliminating gerrymandering via non-partisan drawing of districts needs to be at a top priority.<br/><br/>PS – The title of the piece confuses ""unbiased"" (in other words, where districts are drawn without regard to voters' party affiliations) versus ""equally proportional"" (in other words, where every district has the same proportion of Democrats and Republicans). That confusion sets up what is really a bogus premise for the whole piece (that drawing ""unbiased"" districts in Florida is impossible).",0.7832
46,"To take the math a step further, with Republican voters comprising about 30% of the electorate, 25% of Republican voters equals 7.5% of the total electorate. Not looking good for the prospect of a Trump victory. As a Democrat, I wish Trump all the best in the primaries.",0.7713
47,"Every day I read about the Republican Klown Kar, the Koch brothers, all the usual cliches. Marco Rubio's wife had all those traffic vilations while Senator Clinton has the means to be chauffered everywhere. We do have diversity in our party. Governors, Senators, Congressmen and women, but we don't count. We don't count because President Obama prefers to hear people who don't vote. No wonder he prefers to deal with and promote Mayors of big cities. ",0.7637
48,"KEEP UP THE GOOD WORK  I hope that the writer will keep up the good work of talking about everything but the fact that the Republicans cannot find a decent candidate to stand in the upcoming elections in 2016.  Their campaign tactics show as much disdain for the political process as the legislators show for governance.  From their vantage point, it looks to me like they wonder how many red herrings, paper dragons and straw men can dance on the head of a voter.  I'm sure that menagerie will grow with time.  But we're talking about our government, of, by and for the people.  Not a zoo.  Get real!",0.7621
49,"@Ralph Averill<br/>'They have succeeded in doing just that'.<br/><br/>Really?  What country are you living in?  Last I checked, the GOP hasn't managed to get a bloody thing that isn't symbolic grandstanding out of their caucus, much less anything Obama hasn't said he'd veto right out of the gate, if they ever hammer out a compromise both houses can pass!  And I'm perfectly fine with that",0.7616
50,"No, the Greek electorate are as informed as anyone else. But when you have millions of pensioners entirely dependent on the state, then this block will vote in their own interests and elect  parties that promise them goodies. Unfortunately, this is very much the flaw in democracy. The people dont always do what's best for their own country.",0.7606
51,And the GOP is only too happy to help.  Corporations and billionaires are the only constituencies that matter in Washington. ,0.7579
52,Of course - their priority is to make sure that is is Dems who get elected - NOT those who are best suited to the job.,0.7579
53,"The defeat of this agreement was the grassroots effort of many thousands of individuals educated on the issues and voting for the best interests of workers worldwide. That's not ownership. That's Democracy. That in no way is comparable to the dictates of singular donors. One can't appeal to the Kochs and the American majority at the same time. We Democrats don't have that problem. Voting Rites, Climate change, the ACA, and marriage equality are just a few examples. ",0.7549
54,"The defeat of this agreement was the grassroots effort of many thousands of individuals educated on the issues and voting for the best interests of workers worldwide. That's not ownership. That's Democracy. That in no way is comparable to the dictates of singular donors. One can't appeal to the Kochs and the American majority at the same time. We Democrats don't have that problem. Voting Rites, Climate change, the ACA, and marriage equality are just a few examples. ",0.7549
55,"What is stunning is moderate, thoughtful Republicans do not say that they will vote for a democrat. That is the only alternative. If you don't, you may give the election to the boobacracy that you decry. Is thoughtful Republican an oxymoron?  ",0.743
56,"I'll make a deal with the three no votes on the court. If they agree to pay the de facto criminal super high health care premiums in a republican led world for all Americans under age 65, I will support their view.",0.743
57,"If there is no place for this sort of Republican Party, then please explain how eight of the ten people on the stage won statewide offices in general elections.",0.7357
58,"How exactly do Republicans expect to convince voters that they have their interests in mind when they repeatedly pass legislation that large majorities, which must include Republican voters, oppose?  From universal background checks on gun sales to campaign finance reform and now net neutrality, huge majorities of Americans oppose the Republican positions.  They pay lip service to the idea of protecting ""the People"" against government overreach and then use government to favor corporate interests over individuals.",0.7351
59,"""African-Americans, Latinos, single women and highly educated progressives"" - by defining Clinton's base this way David, of course, misses the point. The Republican right (redundant) (including Jeb Bush) has excluded all of these groups from any consideration in order to cement its ties to the ""1%"". We can only hope that working class and middle class voters can see that their interests are served by the (barely) center/left Democratic party. A swing to the left, minimal though it may be, is our only hope.",0.7351
60,"One small reminder of this is that Palin was the actual Republican nominee for Vice President of the United States. <br/><br/>Sacrificial extremist? Well perhaps, but she was also the representative of the Republican party, officially, the person they chose to represent them in a national election. Like this author, Republicans have been trying to distance themselves from her ever since, but making someone the nominee, then having her run in a national election makes it a tad difficult to later claim that anyone paying attention to her is cherry-picking some fringe, non-noteworthy figure.",0.7184
61,"Sorry to have to repeat this one, and I'm probably paraphrasing:There is one army stronger than all the armies in the world, and that is an idea whose idea has come.<br/><br/>I agree with you on your basic premise.  Civil rights for a voting minority should not be voted on by the majority. In Ireland, as I understand it, they couldn't legislate from the benches and had to put it to all voters.  Well done, Ireland. ",0.7096
62,"Tough bananas.  It'd be nice if Texas had the guts to sever its ties to the federal teat and try to make things work with their own special brand of 'independence.'  And, as others have noted, these things run in cycles.  <br/><br/>Speaking of which, Texans should realize that the real cycle is voter turnout.  And, when minorities are able to vote things will change.  I'd seriously like to live long enough to see that....  ",0.7003
63,"Democracy is a messy inefficient model.  But what is the alternative?  <br/><br/>The same politicians you call ineffective in Washington are the kind of idealists that many of us would love in office if we believed they could engender real change.  <br/><br/>I'm all for idealism, but with the needed dose of pragmatism.  We are a democracy, we need consensus and compromise or we waste time wallowing in stalemate.",0.6966
64,any old any color democrat is better than all the buffoons in the republic party put together.,0.6808
65,Voting can change everything. I wish we could learn that here in the United States. ,0.6705
66,"In France, about 80% of eligible voters vote on Sunday.  In America, it's about 60%. Americans vote on Tues, since Farmers in 1854 voted on Tuesday since it took them 1 day to get to the polls and they could not travel on Sunday since that was the Sabbath.  We are STILL GOVERNED BY AN 1854 LAW!    For people who work on Tues., there is a conflict between working and voting on the same day.<br/><br/>In Florida, in 2000 and in Ohio, in 2004, many had to wait 10 hours to vote.  In Ohio, many left the voting place after a few hours, to go to work.  (And in 2004, Bush-43 “won” Ohio by 18,000 votes!)<br/><br/>In New York City, it takes me about 10 minutes to vote! Most Elections, I can vote at 6AM, (5 blocks from my home), &amp; be on the subway by 6:30AM &amp; get to work by 7:45AM.   NYC really makes it too EASY to vote, since it’s run by a bunch of Liberals who obviously hate America! <br/><br/>Republicans who rule Florida decreed that there would be NO early voting on Sunday, November 4th, 2012.  (Early voting was prior to Tuesday, Nov. 6th, but for a shorter period than in 2008.)<br/><br/>Republicans believe that less people voting actually increases the probability of a GOP victory.  And I think they are correct.<br/><br/>This born-again Christian really can’t understand why our leaders do not trust us to both vote and go to Church on Sunday.   On Sunday, many of us find time for both Church and the SuperBowl on the same day.  But Church and voting?  Nooo, we can’t have that.   <br/><br/>God Bless America.   God Help Us All.",0.6614
67,"Thank you Senator Ried.<br/><br/>What we need most of all is public/private collaboration jobs bill---urgently.  So that working class Americans are not left behind during this current recovery.<br/><br/>The middle class is an endangered species,  thanks to more than 40 years of Republican AND Democratic Reganesque economics.",0.6597
68,So....the Tea Party is done? Thank you Donald.,0.6369
69,Maybe he can imply that he was an American Indian like blonde/blue Senator Warren and get a free pass from the NYT....oh I am sorry that he is in the wrong party.  ,0.6249
70,"Like so many other congressmen and senators, it is clear that Mr Menendez's vote is for sale to the highest bidder.",0.6249
71,"""Paul"" understands this very well and is waging a campaign appropriate to his knowledge, status, and values.  The call to arms has to go out to the average voter, and all non-voters.  ",0.624
72,"""Paul"" understands this very well and is waging a campaign appropriate to his knowledge, status, and values.  The call to arms has to go out to the average voter, and all non-voters.  ",0.624
73,"Not in the majority party of our Congress, that's for sure.",0.6124
74,Please start a petition at the White House website so the public can register it's support for this action.,0.6124
75,"Congress is controlled by hundreds of poster-kids for American idiocy. In general, the election for POTUS comes a distant second to their own re-election. They don't have to fight for the SCOTUS--they already have it. They know that with a Dem in the White House all they need do is obstruct, and that's a lot easier than constructive governing. <br/><br/>Trump is another snake-oil salesman, and mixing the metaphor, he's the canary in the coal mine showing how brain-dead so many Americans are.",0.6103
76,""" Little by little the opinion of the American voter is being subjugated to the rulings of 9 jurists on the Supreme court."" Really? How is the ""opinion of the American voter"" being subjugated when the ACA was passed by a democratically elected congress and signed into law by a democratically elected president?",0.6072
77,"So, besides talking, what are you doing? Are you contributing to candidates that are addressing the issue? Are you supporting them? Voting for them, canvassing for them?",0.594
78,"Until the Republicans can produce a poet as delightful as Mr Eisenberg, Democrats will continue to carry the day.",0.5859
79,"Well, since the column was primarily about the Republican ""debate,"" why say anything about the Democrats?  He also didn't mention Afghanistan, the Phillipines, or the British Labour Party.",0.5859
80,"Rand Paul tweeted ""As President I would make it my mission to repeal #Obamacare, and propose real solutions for our healthcare system.""<br/><br/>Obama was first elected in 2008 and took office in 2009.  Efforts to pass a health care reform bill began shortly thereafter.  Just how many years have gone by withOUT a proposal for ""real solutions for our healthcare system"" from any Republican?  (And, no, bills to allow sales of health insurance across state lines do not count as any sort of ""real"" solution.)  Just what is it that the Republicans are waiting for?  Where were their proposals during the year that the ACA was being considered?  Where were their proposals when they were voting again and again and again and--well, you get it--to overturn the ACA?  Where were their proposals during the campaigns for the 2012 election?  Is Mr. Paul going to give us a clue as to what his ""real solutions"" are?  They have had years to come up with ""real solutions"" and they still haven't put forth even one credible suggestion (and, no, allowing health insurance to be sold across state lines STILL doesn't count).  So now we're supposed to believe that putting one of them into the office of the presidency will magically result in producing ""real solutions""?  This is so ludicrous that it's hard to believe that any half-way intelligent American would fall for it.  Unfortunately, we appear to have quite a few citizens who fall short of that low bar.  Let's pray there aren't too many of them.",0.5601
81,"As a South African, I would like to say that South Africa is no more a democracy than Zuma is white.<br/>The ANC uses so-called Western democracy to justify their subjugation of other political parties and to stifle any wrongdoings in parliament by Zuma and his cronies. It helps when you have 40 million ignorant, uneducated blacks voting for you.<br/>Unfortunately the true test for South Africa's so-called ""democracy"" is whether or not the ANC will cede power should they ever lose an election. Methinks not.",0.5574
82,I am soon glad you can't vote in America!!,0.555
83,"Democrats love him for his destroying the party's standing among minorities, but he may yet some RINO policies left to share too. If he could put Jeb! on the defensive about handing billions to Shell (through subsidies and tax breaks) and Walmart (by supplementing their inhumane wages) this race will start looking completely different.",0.5487
84,"All this suggests that McConnell was good at blocking things when he was minority leader, but he doesn't have the skills to actually run the Senate.  Maybe he should give the leadership job to someone who knows what he's doing, and take it back when the Republicans are back in the minority. (If things continue like this, that won't take long).",0.5267
85,"Don't forget - the ones who voted for this will be the ones with the largest campaign funding in the next elections.  If they don't retire and open a ""charitable foundation"", that is.",0.5213
86,As far I remember Poroshenko was elected in free and democratic elections in May last year. The same is with Ukrainian Verkhovna Rada (Parliament). Democratic parliamentary elections were held in October last year.<br/><br/>J.I.,0.5106
87,"So ""stupid"" that they won the House and Senate and over a dozen Governorships in the history-making 2010 and 2014 Midterms.  Americans want the ""stupid party"" in charge, 'cause the other one is far worse.... ",0.5106
88,"So is non-citizens voting a big problem, worthy of this effort? Is there any data to support that view? ",0.504
89,"Don't worry. He won't be President. Registered Republicans only make up about 25% of the electorate, and he's only the current top pick of about 14% of them.",0.4949
90,"and a lot of his constituency is not Jewish, maybe atheist, maybe just plain old Democrats who care. The guy doesn't deserve a break.  He will not survive this if it's up to people with a similar mind as mine.",0.4939
91,"The vast majority of American citizens support secure voter IDs, which is conventional practice throughout the Western world, and even in many third world nations. And yet Hillary scolds that this and other common sense requirements are racist voter suppression? What a clown. Let college kids use student IDs, she sneers. Right, because countless non citizens have student IDs, not to mention the ease of counterfeiting them. Think the leftist and diversity hordes on campuses would actively promote these intelligibles to vote at stations manned exclusively by leftist and union hacks. Of course they would because, to Dems, laws are for suckers and white folk.",0.4939
