,comments,scores
0,"@ Chanson de Roland: ""Instead of bringing Europe together in prosperous union, the European project now divides Europe into internecine feuds, even within nations.""<br/><br/>I agree, but I would be more specific: in my view, it is the Euro which divided Europe. The EU was doing quite fine until the single currency. There was friendship between the peoples, and a rather strong friendship between the Germans and the Greeks, actually. The Germans loved the Greeks - their temperament, their hospitality, their food, their beautiful landscapes.<br/><br/>Then came the Euro, which tied everyone together in an uncomfortable and unworkable monetary union. The currency was much too hard for Greece and the other southern European economies. And while the German export economy benefitted, the average German citizen did not - he is now being paid in an under-valued currency, has less buying power on holidays abroad or for imports, and has to watch wihile has savings accounts get eaten up by low interest rates.<br/><br/>Even worse, the Euro has made the southern Europeans into borrowers and the Germans into an economic policeman, who has to insist on following the rules because of his own self-interest, but is resented for it abroad.<br/><br/>We would all be better off, in my view, if we went back to our national currencies. I'd rather see the German export economy take a hit than live in the most hated nation in Europe.<br/><br/>The EU and the Euro are not identical. One worked fairly well until the other came along.",0.9766
1,"_ Did any banker or German hold a gun to Greece's head and compelled them to lie about their nation's financial health in order to gain entry into the EU?<br/>YES! Goldman Sachs cooked the books along with Greece's then-leader to get into the EU and they should be in jail now!<br/><br/>- Did any banker or German hold a gun to Greece's when they cho(o)se to look the other way to rampant tax evasion?<br/>Ordinary Greeks have their taxes taken automatically out of their monthly paychecks, just like ordinary French people. RICH Greeks, and French, however, like many rich of other countries, have their wealth in tax havens.<br/><br/> Did any banker or German hold a gun to Greece's head when they created an unsustainable social welfare state?<br/>The Greeks were doing fine until they joined the Eurozone, as were the French. Southern Europeans should leave the Eurozone until the terms are not skewered in the favor of the wealthy ad, yes, the bankers.<br/><br/>Please read any New York Times article pertaining to Greece and/or the Euro by Krugman to have more details on these issues...",0.9755
2,"May be the Greek government should compromise with its creditors on their demand.  But it should not reduce the pension amount paid to the elderly people.  Instead, the pension will be paid out in drachma.  But the Greek government will protect the drachma so that it would not depreciate more than predetermined level every year, say 5 or 10%.  This will allow 1) Greeks people realize how much will its drachma really worth without Euro, 2) pension benefits will be reduced over time as what the creditors will want, and 3) they have their own currency ready if they truly want to get out EU.",0.9622
3,"You are certainly right about the belligerent style and it would have been smart to avoid overtly marxist terminology, which is waving a red flag (literally). <br/><br/>However one of Greece's biggest problems is non payment of taxes which reduces government revenue dramatically. If their 0.1% is anything like ours that has also reduced living wage jobs (a huge part of the profitability of US companies depends on cheap labor) and increased income inequality. Those are issues with employers, shipowners, etc that are basically soaking the middle class and below. I don't know much about Greece but if their extensive public sector employment and generous benefits are a safety net they need to finance it with progressive taxation - give tax breaks only to employers that offer jobs which replace the need for government hiring. A VAT tax is regressive, not progressive.  Varoufakis could learn a lot from Germany, whose workers are much better off, if he looked beyond the disastrous economic prescriptions being forced on Greece. If Greece showed an interest in copying what Germany does right Germany might in turn have confidence that the Greek government could resurrect the Greek economy if they got some slack ...",0.959
4,"Money is a common denominator, a means of exchange accepted by two or more parties engaging in a transaction.  It is a convenience - no more and no less.<br/><br/>And as such, the means of exchange can not be owned; just as a public roadway can not be owned but rather must serve as a means for free transit, subject only to the conditions that make free transit practical for all parties that require it.<br/><br/>The root of the problem is the current banking system.  As a common denominator, money can not be owned, nor can it be an end in itself, or used to subjugate the elected government of a sovereign nation to to whims of the owners of Greece's debt.<br/><br/>Since Greece is currently a member of the European Community, it can not print it's own currency,  Yet the EC refused to provide Greece with the currency it requires to meet the immediate needs of it's citizens without renouncing it's sovereign right to exercise the powers granted it by the citizens of Greece.<br/><br/>As a result, Greece has no choice but to leave the EC, print it's own currency and administer it's distribution in order to assure the the survival and well being of Greece's population.<br/><br/>Furthermore, the Bank of Greece must not be owned nor controlled by private banking interests.  Ever, again.<br/><br/>As the seat of Western Civilization, Greece has continued showing the way.  Well done, Grecos.",0.9585
5,"""Long Live Europe""<br/><br/>The reason why I chose Roger Cohen’s column is simple: I want to spread the message, Long Live Europe; I cannot fathom that we have to fight to keep being “united in diversity”.<br/>After presenting a project on Romania’s integration into the European Union, I was asked: good or bad? I said positive, my argument was that we have someone to protect us, we have a safety net; Putin wouldn’t leave us alone if we weren’t part of the European Union, if we didn’t have 27 countries ready to help their sister in need.<br/>Romania today is fraudulent. We’re nowhere. They say at least Greece is doing worse than we are, but is that really true? Mr. Cohen says “The worst outcome for Europe would be a Greek exit from the euro,” and he’s right. He also points out that “joining the shared currency, for all nations in it, was an “irrevocable” decision”. Right once again? Maybe Greece wasn’t ready. I know we aren’t and probably never will be.<br/>Mr. Cohen reminds that “[Cameron] has promised, if re-elected, a referendum on Britain’s membership in the European Union in 2017.” Migration to Britain comes in large number from countries part of the European Union. I noticed a huge negative response on social media from young people studying in the UK, many of them allowed to do so because of the advantages that the European Union offers to its people. Britain represents the American dream to many European kids.<br/>Yes, Europe is not doing well, but it is alive. And alive means opportunity.",0.9575
6,"I am so glad for the Greeks. I am hopeful the people will live a better lives in the future. I hope in Germany, the employed people get more share in the reward of their high productivity so that there are less capital to look for returns by lending to the Greeks, or the Spanish people or others. ",0.9558
7,"Funny! The lefty economist Varoufakis, who was trying to tell the Troika that there really is an economics 101, and the ECB that it needs to act as a central bank rather than a collection agency, has gone for unknown reasons.<br/><br/>Of all the stupid comments that I have seen during this entire Troika orchestrated circus, the one which takes the cake is for Americans to ridicule the Greeks for not being able to collect taxes. In 2005 George W Bush repatriated corporate profits at a steep 5% discount, which were held outside of the US in order to evade and not avoid taxes in countries like Ireland, which has no tax liability at a cost to the Treasury of 134 billion dollars.<br/><br/>The 2014 estimate for the loss to the treasury per year is estimated at 50 billion per year. None of this cash has ever showed up as capital investment in the US Economy. Take a look at the list of Dynasty Trust States, which sets up tax free trusts in perpetuity, and then try to laugh at the Greeks for not being able to collect taxes! Hard to laugh now. Isn't it.",0.9529
8,"It is my fervent desire that with this brave step, Greeks will rebuild their economy through value added manufacturing, remain isolated as a national economy, thus proving to the world that a sustainable self-sufficient nation can grow and flourish. Please prove me right and enjoy your new found independence, ironically, the day after we celebrated ours.",0.9524
9,"As I am often reminded by my Liberal friends that Spain, Greece Italy etc had thriving economies before the financial crises. Of course debt sustained  economics works wonderfully well when no variables are introduced (econ 101). But in the real world it does not work that way. I sincerely believe that this was the Greek plan all along never to repay this debt. All of the theatrics and histrionics are for their own entertainment.  The PM will not resign, he is truly enjoying all the attention lavish upon him. It is also troubling to see all the comments against the lenders. It goes to show how the lack of personal responsibility and integrity has gone down to the individual level in our society as well.",0.949
10,"Paul - it may have escaped your attention that the growth projections underlying any IMF program assume that it is fully implemented. But the first Greek bailout, on which your chart is based, went off track within months of its approval in My 2010, with subsequent loss of confidence, deposit withdrawals, a credit crunch, political uncertainty, culminating in Grexit fears in mid-2012 when SYRIZA appeared likely to win the elections. Needless to say the growth-oriented structural reforms were never implemented. Blaming the Fund for all of the above ignores the elephant in the room and criticism in bad faith from someone who should know better. And, frankly, do you really believe that an adjustment program based ENTIRELY on new taxes, as proposed by Syriza, would promote growth?? Not even the Obama administration believes this.",0.9481
11,"Washington DC must take responsibility for the egregious government interference on the federal level that has resulted in the economic demise of a local economy. Suppression at its greatest, with a GDP that would make Puerto Rico #36 of 51 States (the economic size of Nebraska or Luxemburg) how as a American advocating freedom of liberty, life and the pursuit of happiness can we have allowed US Congress to have so much control and create an oppressive economic system over an autonomous State of the Union?<br/>Advocating Independence is not the Answer. the people of Puerto Rico have voted for statehood, give the island the same rights as experienced by other States in the Union. ",0.9413
12,"I don't get it.<br/>You are now a succesful writer, having fulfilled your life dream.<br/>Why don't you want to pay the loan that allowed you to become what you wanted to be? Too many accrued expenses and interest? I'm sure they, whoever the creditors are, would accept if you at least paid back the principal.<br/>Or do you feel like you are so important to humankind that normal laws and obligations don't apply to you?",0.9258
13,"The Greeks should leave the Euro and reissue the drachma.  That way the Greeks can continue to pay pensions to workers at age 55, provide free health care and not collect taxes from the rich and middle class.  Greece can become the true dream nation.",0.9231
14,"Yes, and they haven't gotten over it. That's why Pope John Paul II finally apologized for the sack of Constantinople in 2001 on his visit to Greece (<a href=""http://articles.latimes.com/2001/may/05/news/mn-59656)"" title=""http://articles.latimes.com/2001/may/05/news/mn-59656)"" target=""_blank"">http://articles.latimes.com/2001/may/05/news/mn-59656)</a>. That event led to the Turks conquest of the Greeks and indeed of all of southeast Europe. The great mass of Greeks eventually made their way back to the Greece of ancient times, but not in a good way. What has happened since it, well, history, including at least 9 sovereign debt defaults with the 10th coming our way. History has a long, long arm indeed.<br/><br/>I was reminded of this a few years ago when I was in Istanbul during a basketball world championship. I was walking through the lobby of my hotel during the game between Turkey and Greece. A group of Turks were sitting there watching the game with an incredible intensity. It was easy to see that it was much more than a game for these people and it is easy to imagine that people in Greece were watching the same game with the same level of intensity.",0.9192
15,"Economic growth, of course, necessarily entails the growth of debt.<br/><br/>Alas, when the consumer is tapped out, and when ""the economy"" is so fetishized that the bare idea of people having some savings, rather than a panoply of credit cards, is actually seen as a bad thing.<br/><br/>It isn't, of course, but neo-Keynesian thinking has surely sacrificed the individual to the state, and the state to the economy.<br/><br/>But first principles, alright?<br/><br/>The US government can not print its own money because it must borrow Federal Reserve Notes as a loan at interest from a cartel of private banks. <br/><br/>{the FOMC is ""public"" for some purposes, but the regional banks and their ownership is indisputiably regarded as non-public.  We can not as Americans find out who owns the banks that print our currency!!!}<br/><br/>Now, the matter of ""independence"" for an entity that pretends it can expel enough entropy to sensibly manage the aggregate ""economy"" is one thing.  I'm not addressing that, but I'll note the DOJ is subsumed under the executive and one is hard pressed to argue justice is less vital than monetary policy  [I hope].<br/><br/>No, first principles as to ""the economy"" - <br/><br/>If I have to borrow your ink and paper to conduct business, and I am charged interest payable in said ink and paper - where do I get the ink and paper to pay the interest?<br/><br/>Ah more debt!<br/><br/>Add to this fractional reserve lending and checkbook $ creation.<br/><br/>Now - remember your Laws of thermodynamics.<br/><br/>This, Sir, is what you are up against.",0.9134
16,"I'm surprised to read such ignorance from such a smart commenter. Credit Unions are covered by NCUA, which functions very similarly to the FDIC. Here's a link - read and enjoy! Your deposits are just as safe at a credit union as they are at a bank, and you're much less likely to be ripped off by a CU.<br/><a href=""http://www.ncua.gov/Pages/default.aspx"" title=""http://www.ncua.gov/Pages/default.aspx"" target=""_blank"">http://www.ncua.gov/Pages/default.aspx</a>",0.9134
17,"And I'm pretty sure that Germany and others is happy to oblige allowing Italy to join Greece out of the Eurozone.  That way it'll have a bankrupt, corrupt friend to play with.",0.9081
18,"The Greek/German ten-year spread began to widen before 2007 so your assertion that debt and spending levels were tame cannot be supported by market intelligence at the time.  The first trickles of capital flight by the bond vigilantes beginning in 2005 was a sure sign that Greece was in trouble even back then.  I agree that uniform monetary policy across 19 different fiscal territories can feel like a straitjacket to those subject to capital flight and like wings to those who enjoy the concurrent capital rush.  I also agree that this was completely predictable.  The Eurozone designers must have known this too, but that didn't prevent them from laying down the currency scheme anyways, because the riches earned by the beneficiaries of such currency schemes accrue no matter how long the scheme persists.",0.9054
19,"Greece already had a hair cut, and Greece' loans from the other Eurozone members are already restructured. The term was stretched to 30 years, and the interest is super low. Repayments will start only in 6 years. Of course there are other loans to pay, e.g. from the IMF. However, in average, Greece pays lower interest rates than even Germany.<br/><br/>In the proposal of the Eurozone members, which was rejected by Syriza and now the Greece people, lenders where offering additional restructuing in case Greece succeeds with some reforms.<br/><br/>Some reforms are needed in my oppinion because there is no reason why the other 18 Eurozone members (and the IMF) should spend additional billions for a dysfunctional state.<br/><br/>Germany has already lend 90 bln euros, which is as much as if USA would have lend 350 bln Dollars. From Greece perspective, the loans are more or less equal to a whole year GDP, which compares to 17 trillion dollars if we would talk about USA.<br/><br/>The Marshal plan so many people here are refering to (into the direction of Germans), which I highly admire, is a joke compared to this. (I like to remind the people that Greece also benefited from the Marshal plan, as almost all western European countries. And Greece is, unlike the Marshal plan, not forced to by the lender's industry products.)<br/><br/>This is not austerity. What we ask for is that Greece manages to become a functional state. Spending for economical growth cannot be started before that, because this money would just be wasted.",0.9008
20,"Oh Please! You confuse the Versailles agreement and the Marshall Plan. Marshall was a great general of WWII, and a great statesman afterwards. His post-WWII plan was the total opposite of the vengeful, excruciating deal done at Versailles. (Send a percentage of your tuition fees to charity in my name!)",0.8975
21,"Right, St. Germany.  I forgot.  It was Germany's job to make sure that banks that made bad loans at correspondingly high interest got absolutely secure return on investment - the kind that usually pays low interest - and who cares what happens to the Greek people?",0.8955
22,"If we're talking about respecting democracy, let's respect the democratic will of Latvians, Estonians or Slovakians too. Resistance to debt forgiveness for Greece does not come primarily from private investors (who already took a big loss in 2012) or the ""one percent"", but from internal political pressures in the rest of the Eurozone. Maybe people in these countries are selfish and myopic in supporting politicians who are asking for more spending cuts in Greece, or in wanting to get back the money they are owed---up to 4% of their GDP in some cases. But just as we should respect the Greeks' right to engage in a romantic act of self-destruction, we should respect the other Europeans' right to support selfish and myopic policies.",0.8802
23,"If we're talking about respecting democracy, let's respect the democratic will of Latvians, Estonians or Slovakians too. Resistance to debt forgiveness for Greece does not come primarily from private investors (who already took a big loss in 2012) or the ""one percent"", but from internal political pressures in the rest of the Eurozone. Maybe people in these countries are selfish and myopic in supporting politicians who are asking for more spending cuts in Greece, or in wanting to get back the money they are owed---up to 4% of their GDP in some cases. But just as we should respect the Greeks' right to engage in a romantic act of self-destruction, we should respect the other Europeans' right to support selfish and myopic policies.",0.8802
24,"Yes, it is easier to inflate a currency and reduce the exchange rate than it is to deflate government spending (and wages).  Furthermore, it is true the effect of deflation is a reduction of government revenue and a relative increase in external debt.<br/><br/>What is missing from this generality is that the Greeks, in order to have ""flexibility"" in inflating their currency would have to step outside the Euro and the EU (something about 3/4th of the Greeks don't want to do).  I predict that the result of Greece introducing a new currency will be hyperinflation, or at the minimum high inflation.<br/><br/>What Krugman is urging is high inflation plus bankrupting the country (making them an international credit pariah), instead of continuing the austerity program inside the Euro/EU (3/4ths of Greeks say they want to stay inside the Euro/EU).  I might add this new policy will follow years of austerity that has brought on a contraction of the Greek economy equivalent to the US Great Depression.",0.8737
25,"I know at this point that the NY Times is completely lost on the topic of Greece, but just for the record I'll try anyways.<br/>THIS is NOT what happened: ""Austerity was the price to be paid for keeping the monetary stability created by the euro currency.""<br/>Rather, what happened was that the EU tried to use the crisis to force Greece to reform its corrupt and inefficient ways, things like people retiring at 55, tax evasion as a national sport, 400 cleaning ladies for the finance ministry alone, the largest military per capita in all of NATO, an absurdly inefficient bureaucracy, and all of it financed by misdirected EU infrastructure funding and fraudulently obtained loans, billions and billions. The idea was that only under intense pressure could those ways be changed, even if some of the reforms would manifest as something looking like austerity.<br/>Of course Greece did what it does best, faking most of the reforms, carrying out only the easy ones that would hurt only the little people, while taking the additional money, again billions and billions.<br/>Nevertheless the Greek economy actually was improving -- until January, when Syriza came to power, which is clearly led by a bunch of complete sociopaths and habitual liars.<br/>Keynes' method only works if a country actually has a working economy and administration. And devaluation of currency can indeed boost a country's trade -- but only if you actually have something to trade. Not the case for Greece on both counts. ",0.8706
26,"Remembering Keynes<br/><br/>The Greeks should (re) adopt the Drachma then get busy being VERY IRRESPONSIBLE by putting everyone who needs help on social support (of course with a sunset to the policy) such that a massive economic stimulus takes place.<br/><br/>Banks should accept Euro deposits but only provide Drachma withdrawals.  There will be some short term Euro hoarding, and all the crooks who can leave town with cash will certainly do so.  But regular Greeks can eat, pay their utilities, buy clothing, put fuel in vehicles, dine out once in awhile. See a movie!<br/><br/>I kind of favor the ""workfare"" approach; students get paid to go to school.  Housewives get paid to keep house.  I suspect that a number of business incubators and loans to private businesses could make sense.  Greece should spend a lot of Drachmas to refresh and protect their national assets.  They should build some infrastructure projects.  They should have one group bury bags of Drachmas and have other groups dig them up.  Wait a minute...",0.8665
27,"Sorry, you can't compare reparations with bonds. In the case of Greece it is not a case of punishing them but of lending them even more money if they show the willingness to reform their profligate ways. Willingness which, the referendum shows, they clearly do not have.",0.8645
28,"Among other things, a strong dollar is tied to what international financial markets deem to be the credit worthiness of the government that issues the currency, and the debt obligations issued by that government.<br/><br/>Anybody remember a certain group of Tea Party Republicans that thought it would be a great idea to default on US government obligations?  The same crew that was regularly threatening to ""shut down government"". Somebody ask Chris Christie how much his multiple state debt downgrades has cost, and will cost, the State of New Jersey. One of these days these fools will get a Republican President to go with their Republican Congress and Supreme Court. Then we'll see how much the rest of the world likes the dollar. About as much as they like NJ state debt obligations.",0.8625
29,"As many people have pointed out, Germany has had the huge benefit of debt relief in the past, and they should extend the same kindness to Greece today.",0.8625
30,"Would it be much simpler to revise the interest rates on college loans to better reflect today's low interest environment. Tie it to the rates banks pay to borrow from the Fed, for example, or perhaps the prevailing rate on a 30 year mortgage.<br/><br/>Seven to eight percent interest today is close to being usurious outside the payday loan industry.",0.8555
31,"Metrojournalist:<br/><br/>Oh, of course, it is always the banksters' fault.<br/><br/>It isn't the fault of ordinary Greeks (the great majority) who don't pay their taxes.<br/><br/>It isn't the fault of ordinary Greeks who retire on public pensions in their fifties.<br/><br/>It isn't the fault of Greeks who have repeatedly elected corrupt politicians who have grossly mismanaged the Greek economy.",0.8508
