,comments,scores
139,Totally Greece received 332 bill euro by public organisations which is 185 % of BIP or 36 time the Marshallplan (related assistance loans to BIP). Greece is a bottomless pit without resilient governmental structures.,0.0
140,What about the billions Greece owes Turkey for its 1920 (failed) invasion? ,0.0
141,"What we aren't being told about the situation in Greece and how it all came about:<br/><a href=""http://www.nationofchange.org/2015/07/05/greece-what-you-are-not-being-told-by-the-media/"" title=""http://www.nationofchange.org/2015/07/05/greece-what-you-are-not-being-told-by-the-media/"" target=""_blank"">http://www.nationofchange.org/2015/07/05/greece-what-you-are-not-being-t...</a>",0.0
142,"Where does El Chapo keep his billions?  Why, in chartered, regulated banks, of course.  With deposit insurance.",0.0
143,"Hmmm, I thought Goldman Sachs was a US firm.",0.0
144,The Eurozone is not synonymous with the EU!,0.0
145,"Nobody is forcing you to take their loans, you know. Vampires? Just simply walk away, then...",0.0
146,Tax evasion has been the national sport in the Mediterranean countries since long before the creation of the Euro. Currency union without fiscal union makes no sense at all.,-0.0258
147,"I wonder when the citizens of the European Union will wake up to the fact that over a period of years no attempt has been made by Angela Merkel and the IMF to bail out Greece. The real goal of the forced bailouts was to transfer Greek Debt from the Banks to the taxpayers of EU countries, and it has worked. The downside of course is that now all of the citizens of Europe are on the hook for debt which Greece can never pay back, and of course said debt has grown dramatically, while the banks saved themselves.<br/><br/>It doesn't matter in the least to Europe if Greece votes yes or no on the referendum because Greece is now as broke as Puertorico. It should matter to the citizens of the European Nations, that although Greece will be the first to leave, it may not be the last.<br/><br/>Currency Union without political Union was a hairbrained scheme, which only a team of Saints could have pulled off. These taxpayers of Europe, when they do wake up, will as their first conscious act want to punish Greece, then it will probably be just a matter of time before they recognize the anti democratic nature of the beast which is the Troika, and conclude that this is not what they bargained for when they surrendered their national currencies to Brussels.<br/><br/>Angela Merkel and the IMF may have been a tad short sighted in their handling of Greece, but bankers count for a lot more than people in the grand scheme of things. It's just that the hoi polloi aren't supposed to recognize the true nature of the game.",-0.042
148,"Margaret Thatcher predicted this disaster -- in 1992.  This from a Forbes magazine interview with her:<br/><br/>But, in a scathing tone, Lady Thatcher insisted to me that a single currency was impossible. It would never work. “Every single fixed exchange rate has cracked in the end. We’re all at different levels of development of our economies. Some countries simply couldn’t live up to a single currency… We should each of us be proud to be separate countries cooperating together.”<br/><br/><a href=""http://www.forbes.com/sites/robertlenzner/2013/04/08/margaret-thatcher-predicted-the-failure-of-the-euro-in-forbes-october-1992/"" title=""http://www.forbes.com/sites/robertlenzner/2013/04/08/margaret-thatcher-predicted-the-failure-of-the-euro-in-forbes-october-1992/"" target=""_blank"">http://www.forbes.com/sites/robertlenzner/2013/04/08/margaret-thatcher-p...</a><br/><br/>I'm sure there is more calamity to come, when Italy or Spain face skepticism over their ability to repay their debts.  Good that the UK stayed out of this train wreck.    ",-0.0451
149,"Could you please comment on De Grauwe's piece in VoxEU - that Greece's problem is not solvency but illiquidity. Seems to cal for mainly the removal of austerity. Here is the link<br/><a href=""http://www.voxeu.org/article/greece-solvent-illiquid-policy-implications"" title=""http://www.voxeu.org/article/greece-solvent-illiquid-policy-implications"" target=""_blank"">http://www.voxeu.org/article/greece-solvent-illiquid-policy-implications</a>",-0.0516
150,"As I've said before, this is silly.  Do grown men and women really think Greece isn't going to default and leave the Euro?  Kick that can down the road all you want.  Kick it for as long as your populace will pay the freight.  Greece is leaving the Euro.",-0.0516
151,"To be fair, it is a bit different in terms of leverage.  The holder of your mortgage can foreclose on your house.  What can the holders of the greek debt take?",-0.0516
152,"The only Government of a developed Western nation that has behaved in a more irresponsible way than the this Government in Greece, which is putting their left wing politics, ahead of the good of the  country is the Obama regime.",-0.0754
153,"The ""Germans"" (which I now understand includes a lot more people than just those who live in Germany) are routinely condemned for being hard-nosed and heartless.<br/><br/>Well, those ""Germans"" have let Greece run up a tab of 300 billion Euros, lending Greece more and more money in return for promises that are never kept. If that's ""hard-nosed and heartless,"" one wonders what it means to be soft.",-0.0772
154,"Uh, no, what he said was that the euro and austerity policies that went too far helped turn a moderate, manageable set of screwups into pretty much an absolute disaster.<br/><br/>Oh, and this you could see coming, which didn't stop the smart guys from changing course.",-0.0951
155,yes- The Clinton Foundation should pay the tuition of all students who are citizens. Then the problem is solved. No government  action necessary except to go after those who have not repaid their loans.,-0.128
156,"These analogies to Germany make no sense.<br/><br/>Germany was a defeated country. It was in position to dictate anything. It was relatively easy to establish order at the same time as granting debt relief.<br/><br/>Is anyone suggesting that the EU take over Greece? The debt relief part is pretty easy. How do you demand a democratic country change their ways? If you do, doesn't think sound like the current ""austerity"" mess?",-0.1406
157,"More particularly, looking at Greece's situation through the distorting lens you provide leads to confusion, rather than clarity.<br/><br/>""the profligate state bankrupted Greek banks""<br/><br/>Um... actually, Greek banks were preyed upon by too big to fall banking groups from the largest EU economies. These banks, and the Greek banks themselves, wilfully ignored Greek sovereign debt risk in buying Greek financial assets, from banks to bonds.<br/>Why did this happen? Because fig leaf bond ratings issued by the major agencies (S&amp;P, Moody's, etc.) conveniently assumed there was little difference in risk in those assets compared to the major European economies until reality smacked them in the face, while the potential rewards of going along with the charade were irresistible to banking executives in the form of performance bonuses... And that's without even discussing Greece's fraudelent accession to the euro itself, aided and abetted by the finest snake oil salesmen Wall Street could muster (find the names for yourself, it's public record) to paper over the gaping holes in Greece's submission for the benefit of equally self serving EU technocrats from the same EU countries who fed off Greece's easy money spending frenzy.<br/>Sound familiar? Just don't call them ""banksters"", that would mean there's a problem that needs dealing with...",-0.1431
158,OOPS! Thought I was on the Greece page.  Sorry.,-0.1511
159,"I don't like the sound that the U.S. government needs to help Puerto Rico here. I'm holding onto my wallet a little tighter. They got themselves into this mess, let them get themselves out of it, but not with my tax dollars.",-0.1637
160,"One might also ask why Greek pensioners (not all recipients of patronage) should subsidize German and French banks, which made a killing from loans to Greece, knowing full well the risk, but also certain, in event of default, they would be repaid out of public coffers, that is, they could socialize their losses, which in fact they did.",-0.2263
161,"It's amazing to see how Dr. Krugman absolves Greece of all sins and places all blame on her lenders. So working hard and living within your means (austerity) is a crime but profligate spending and tax evasion should be rewarded? Afterall, no one forced Greece to join the Euro.",-0.2357
162,"Paul Muller-Reed:   Are you tired of reading in The NYTimes about the vast corruption, tax evasion, no show jobs, obsolete rules to start businesses, and yes, early retirement at 50 for hairdressers because they had to stand on their feet all day? All of this has been written in the Times. Greece has to accept their responsibility in this in able to go forward.",-0.25
163,"You mean like the French and German banks that got bailed out on bad private loans made to Greece by the ECB instead of taking their lumps? And then the burden gets handed to the Greek taxpayers in general, _who were not the people those loans were made to._<br/><br/>Sounds like Northern Europeans like handing over the burden just fine. ",-0.25
164,"From the article:<br/><br/>""Finance Minister Yanis Varoufakis of Greece said on Thursday that he would resign immediately if Greeks [vote ""yes"" in the referendum]...""<br/><br/>As Dr. Pangloss might say to Candide, this is yet more evidence that we live in the best of all possible worlds:<br/><br/>1. If the Greeks vote ""yes,"" the EU gets rid of Varoufakis (and Tsipras).<br/><br/>2. If the Greeks vote ""no,"" the EU gets rid of Varoufakis (and Tsipras) and Greece.<br/><br/>So either way, we get rid of Varoufakis (and Tsipras) – it's a ""no lose"" referendum.",-0.2732
165,"Germany 55 years ago was a very different country from what it is today (and arguably a very different country from the little that you saw and experienced). In terms of social justice and civil rights, it has changed much more radically and extensively than any other country, including the U.S. I doubt that dating a few German women (how many could you possibly have dated?) and having ""conversational"" German can give anyone insight into the mind of an entire people, let alone make predictions as to its actions 60 or more years down the road. ",-0.2732
166,"""A Greek exit would also do untold damage to the credibility of the euro""<br/><br/>The NYT keeps repeating this absurd notion, when nothing could be further from the truth.<br/><br/>In fact, the more that Greece suffers (specially if it leaves the Euro) the stronger the Euro will be. Greece will be exhibit one that if you don't play by the rules you face horrendous consequences. That is a huge incentive for all the other 18 Eurozone countries to follow the rules and keeps debts under control.<br/><br/>The best thing for the Eurozone to do is to divert any money that was going to go to aid Greece and pump them into Portugal, Spain, Ireland - the countries that followed the rules.<br/><br/>Greece made its choice to support a lunatic leftist government. Let them live with their choices. Let Greece sink or swim with their choices, while the Eurozone supports the countries that want to follow the rules.<br/><br/>The absurd position of the NYT that this weakens the Euro notwithstanding.",-0.2789
167,"Argentines lost about a third of their money's worth when the currency board was abolished.<br/><br/>In general, people in countries that don't use international reserve currencies know that they are at risk of capital losses from their currencies' instability and are prepared to reduce their exposure by moving deposits and switching out of the local currency.  (This adds to the currencies' instability, but what can you do?)",-0.2846
168,"It's reassuring (not) to know that things hinge on ""how expendable Greece ... is seen to be.""  It makes the talk about feeling carpet bombed with threats, in the run-up to the referendum, more understandable, at least to me.  <br/><br/>I am also reminded of stories I've read about college kids who run up too much debt.  While Greek leaders are not college kids, we do know that the purveyors of easy money are not choir boys.  And we also know, it seems to me, that once bad decisions have been made, there's a point after which sticking to the original deal is not constructive for anybody -- isn't that the point of bankruptcy proceedings?  This may be my own ignorance, but I don't understand why some kinds of indebtedness are thought to be different in a way that means the debt cannot be restructured -- why is their dynamic different and not acknowledged to be subject to the same realities?",-0.2869
169,No loan payments for 30 years. The reductio ad absurdum applied to economics. You can't make this stuff up.,-0.296
170,"Glad to see Krugman agrees with me. It's past time the creditors shaved their heads by writing off the bad debt and the ECB re-capitalized Greece. Oh, wait, the EU can't actually do that. Snort.   Meanwhile here at home it appears the Federal Reserve et al have decided to let Puerto Rico go bust. Can they do that?",-0.296
171,No loan payments for 30 years. The reductio ad absurdum applied to economics. You can't make this stuff up.,-0.296
172,"You are reciting a baseless myth that is widely propagated.  The reason why this myth continues to grow is because it pits little David (Greece) against Goliath (Germany) and who would not root for the underdog.  Unfortunately, that picture is seriously flawed and the myth does not help the Greeks.  Germany and the other EU countries want nothing more than to help Greece, it's the Greek who won't let them.<br/>Listen to Stefan Richter on the Diane Rehm Show yesterday, he does a great job of explaining what's really going on.",-0.2996
173,"Dear Mr Cohen,<br/>It is not true that the Greeks desperately need those 8 billions. Now that they are in primary surplus (or at least were a few months ago, and would be again if the situation clarifies), the only reason they need these 8 billions is  to be not officially considered defaulting. If the 8 billions are paid by the FMI and EU, they won't go to Greece, they will go directly to Greeks' creditors, i.e. basically the same FMI and EU, together with whatever primary surplus the Greece can make.  As several readers have already said, you should read the columns of your colleague Krugman on this. ",-0.3252
174,"From what my contacts in those countries tell me, the people of Ireland, Portugal, and Italy would beg to differ; they are not doing as well as the propaganda pushed by the creditors would have you believe. The 'austerity forever' bloc simply needed a contrvied 'success story' or two to prove their failed economic policies. ",-0.343
175,"Thank you, Susanna666<br/>I am Swiss and live in Basel, on the border to Germany, and watch the news also on German TV. 70 years ago all concentration camps were liberated and closed. As there was not just Auschwitz, but smaller camps in and outside Germany, the President of Germany has had a busy and not easy time, attending all the remembrance occasions, trying not to repeat himself when speaking of the unspeakable. Now has started a search for locations in and outside Germany where Jews were murdered without a camp. I fear President Gauck will be even more busy when the list is completed. Hopefully he will be able to concentrate on German locations and TV will not have to report each time.",-0.3542
176,"Citixen:<br/><br/>Get real. Can't you imagine the boos and catcalls (probably some from you) if Germany started talking about the need to federalize Europe? Think of the motives that would be imputed to it!<br/><br/>No, there is no alternative to Greece taking charge of its destiny. ",-0.3595
177,Too much debt from overspending.,-0.3612
178,"If the Ex-Im bank is indeed important to Boeing, why does it continue to expand in South Carolina, a state overrun with the right wing crazies who are seeking to kill the Ex-Im bank?",-0.3818
179,"Tsipras and his government have been arrogant, shallow and small-minded. Samaras did not enact a single reform required by the sequential bail-out packages his government received. Greece has zero credibility toward Europe and -after the referendum debacle- even less good will.<br/>But Europe has made many mistakes over the last years including a total disregard for the fate of Greece's vulnerable populations, youth and pensioners, and expecting Greece to repay a staggering debt that -even with the strictest reforms- will take multiple years struggling the all-but-destroyed Greek economy.<br/>It takes two to tango.<br/><br/>George Seferis wrote ""wherever I travel, Greece wounds me"". As an Greek expat, I have felt the truth of these words time and time again. But now, it is not only Greece in freefall, but the dream of a united, unified, Europe is no longer relevant. The fate of my country is dark but the future of the European Union is even darker. For me, and for those of us who aspired to one Europe, that is the bitterest pill.",-0.4012
180,Haven't the Germans historically been the problem,-0.4019
181,"""help is available""  You obviously don't get the fact that the ""bailout"" funds being negotiated would simply be returned to the institutional creditors. I'll leave your callous disregard for the unnecessary suffering and impoverishment of ordinary Greeks out of this.",-0.4019
182,"Several weeks ago you suggested that Greece should be forgiven a lot of its debt like other European countries were after the war.  However,  those countries debts were not the result of prolifigate spending and irresponsible governing.  Perhaps debt should be forgiven but the differences should be explained.   That's my opinion!",-0.4295
183,Perhaps we can learn something from Greece.  We are also a country that spends more than it takes in although we still able to borrow and pay our existing debt service fees.<br/><br/>John,-0.4404
184,"Haven't we learned from the Financial Crisis that debt is not good???<br/><br/>Congress should not allow Puerto Rico to issue any more debt !<br/><br/>Puerto Rico must run a balanced budget.<br/><br/>The same is true for Illinois, Chicago &amp; the United States.<br/><br/>Governments love borrowing money &amp; spending it to get reelected.<br/><br/>This has to stop.",-0.4585
185,"It is obvious, to anyone reading your comment, that you are unaware that the creditors have stopped financing the 'standard of living' in Greece since 2012. Since then, the creditors have been helping Greece to serve it's unsustainable debt",-0.4588
186,"Is Mr. Krugman following these comments?  I wanted to pose a question.<br/><br/>What is stopping Greece from just printing more Euro's?   They have the plates. Sure it would be illegal, but how they stop it other than by bombing the Treasury? ",-0.4749
187,Germany should give Greece a Marshall Plan.  Instead Germany insists upon treating Greece as badly as France and Britain treated Germany at Versailles.,-0.4767
188,Let's remember that the vast majority of the funds that the EU has provided to Greece so far have not gone to the Greek people.  The funds have gone to bail out the German and French banks.<br/><br/>The EU should be ashamed.,-0.4767
189,"Why do you still want to be a colony? Is something that I don't get. Puerto Rico is the only place where ""freedom"" it's a bad word.",-0.4939
190,"The Marshall Plan was a plan to benefit all of Europe and the United States as well, since a decrepit Europe could not buy any American goods. The financial aspects of the Marshall Plan were great for all countries which participated in it (i.e. all non-Eastern European countries), and Germany received but a fraction of the money. <br/><br/>Today, adjusted to today's money, Greece has already received the Marshall Plan's money several times over. In other words, none of your factual statements hold up.<br/><br/>Still, I agree with ""Germany's debt to Europe can never be repaid"", as long as it is understood in a historical and moral sense. As a legal concept it is nonsense, since there are no outstanding reparations today. That ended long ago. As a political concept it would be even worse. If it means that Germany alone among all other nations can never pursue any national interests, it would be an assured way for making the EU anathema in Germany. Fortunately, nobody in his right mind among the European political leaders demands such a suicidal ongoing political capitulation. <br/><br/>The Euro-zone has 19 sovereign members. Germany is neither the ""ruler"" of that group nor its ""servant"", but rather one of 19 members. That is the only way it might function in the end.",-0.5023
191,"Interesting analogy, but you get the Lehman story wrong. Lehman was the culmination of a long malaise (see <a href=""http://wp.me/p5zzQG-1k"" title=""http://wp.me/p5zzQG-1k"" target=""_blank"">http://wp.me/p5zzQG-1k</a> ), which makes it an apt analogy to Greece. Greece is a symptom of the dysfunctional Euro, much as Lehman was the symptom  of a dysfunctional financial system.",-0.5106
192,"As Mr. Harddouvelis accurately says: “Domestically, reforms that seek to level the playing field, minimize bureaucracy, fight oligopolies and give more power to the people are badly needed.” I do not consider any of these reforms “austerity”, and Greece’s principal creditor nations resent the Greeks’ unwillingness to implement these and other sensible reforms such as adjusting the age of retirement for public sector employees &amp; lowering pension payments for early retirement individuals more in line with the levels in place in most of the rest of Europe.<br/><br/>Until which ever government is representing the Greek people accept these reforms it is going to be very difficult for the leaders of the more prosperous EU countries to ask their taxpayers to sacrifice more to bail out a country which is viewed as not having made a sufficient effort to bring its economy into the 21st century.",-0.5423
193,Maybe Germany could pay the cost of WWII to the rest of Europe including Greece. What's up with setting up a repayment program everyone knows can't work and then blaming the Greeks for it. And what's up with the US financial press making all sorts of misrepresentations?,-0.5574
194,Perhaps that would keep him from going bankrupt and stiffing his creditors again.,-0.5574
195,"Gee - you'd think the French and German banks that lent Greece all that money knew it, though, wouldn't you?  So - maybe they knew this borrower was a poor credit risk, and knew they might lose the principal.  Oh, that's right, only silly normal businesses bear the risk of bad decisions; banks can have their governments act as collection agents for them.  Sweet!  (well, not for the Greeks, but whatever).",-0.5707
196,"The problem seems to be more complex than the European nations can solve. For example, what happens if Greece accepts the austerity measures - cuts to retirees' pensions and higher taxes on citizens -- and stays in the Euro? We've already seen this: the Greek economy will continue to struggle until it hits another Euro deadline, which it will miss. At this stage, it seems that Greece has two options: continue the Euro with a much better form of debt forgiveness designed to get the Greek people to grow their economy or leave the Euro, struggle for several years as a currency gets off the ground and then start to control its future. <br/><br/>But they can't keep doing the same thing and expecting a different result.  ",-0.5719
197,"Stop servicing the debt owned by the Chinese, that will wake them up.",-0.5719
198,"That's probably the worst case scenario for Greece.  Grexit followed by some bad deals with Russia followed by unrest followed by suspended democracy.  It probably won't get there but it's a worry.  <br/><br/>Tsipras is good at channelling the emotions of the people, but when it comes to rescuing a insolvent banking system and negotiating a currency transition, I would rather someone more competent were in charge.  On the other hand the referendum results showed that he has his people behind him.  ""democracy is the worst form of government....""",-0.5873
199,"If the Greeks showed any signs of acknowledging the responsibility they bear for getting themselves in this mess, any sign of willingness to reform without being absolutely forced to it, there might be some basis for continuing negotiations. But from what I've read, there's not. There's only a sense of victimhood. It seems the Greeks just have a different attitude towards debt than most other developed nations. If Greece stays in the eurozone, it would be a constant apple of discord, as it has been ever since it joined the EU. A clean divorce would be painful, but ultimately the best thing for all concerned. ",-0.5912
200,I can't help but wonder what the Big Bank Theory is AS OF Monday when Puerto Rico defaulted on a 58 million dollar debt responsibility.,-0.5966
201,Greece will be the first country to exit the Euro and return to it's own sovereign currency.  It will be messy but the people will be better in the long run.  After all the problem in Greece boils down to insufficient funds.  If Greece still had it's own currency they could simply ramp up their money supply and their problem would be inflation rather than insolvency. ,-0.6124
