,comments,scores
202,"and to illustrate again the major contemporary problem for economists in Europe lets quote the highest recommended comment on the NYT threat about the last ultimatum of the 18 European States. - Mike from Little Falls, New York writes:<br/>'I got to think this morning how the American taxpayer might feel at subsidizing the social welfare programs of an intransigent foreign country, say, Mexico. So much of the commentary from the proletariat the last few days has been in support of the Greek worker and highly critical - sometimes offensively so - of the Germans. I wonder if any of the commentators would feel differently if it were their money going to Greece. <br/><br/>Yesterday I pointed out to an acquaintance that the European taxpayer had loaned the Greeks $250,000,000,000, thinking the amount might create a realization of just how generous they had been. Instead the person replied, ""by my calculations that's only $500 per inhabitant of the European Union."" So I guess for some people it's OK for the Greeks to steal $500 from every man, woman and child on the continent. <br/><br/>I personally find their lack of willingness to make the changes every reasonable person agrees they need to make - liberalizing their labor market, collecting taxes and not retiring in their 50's - offensive to the people that have been trying to help them. Fully 60% of the Greek GDP comes from the government. Until that changes, nothing matters.'<br/><br/>Agreed - nothing matters until this type of Inequality isn't fixed!",-0.6201
203,"@Scott Holman said:<br/>"" I don't know how to go about lying about banking matters, but apparently, someone in Greece did.""<br/><br/>Actually, it was someone, or several someone's, in Berlin and Munich, and Brussels, and Paris, and New York (Goldman Sachs) who did.  He connivance of the banking and political elite of the EU in falsifying the books to ensure that Greece was in was one of the reasons the current creditors bailed-out the private lenders in the first place.<br/><br/>The Greek establishment weren't the only conspirators.  Their allies in the rest of Europe helped.  Now that the Greeks have thrown off their pals for an outsider reform government, only the creditor side of the table still has institutions with responsibility for that fraud.",-0.6249
204,"How about Tsipras, Varoufakis and the other clowns all resign immediately? Greece needs to grow up. These guys are part of the problem.",-0.6249
205,Marshall plans are for countries that have been destroyed economically.  Who destroyed Greece...Socialists and their redistribution theories that don't offer to incentives to work and save?,-0.6324
206,"and let me last not least word my absolut objection about this one;<br/><br/>'Forcing Greece and Germany to coexist in a currency union will always be an exercise in smoke and mirrors. Their economies are mismatched, their temperaments even more so.'<br/><br/>Is it really more 'mismatched' as forcing Texans and New Yorkers in a currency union?<br/>Or as many different cultures and races the US tries to 'force' to live together?<br/><br/>NO - it isn't and why - of all people is it so difficult for Americans to understand that if a continent strives for peaceful unity after centuries of wars and divison - it should be possible?",-0.6347
207,"'I don't know how you stomach some of these comments, Krugman.'<br/><br/>Ja - especially all these comments about Germanys dominiation of the Eurozone.<br/>Which beckons the ironic question: Would the Eurozone be in chaos if it would be dominated by Germany?",-0.6369
208,The problem is that even with total debt write off Greece is not able to survive without new funds (loans). And who is going to lend them? Why is German taxpayer obligated to finance Greek's retairee at 50 while he has to work until 65.,-0.6369
209,"Maybe the test will come when (and if) the economy ever gets back to what we used to think of as ""normal"".  Will Prof. Krugman then advocate a paydown of some of the enormous debt incurred since Mr. Obama took office?  My understanding of the argument is that debt should be incurred to support a strong fiscal policy during recessions, and paid down during subsequent recoveries. (The trillions in debt incurred since 2009 amount to fiscal policy whether or not called by that name.) if we do get to a real recovery it will be interesting to see if Krugman columns go against the Democratic grain and argue for some degree of debt paydown.  If not, then perhaps Noah Smith will be proved right.",-0.6369
210,"@Nathan - it is true but it is also a stalled argument. Before the referendum stunt, a lot of people, myself included, is sympathetic. But now PM Tsipras is painting Greece in the corner, whose side is he on anyway?<br/><br/>Incidentally, Germany war debt was reparation but Greece is attempting to borrow for the third time. So, if your nephew asks you for the third time for a loan but refuses to turn around his life, would you still do it? Perhaps the nephew doesn't mind but the rest of the family surely will have a different opinion. ",-0.6381
211,"It's starting to look like the creditors don't care about the debt repayment,  They only care about exerting political control over the Euro members.",-0.6435
212,Why don't they take all the money they have and sell short Greece.There is an ETF for that. They will make enough money to pay back their debt by betting against Greek debt. ,-0.6597
213,"Ireland and Portugal took similarly painful austerity measures insisted upon by European lenders and have now prevailed over the medium term.  Benefits were cut, pensions modified and the labor force was disrupted.  Whey did it work for them?  They accepted accountability for the circumstance in which they found themselves.  They took the medicine.  The culture of ""your fault, not mine"" has become pervasive as people perceive themselves to be scapegoats.",-0.6597
214,"In europe we have two political directions,<br/>one is anti-austerity,<br/>and the other one is 'we don't pay for the messy or spendthrifty countries'.<br/>Maybe Krugman doesn't realize that the second direction isn't just germany, it includes britain (also not in the euro, still an important net payer to the EU), finland, france (if le Pen will gain momentum), the baltics, netherlands and more.<br/>Many of the second party do believe, that greece wants others to pay for very generous benefits, and to dress up their inability to collect taxes.<br/>Next year we will have a referendum in Britain, it doesn't take a lot to make them turn against the EU, and it would be a much more devasting blow to the EU than losing just Greece. And make no mistake about France, Front Nationale is on the rise.<br/>We are not the US, we are still a bunch of nations competing for our individual electorate. Austerity isn't just an economic concept, it is also avoiding a moral hazard, it keeps the right of the center countries in. It is very dangerous to divide europe up into taking and giving nations. I wonder what Krugman will say if the referendum in britain turns out negative, or Marie Le Pen wins the next election, if he still will blame the creditor nations for being selfish. ",-0.663
215,"Let's not forget the Greek Nation's complicity in its economic mess...poor tax collection, out of control black market economy, bloated bureaucracy with mismanaged pension obligations, among other things. 6 years of austerity does not make up for the decades of economic irresponsibility. And let's not forget the impact on our global economy from this default. I'm no fan of predatory lenders, we had plenty in the US who contributed to our recent housing crisis.  Greeks come to this juncture with ""unclean hands"", they protest but are equally to blame.",-0.6634
216,"No one forced the Greeks to enter the EU.  If you join for the benefits, you must also plan for the negatives.  This notion of responsibility gets lost on PK who appears to always think that more debt is the answer to overspending.",-0.6697
217,"When you cede much of your national sovereignty and control of your economy to a central bank, you run the risk that this central bank will then proceed on disastrous economic policies. The German administration seems to have decided that reducing spending will cure all ills (rather like a certain American political party). Time and again we see politicians ignoring basic Keynesian economic principles; and time and again the people pay for their allegiance to an ideology over the facts.",-0.6705
218,"""Germany’s debt to Europe can never be repaid. It is the real and deepest one.""<br/>I know you're talking about the war crimes of the Third Reich. But in the present day context, it's also worth remembering that Germany has had its financial debt forgiven, or not paid through one means or another, repeatedly. All the talk about the word debt meaning guilt in German fails to mention that when it is convenient Germans are quite comfortable having their debt forgiven. Just as they are reluctant to forgive Greek debt, even when it cannot be paid, and their refusal to forgive means the end of the ongoing European project.",-0.6918
219,"Why do we hear only stark alternatives for the Greek people – either draconian, punishing austerity that kneecaps the economy and ensures perpetual penury, or profligacy uncontrolled without end?<br/><br/>I've come to the sad conclusion that my fellow human beings, including readers of this paper, want only red meat thrown at them, simple, stark answers that let them vent their spleen at someone or something – at the evil, greedy ""banksters,"" for example, or the profligate, corrupt Greeks. No comment posted here will get their attention unless it draws blood. <br/><br/>Extreme austerity has not worked for Greece. That should come as no surprise. We all know, or should know, that when an economy is down, and demand is slack, austerity will only make matters worse, and lead to depression. That has happened in Greece. The human toll, cited by other readers, is shocking.<br/><br/>Reportedly, some reforms have been made, and more are possible, but not without hope. The Greeks need to see some improvement in their economy, some light at the end of the tunnel, some sense, most importantly, of being in control of their own lives. <br/><br/>This can be achieved by a middle course, by combining growth initiatives with continued budget reform. For example, infrastructure development grants could be matched to step-by-step, budget reductions. But the unelected ""Troika,"" and their banker clients won't hear of anything but draconian, futile austerity. The Calvinist mindset wants punishment.",-0.6956
220,"Unfortunately, i fear a deal may still be reached and more European taxpayer money will be thrown down a pit at Greece. Never underestimate the spinelessness of French and Italian politicians. They will not want to have to explain to their constituents how they lost hundreds of billions of euros from a Greek default. Together France and Italy have a larger economy than Germany so they may try to force something through and cave to the Greeks. ",-0.7035
221,"Back in 2010 or so the expression ""PIIGS"" was used often. It means ""Portugal, Ireland, Italy, Greece, Spain"". All of these countries got help from the EU/ECB/EZ/IMF under harsh austerity conditions. As far as I know it worked for every country - except Greece.<br/><br/>None of them is an economic powerhouse right now, but quite frankly none of them were to begin with. Why was every other country capable of recovery, of reform, of getting their house in order, but not Greece? I believe it was the will of the people in power and the shame of having to take help from other countries.<br/><br/>Sure, there are still problems in the ""PIIGS-minus-Greece"" countries, but now they are structurally sound and the remaining problems are being attacked. But not in Greece. They have taken money, more money, a lot more money and done nothing, zip, zilch, zero in return. And if they get more money now they will _know_ their ""special way of doing business"" works. And then all the others will know. And then Europe is finished...",-0.705
222,"Kudos to the Supremes for failing to trigger bureaucratic chaos and financial distress for the hapless victims of America's incomprehensibly complex and expensive health insurance system.<br/>That said, nothing happened...<br/>When nothing happens and people make a big deal about it, I generally start looking around in case something actually is happening beyond the limelight.<br/>And, surprise, surprise...<br/>Quite a lot is happening:<br/>The stock market is getting heavy due to the weight of global long bond interest rates that are creeping steadily higher.<br/>Inflation is heating up.<br/>Growth has turned negative.<br/>Congress has just shafted the American worker, again, with a new trade bill.<br/>America is complicit with the IMF bailing out of an insolvent Ukraine even as it refuses to give similar succor to Greece.<br/>Indeed, there's quite a lot happening.<br/>Nothing happened with ACA, though, and that is excellent news.<br/>I am *so* tired of filling out government forms.",-0.7096
223,"The response was typical of what one expects from the Left: deny any responsibility, shift the blame to others, and refuse to make any detailed proposals or concrete concessions",-0.7184
224,"You can't restructure when there is no money to pay back the loan. ""Restructure"" is just a word used to delay the inevitable - a BAILOUT.  Do the math.",-0.7213
225,"""Let Greece fail"" ?   Greece has already failed.  Several times, recently.  But the EU has shown itself to be partial to failure, and dedicated to the furtherance of greater failure.  ",-0.7227
226,"Interesting how many new analyses are discovering that the deal forced on Greece is self defeating, that Greece has no chance of paying its debt and that its economy is only going to worsen. The danger is what government might eventually take power, perhaps one that will not only leave the Euro but will repudiate its debts.",-0.7249
227,"Exactly!  And they got a €100B debt reduction in 2012, plus a 15-year repayment extension of old and new date , and an interest rate reduction to 3.5%. The debt has already been restructured but they still can't figure out they need to collect taxes, make the islands pay VAT, and scrap the 13th and 14th months bonus payments to public workers and all pensioners. The lowest Italuan pension is €400 per month. In Greece it's now €500, after cuts. Greece ranks 74 for ease of doing business on the World Bank index and 65 on Transparency's corruption index. That's why there's no growth. Greece is killing it's own economy.",-0.7263
228,You simply miss the point. The difference between EU and US was the point -- to have a currency union for the members of the eurozone without a fiscal union (such as the US) has now proven to have been a terrible mistake.,-0.7269
229,"The year 1914, and Sarajevo, marked the opening of a great chasm- the effects of which reverberated throughout the twentieth century and into our own. These effects included the rise and fail of European fascism and Russian communism, and the destruction of the old social and economic order. Modern Europe, with economic union at the core, arose from the chaos.<br/><br/>At worst, the ""Grexit"" could unleash  unforeseen consequences in the world financial system. But a 1914-style cataclysm?  That seems far less likely than one more recession resulting from a world economy now wholely run by bankers and globalized financial interests.",-0.7383
230,"After the 2008 crisis hit the state of Florida particularly hard, the rest of the US sent them mine in the form of automatic stabilizers, unemployment, food assistance for the poor, etc. You know how much they were given? Twice as much as Greece was loaned (as a percentage of GDP). No special bills passed by Congress, no histrionics from morally superior Aryan bankers. Just as a matter of regular business, the state was given double what Greece was loaned.<br/><br/>Transfer payments. That's what a real Union looks like.",-0.7501
231,"Spain is not exactly the healthiest economy in Europe.  We just stopped paying attention to their problems because Greece's are even worse.  Besides, has anyone asked them if they want Puerto Rico back?",-0.7506
232,"Caezar, I am 77. When will interest payments become unsustainable? I can't wait too much longer.<br/><br/>Were they unsustainable in 1946 when the debt ratio was 47% larger. In fact, has debt service EVER negatively impacted out economy? Today they are running at 0,8% of GDP, the lowest in 60 years.<br/><br/>Yes, they MAY get too high, but then a asteroid may hit NYC tomorrow. I worry more about the asteroid.",-0.7587
233,"The greeks lied their way into the eurozone, continue lying while refusing to see the obvious: other eurozone members will not subsidize greek pensions that are more generous than in their countries or the bureaucrats who do not work. Good riddance to such deadbeats...",-0.7589
234,"One question, do you know that about 50 % of the provate hold debt in Greece was been written  off in the first haircut.<br/><br/>And second why if Mr. Joseph Stiglitz not mentioning the part of the Greek Banks on the loan?<br/><br/>BTW why do you believe an American Economist understands the Problems of Europe. All in all I would say they have Problems to understand the USA economy.<br/><br/>Darion X (Germany)",-0.7845
235,"Perhaps Mr. Cohen should read what an economist says?<br/><a href=""http://www.nytimes.com/2015/07/06/opinion/paul-krugman-ending-greeces-bleeding.html?rref=collection%2Fcolumn%2Fpaul-krugman"" title=""http://www.nytimes.com/2015/07/06/opinion/paul-krugman-ending-greeces-bleeding.html?rref=collection%2Fcolumn%2Fpaul-krugman"" target=""_blank"">http://www.nytimes.com/2015/07/06/opinion/paul-krugman-ending-greeces-bl...</a><br/><br/>Mr. Cohen sits in judgement from a country that avoided the worst delusions of those who believe in the fairy tale of austerity.",-0.7929
236,"The brutish behavior of the banksters who have hijacked Europe has now reached the point of genuine economic terrorism. Anyone who has any doubt about the radical threat that this class poses to not only a viable democracy but to any viable, livable world must pay close attention to recent events in Greece. And everyone who supports a democratic future for Europe must now more than ever support the democratic will of the Greek people. The upcoming forced re-vote is itself a sign that to the banksters, elections don't matter--and that to the principled leaders of Syriza, they do. Vote NO, Greece!",-0.799
237,"The US legal system has its faults, but it is lightyears ahead of the European systems (French, German etc.) as concerns corruption and money-laundering.  the US FCPA (Foreign Corrupt Practices Act) has no equivalent on mainland Europe (the UK now has a similar law).<br/><br/>The reality is simply that European legal systems do not do a good job at preventing and sanctioning corruption.  Alas.  I wish it were different.  That is why Siemens was hit with a $140 million fine for corruption by the US and not by Germany (corruption on Bujagali I in Uganda).  And the French banks (notably BNP Paribas) were fined for money laundering for Iran by the US (because of the actions in their NYC branch), and not by the French legal system.  <br/><br/>It may sound unfair, but it's a tough job and somebody's got to do it.",-0.7997
238,"What seems ironic in all this is Germany's inflexibility, considering their situation in the 1920's when they continually renegotiated their reparation payments and eventually cancelled it all when Hitler came to power.  Although the situation is quite different with Greece, the Greek humiliation is also similar to Germany's in the 20s.  Of course Angela Merkel was not alive back then and perhaps does not remember her history lessons.",-0.8118
239,"@Nick Estes:  If China tries to suddenly collect all that debt, all the debt they think they hold will go down the drain as uncollectible.  They will hurt more than we will.",-0.8126
240,"Mel<br/><br/>You write that the elites are now experiencing ""cold, hard fear.""<br/><br/>They are not experiencing any such thing.<br/><br/>This is not a tremendous surprise; it is just considered part of the price of doing business and they will move on. If the Greeks refuse to cooperate on their terms then they will keep on changing terms until finally, the Greek people are ground down and so pulverized with the economic disaster they have brought upon themselves, that they will beg for relief.<br/><br/>I don't like this scenario but I know these people. They never, ever lose.<br/><br/>As long as they are in charge of everything, which they long ago arranged to be, then they will never feel the pain that the Greeks or others are feeling and will continue to feel.<br/><br/>When the banks close in Greece, when their credit cards cease to function, when there is no more food, gasoline, no more money to pay workers, no more people who can afford to pay for goods and services, the creditors, like vultures will keep on circling back, again and again, with their hirelings, until they get Greek resources, properties, gold, anything. <br/><br/>They are much bigger and more powerful than this tiny nation and ultimately they will get their way.<br/><br/>This is just a tiny gnat waiting to be squashed, in their eyes.",-0.8164
241,"Oh, poor billionaire Hank Greenberg.  So, he got his moral victory.  Now, where is the relief for the Taxpayers who bailed-out the financial services industry?<br/><br/>Insurance companies are required to maintain the bulk of their Cash Reserves in marketable securities--of high quality.  At the same time, because the insurance industry is separately regulated by the insurance commissioners in each of the fifty states, there is no nationwide regulation of the insurance industry.  Well, AIG over-extended itself by guaranteeing, credit-default swaps--one of those ""toxic assets""--for considerably more than the parent company's Net Worth.  And to add insult to injury--the Taxpayer's injury--AIG placed much of those Cash Reserves in the ""high-quality"" bonds of other AIG subsidiaries, around the country.  Dumb, and dumber.<br/><br/>So, AIG circumvented the insurance laws and over-extended itself like a drunk sailor.  Since the company operated in perhaps 40-42 states, as well as 170 countries, its failure would have quickly spread The Great Recession worldwide.<br/><br/>Of course, the GOP is fighting to pare-back Dodd-Frank. which was intended to correct the risky activities that caused the financial meltdown.  AIG execs still received excessive bonuses at the same time that the taxpayers lost their jobs, homes and life's savings.  Where were the personal fines?  The jail time?  Banning executives for life from the financial services industry?<br/><br/><a href=""http://thetruthoncommonsense.com"" title=""http://thetruthoncommonsense.com"" target=""_blank"">http://thetruthoncommonsense.com</a>",-0.8205
242,"You miss the point.  If Greece had its own currency, they could stimulate their economy.  There would also be resulting inflation which would reduce the real value of the debt while the profligate borrowers would not be able to purchase as many foreign goods.  Bad things happen.  Sometimes governments borrow too much, sometimes the private sector, sometimes the bottom falls out of the timber market, sometimes banks or markets go crazy, sometimes bad things just happen that aren't really anyone's fault.  The point being that, if you are on the gold standard or the Euro standard, you can be stuck for a very long time because you can't devalue your currency to fix the situation.<br/><br/>The US can print its own money so can stimulate its way out of a recession even after interest rates have been dropped to zero.  Greece could do the same if they had their own currency.  But Greece has NO OPTION to stimulate its economy on the Euro. And inflation can't normalize the Greek debt and currency.  Krugman's theories, which are standard economic text, have been proven true by the facts since 2008.  Contrary to your post, Krugman's prescription is not how Greece got into its mess, but could get it out.",-0.8256
