,comments,scores
0,"Tests are a good teaching tool, help motivate students to master critical elements of the material being taught, but they become insidious when used as the sole means of grading or otherwise judging competency.  For me, the real question is:  What is done with the results of these tests?  If they are used as the sole basis for grading, determining whether students pass to the next grades, or rating the competency of the teachers, that is very wrong.  Some students are quite competent, but don't test well, due to anxiety or any number of other issues.  Conversely, there are students who know how to score well on ""multiple guess"" tests, but who really aren't competent on the subject matter.  Multiple choice tests also don't show whether students have good oral skills, whether they listen to others, build on ideas, and arrive at new insights, or whether they will remember any of the subject matterafter the test.  Accordingly, tests must be only one tool among many in helping teachers motivate and grade students (and in helping schools motivate and grade teachers.<br/><br/>As to the last question, it's great to include a few problems that stretch the minds of the test takers, and that only a few will get right.  The correct answer is not in the text, and is not a very satisfactory answer, but it is a reasonable interpretation of the story and clearly the best alternative presented.  So, right answers will help identify students with exceptional talents (including good guessing).",0.9901
1,"I am grateful for the high quality of reporting on education in The Times. And this piece is a good example. But I wish this paper spent more space on the educational plight of the average American and less on the elite. <br/><br/>I suspect that the staff at the The Times has more brushes with students who aspire to the most elite institutions, and I also am certain the staff has more exposure to graduates of these institutions. But that's not the average American's--or even the above-average American's--experience. <br/><br/>I know you do plenty of pieces on the 99% of us who do not get Ivy League educations, but there is an inordinate number of articles about said ""League."" What made me notice most of all this time was the title, ""A Prudent College Path."" I'd assumed it was something I might read for my intelligent and successful teenager, but, alas, it was for the three people in his class who could possible benefit from this advice, no more than that. <br/><br/>While elite colleges have rightly earned strong reputations as institutions of learning, the press would do well to note how often they are attracted to giving these super-star schools and their super-star students too much attention. Perhaps fewer articles about these exceptions and more articles about the masses would  better inform a greater  number of us.",0.9899
2,"It's easy for you to look at this district! How about looking into the going's on in Districts 20 , 21, and 22 in southern Brooklyn where politicians like Felder, Greenfield, and Hikind hold sway?! While the districts themselves do an otherwise fine job educating their charges, essentially because of populations who value education, you can be sure they take care of their supposedly rigidly orthodox brethren and their Yeshivas first! Often at a loss to ALL our kids! Simple case in point is that I understand FDR high school which encompasses those districts recently celebrated its' glorious 50th Anniversary! Councilman Greenfield and his mishpocha staff were invited to their Sunday banquet, indicated they would come, and FDR's burgeoning alumni association set aside almost five hundred dollars for a Kosher table! Greenfield and his staff not only didn't show up, they never even sent their regrets! The alumni association would have been happy to allocate those monies for scholarships for our kids!...It will be interesting to see what these politicos do when one of southern Brooklyn's other high schools, and a much more famous one at that, New Utrecht celebrates its historic 100th Anniversary this October, and many of its notable Hollywood alumni, a number landsmen like myself, fly in from the west coast to glorify in their proud eastern Bensonhurst and Borough Park roots, and see that their old neighborhoods have essentially been turned into political fiefdoms and ghettoes?! ",0.9888
3,"High level US corporate life seems insane - and of course long hours are built into some high level professional roles in Europe.... But attitudes to work and balancing career and family seem more advanced in Europe - anecdotally at least - career breaks and job sharing are common in Ireland in the public sector.... The working week is capped and holidays are long in France.... German working life is more balanced..... And while the economists among you might point out that work life balance must be great in Greece, but unaffordable.... Nonetheless there most be a societal happy medium that's achievable that allows both parents to participate in the workforce, while having a home life..... By the way I agree with a comment below that examples drawn from elite universities graduates are not representative of the US at large..... They probably represent your readership.... but perhaps your readership need to be reminded that there is a world outside their upper-middle class environments..... How do working class American women cope with family life and child care??? ",0.9865
4,"<a href=""http://mobile.nytimes.com/2015/08/10/us/teacher-shortages-spur-a-nationwide-hiring-scramble-credentials-optional.html"" title=""http://mobile.nytimes.com/2015/08/10/us/teacher-shortages-spur-a-nationwide-hiring-scramble-credentials-optional.html"" target=""_blank"">http://mobile.nytimes.com/2015/08/10/us/teacher-shortages-spur-a-nationw...</a><br/>As a student, I know first-hand the importance of a good teacher in learning and doing well in class. With teacher shortages putting pressure on schools to hire, there's no guarantee that teachers will be experienced, good at teaching, or have any idea what they're doing. But experience doesn't always make a good teacher. I've had teachers that are so experienced in their subject, have been in their position for over 20 years, and are very nice, but they weren't good at conveying information. I've also had teachers that were only a few years out of college that were very effective in their teaching methods. Experience helps, but it isn't as important as being able to convey information, which is the main task in teaching. I'm sure the young teachers being brought in will be able to adapt and rise to the occasion, maybe with their learning days so close behind they'll be more able to put themselves in a student mindset. Rather than worrying about students effectively learning, I think greater concern for the future would be in insuring that this lack of teachers doesn't cause an over abundance in years to come, with young people seeing the great job market in the profession and all jumping into teaching school.",0.9865
5,"This article was about an exceptional individual creating a program of excellence that offers kids an opportunity, through participation in sports, to aspire to higher ideals. The parents portrayed in the article support not only  their children's participation in the program, but the program itself, including materially. <br/><br/>I for one think that Coach Bandura is an exceptional human being, and reading this article challenges me to seek in what ways I too could contribute to a better society by using him as a role model. I speak as a university professor, but also as a father whose kid has been through grad school successfully, and who was not ashamed to trust her to capable teachers and mentors, realizing that I did not possess nearly all the skills to successfully homeschool her, as you seem to be suggesting, to the same satisfactory outcomes. I thank God for exceptional people like Coach Bandura, and people like that who I can look up to. If that shows lack of shame, so be it.",0.9848
6,"I have taught maximum security inmates in the prison system for a number of years and I support offering courses to those that desire to take them. Most of the students I have had were very good students, highly motivated and they performed very well. And yes the statistics for such a group regarding recidivism are fairly good.<br/><br/>But for balance a few realities should be pointed out. These students are self-selected. They are for the most part interested and motivated to change and better themselves. It is not correct to infer that if all inmates are simply offered college classes that there will be a dramatic reduction in those returning, because many are not interested in changing and no one can predict when they will be. <br/><br/>So these programs have the very real possibility of helping 10-30% of the inmates get their life turned around, which is a good thing of course, but  again it's because they want to change in a fundamental sense. For the majority who are not yet at a point they actually want to follow the rules, there will be no such change.<br/><br/>Inmates don't change because you and I want them to, or we offer them opportunities to change, they change only when they decide to themselves. So it is good to have educational programs, it's also good to have some sense of the bigger picture.",0.9799
7,"For so many of us when we are younger we receive praise for our obvious gifts we are pushed in that direction. We think that is the way we ""should"" go, I mean after all, it would be the easy road. I taught gifted kids for awhile in a high school. I always cautioned them about their futures, reminding them that they have to make choices that suits them and not their parents or others. I was always good in math, and everyone assumed I would go that direction. I even got into college as a math major. But I looked around and said ""I couldn't possibly do this the rest of my life"", and changed my major. Fortunately for me, I had a variety of choices because of many passions. I eventually taught 18 different art and humanities courses over a 35 year career. To make a long story very short, one of my courses ""Puppetry"" was packed with gifted students looking for a way to express themselves, along with football players, art students, math majors, etc. I used to say it was a good life experience, all working together in close quarters, putting on a show, and laughing their butts off in the process. Life is short, do what makes you happy, money will follow. The important thing is the process, product is always an outcome.",0.9774
8,"I wonder if ""the best jobs, or the grad schools"" are even the way to go. I traded a crack at that world for a second-string grad program and a non-stellar academic career. I have been employed 23 years by the same employer, own a house and a rental house, started a small business I will pursue in retirement, and travel a lot.<br/><br/>No I don't have a skyscraper condo, a beach house, or a Maserati. But I'm comfortable and live a great life. I wonder how many who focus on being among the 1% of business or academe ""like laser beams"" end up really happy? You might ask your sons ""what is it you REALLY want to do?""  Too few parents, in this age of anxiety, do that.",0.977
9,"Fully agree with the elimination of obstacles preventing teachers from migrating from one state to another, but getting rid of meaningless additional licensing requirements will not resolve the problem, because pensions are generally not portable, and they are also structured in such a way as to reward longer term employees of a state or a district. This is a big problem, not only for teachers, but for their families, because spouses are tied to a particular state, as well, and others, like my single and childfree sister who is the sole remaining immediate family member in our home state with my very-old parents, will have to remain there even when she is the only one left, rather than moving closer to her siblings and their families.<br/><br/>The concern about doing the same thing after decades as on Day One is misplaced. This occurs in many respected professions, like medicine or dentistry. The main problem is that, regardless of what are viewed as lax entry requirements to the profession, most people do not realize how hard teaching really is or how much time and natural talent it requires. <br/><br/>As an aside, I would note that, while requirements for entry to medical school are still quite high, there are plenty of loopholes such as outright nepotism and Affirmative Action that permit markedly less-well-qualified candidates to slip through. It's rather shocking, frankly.",0.9758
10,"A reporter should be embedded with college students at prestige schools for a period of time, so that they could better assess where the ""stress"" is coming from.  I'm a faculty member at a prestige school, and though I give students plenty of opportunities to work, work, work on their papers and data exercises, offer draft writing options and lots of office hours, relatively few students take me up on that.  One would think that working on assignments over time, with the prof who will grade you, would be less stressful than pulling an all nighter.  I also see students who are way over-committed with  activities, are in leadership roles for umpteen organizations, but who save doing course readings till study week.  No wonder they are stressed!  In the ""real world,"" or the work world at least, work happens continuously.  But students have somehow learned to do episodic work, and seem to fill in a lot of time with social things.  Do employers really care if you were a leader in 3 organizations or 5?  How can you have the time to be a good student then?  And what if one has to work?  I just think the desire to be involved with everything has gotten out of hand.  On top of lack of sleep, and yes, parental pressure, students are stressed - but many are not good users of the services that exist, or do not take the time to go to office hours or talk with the faculty members who are there to help them figure out what they are there for - to learn new and challenging material.",0.9745
11,"""Suicide on Campus and the Pressure of Perfection""<br/>Growing up, Hannah Montana told me, ""Everybody makes mistakes"" and that, ""Nobody's perfect"". However, we strive for perfection even though we know perfection is impossible. It is this drive and desire to be perfect that make ""small setbacks” seem more like huge disappointments. As quite a perfectionist, I have high expectations for myself. When I received my first B ever at the end of my junior year, I was very upset, mostly at myself. I had tainted my straight-A record, I ruined my chance of attending my dream college, and my GPA and rank were a complete loss. However, not only had I failed myself, I had failed my parents. I feared their reaction to my report card, anticipating the disappointing looks, the questions, the lectures.<br/>In my strive for perfection, I failed to see the bigger picture and focused on my “small setback”. Scelpo states that such setbacks should give “that feeling of needing to try harder next time”, but my perfection made me obsess over them. Instead of feeling determined to try harder, I wanted to give up. This all or nothing mindset of perfection is the driving force behind the stress that causes students to commit suicide. As cliche as it is, nobody's perfect, just like Hannah Montana sang, and everyone-students and parents alike- need to be able accept imperfection. Although we should set high standards for ourselves, we need to be reminded that being imperfect is in fact, okay. ",0.9709
12,"Does Your School Do a Good Job of Teaching Sex Ed?<br/>I picked this article because i feel as if it takes on a very important topic. I personally do not think that schools do a good job at teaching students about sex education. What they focus on (at least the schools I have went to) is the possible consequences of having sex; like sexually transmitted diseases and unwanted pregnancies. Although there is the occasional ""make sure you wear a condom"" lecture, but they insist on staying abstinent. Yes, this is important information to make students aware of the dangers of having sex and it is still an awkward subject. Many people will agree that the sex conversation should be left up to the parents, not the teachers. I think the reason why it is this way is because it is the teacher’s job to give the students inarguable  information, facts, to keep and it is the student's job to take it in, and if they want, ask questions out of curiosity (not like this happens often). But let’s face it, at least in high school, there are going to be students willing to experiment anyway. What schools should should also be teaching along with the consequences are things like what to do if you want to have a child, rather than how to prevent having one. I believe by doing this it would make a huge difference in the youth's knowledge on sex and make us more well rounded on the topic.",0.9691
13,"New York City Task Force Targets Cheating by Teachers and Principals<br/><br/>This is the second article I have came upon regarding cheating by school officials. Cheating has been an ongoing issue for years in many different schools and has just come into view. Take for example, the tampering of third-grade exams or the school on Brooklyn that didn't provide actual instruction for students from different subjects but instead gave the students just packets to pass a class. Carmen Farina, the school chancellor, is taking a good step forward by addressing the problem to fellow educators to stop the issue, saying there will be zero tolerance for educators who disobey academic policies. Recently, the latest investigation was in the William Cullen Bryant High school. In response, to this investigation being open the State Legislature is observing the Mayor Bill de Blasio and Michael R. Bloomgerg but then noticed this problem increased when Mr.Bloomberg was in charge. Now, one of the regulations that the State Legislature will have, be that the teachers can't grade their own student's tests which is a good step toward solving this growing issue. It's great to see that the Education Department has taken action now and is trying to crack down on these cases. Now, they will be checking for any unusual items, like too much credits or too much graduates who graduated than were expected too. Hopefully this growing issue will slowly decrease until it fades away.",0.9673
14,"I certainly agree. Better to work hard helping people in a selfless profession which is admired, revered, highly compensated, and far more important than any of those easy,  self serving professions like social worker, teacher, fire fighter, public defender...",0.9633
15,"I think there are two different topics.  I think you are right in the sense of depression being a common ailment that needs to be addressed.  Awareness on mental illness and education about it most definitively have to change.<br/>But I also think, that the author brings up an important topic.  There is a book called ""The Price of Privilege"" which talks about this issues.  You are right in the sense that it is not only on this demographic that suicide happens, but I do think many of this suicides are preventable if parents were not living through their kids.   Many of this kids are pleasing their parents or are in Ivy League schools to please their parents or to be a part of this elite group just because their parents want them to be there.    Not every kid has the chops to attend this schools in terms of academics or giftedness. Not only that, not every kid has the desire to go to this schools.  It is not everyones happiness to be a CEO or to be a part of this.  There are many successful business men and many entrepreneurs who did not go to this colleges who live amazingly great lives, not necessarily measured in terms of money.   The pressure for the kids is starting since before High School,  the options of the IB programs, the extra credits. It is overwhelming for those who are not ready or are not in the world to be battling the best of the best left and right.  This article puts some emphasis on the affluent class and how overprinting contributes to the suicide rates.",0.962
16,"hope: to desire with expectation of obtainment.<br/>-------------------------------------------------------------------<br/>Some very young Black men in New Orleans, 1990s, armed, mourning a friend, described their expectations: to die young, shot by a rival gang. That was the same response in Philly, 1960s. Maybe the same in L.A. today.<br/><br/>Whole lot of killing going on.<br/><br/>Not acceptable. <br/><br/>Hope can be instilled beginning in the cradle. That's a fine somewhere to start. Enroll new mothers and fathers in a child care class in the hospital, on their one allowable day; next class at first check-up, 2nd check-up, 3rd -- healthcare and education simultaneously provided (use hospital meeting rooms for ed). First born gets a lift up.<br/><br/>Expand job opportunities while improving infrastructure. Pay to repair, paint, clean, upkeep grounds, schools, shelters, housing units, playgrounds.<br/><br/>Start somewhere and everywhere: clinics, schools, jails, jobs programs, court houses, public spaces. <br/><br/>Provide educational moments to every person lacking resources, served in some way by the state, toward practical steps to improve circumstances.<br/><br/>Do it again. Repetition. Try another way. Again.<br/><br/>Responsibility is mine. My country. My lyrics. My rap. My sitcom. My games. My comics. My social media.<br/><br/>Enough of the hopelessness.<br/><br/>More opportunities. More instruction. More hope.",0.9517
17,"I got an undergrad degree at Rutgers University and an MA at the University of Chicago in fields that did not lead to a job.<br/><br/>Finally, I got an MA at Chicago in Library Science and immediately had job offers. Unfortunately, most such schools are gone.<br/><br/>Then, I awoke to the fact that I could follow my passion and also earn a great living doing something I really enjoyed.<br/><br/>In 1981 I entered the Kirksville College of Osteopathic Medicine, the oldest school of osteopathy in the world ( 1892), and have never looked back.<br/><br/>There is no doubt in my mind that getting that DO ( Doctor of Osteopathy) degree was the smartest career decision I ever made.<br/><br/>I graduated in 1987, following a two year fellowship in osteopathic manipulative medicine, did a residency at the National Rehabilitation Hospital, Washington, DC, and immediately went into private, solo practice.<br/><br/>I am now 66, and have worked doing osteopathic manipulation for 25 years. A third of my patients are pediatric. I see the most interesting cases, frequently ones that other local physicians failed to help. In 25 years I can honestly say that there has never been a day that I have not looked forward to going to work.<br/><br/>I love teaching and have been involved in the training of other physicians for 25 years, both DOs and more and more, MDs.<br/><br/>Some other really practical degrees are engineering ( many different specializations), accounting, and nursing. The moment you leave school you will have many excellent jobs available.",0.9509
18,"In high school, my father, a teacher at a larger high school, brought home a psychological test for me that would score social skills. I was in the bottom fifth. Many years later I allow myself to recognize this lack, as I have never learned nor cared to learn being with others in a social setting. Instead all my talents were spent on matters of thinking and doing, which I became exceedingly good at. Still years later I wonder. Was it because of childhood experiences or is it the real me? Should someone have gently steered me another direction? Now I am sad because I am past working years, have renovated home inside and out, and am fatigued and out of ideas that excite or interest me. Now my thinking is guiding me to understand and accept that many skills are needed to make society function well, meaning I perhaps have done and am still doing what is within me to do, which is a contribution for the good of the whole.",0.9503
19,"So I paid back my $15,000 in student loans in time to qualify for a mortgage, which I also paid faithfully. <br/><br/>My goal was always to support myself and maintain financial independence, so I pursued a career (technology) that paid well. Even though I wanted to, I didn't drop out and write the great American novel--and now I'm glad I didn't. <br/><br/>By working, I learned discipline, focus, and the ability to push myself to achieve goals. <br/><br/>Guess I'm a chump, huh? ",0.9502
20,"Had Professor Light both semesters, 1979-1980 school year  One of the best teachers I ever had.  I find it so encouraging that he and others continue to provide the kind of guidance and prodding that the young need to steer their course.  I can only imagine that this type of searching on the part of the student leads to wiser and more informed decision-making later on.  At the very least it provides an oasis of free discussion and reflection in an otherwise over-scheduled life that can overwhelm.  Well done, Professor Light.",0.9378
