,comments,scores
21,"Thank God. As currently constituted, the tests kill learning. The question I saw yesterday was guaranteed to turn any third grader off reading for life and was too difficult for all but the brightest, most diligent, and most precocious students.<br/><br/>Teachers are forced to teach to the test, and given that their difficulty is unreasonable for many kids, that means teaching test-taking skills rather than useful knowledge. Testing mania also demoralizes teachers and discourages talented people from joining the field.<br/><br/>Standardized testing can have a meaningful role, helping students, teachers, and parents gauge their progress. But they must be occasional adjuncts and while evaluation of teacher efficacy is important, it should not be based on test scores because of the perverse incentives that creates. Nor should schools be judged on the basis of standardized scores for the same reason.",0.9337
22,"How math is taught in the U.S. is fraught with problems. When our daughter first learned to multiply, she was taught multiple methods. The problem was not that she didn't understand the content in class, but that she age-appropriately forgot how to apply what she learned to her homework. Teachers did not provide any guidance or materials for parents who could assist with learning. Moreover, her parents had to google, 'matrix-method multiplication'.There is nothing wrong with parents helping and supporting their children with learning. As a parent, my concern is that most math teachers do not teach a systematic approach that will prepare them for higher math.  After changing schools, we were lucky to find a teacher who approached teaching math in a logical and systematic way. This had the added assurance that the gaps or holes from lack of mastery on basic concepts would not line up when learning higher level math. That is not to say that our daughter was not traumatized by her early experience when the math teacher yelled at her for not using the multiple methods of multiplication. As she goes into 10th grade, she is much more prepared to tackle advanced Algebra. We as parents have no regrets about intervening on the anxiety created by how math was taught.",0.9288
23,"I'm surprised to learn there is a governor in the 21st century who has not even completed college. Well, maybe not given the state of the country's intellectual discourse. Perhaps this explains Walker's enmity towards education. Like Cagney's captain in ""Mr. Roberts"": ""I hate all you smart college boys."" Some years ago, while I was in the Air Force, several of us often joked about a mutual friend, now  a history professor, who carried around a huge tome - Richard Hofstadter's ""Anti-Intellectualism in American Life"". Seems he was on to something. ",0.9274
24,"It's important to note that this isn't the fault of the students, but rather of the overwhelmingly liberal (and often socialist) middle and high school teachers and college professors that have politically socialized them. This is a large part of the reason that we need to have a greater ideological diversity among professors on college campuses. I hope you mention the content of this article in your speech at Dartmouth next week; this is an excellent piece.",0.925
25,"We should address discriminatory implementation of the current system, and I think we should also take more of a public health approach and less of a punitive approach to dealing with child behavioral problems.  I think the question should be, ""What works?"" rather than, ""We need to make a point.""  I would expand the model for dealing with struggling children used by special education schools who deal with the kids who have similar issues but have been channeled into a mental health/behavioral sector rather than into a punitive sector.  There are particular techniques, like collaborative problem solving, that help, and many kids who act out have underlying issues like trauma, anxiety, and depression that need to be addressed.  Getting kids to ask for help when they need it can also improve behavioral outcomes (of course, the help also has to be there when the kids ask for it).  What a special ed model remembers is that kids need support as well as rule enforcement.",0.9218
26,"Nice idea, but not going to happen. <br/><br/>The reason the North is more racially segregated than the South is largely because people in the North can (and do) move to the best public schools available. In the South, where there are fewer good public schools, the wealthy simply stay put and pay for private.<br/><br/>If you put upper-middle-class, stable kids in a classroom with high-needs kids with chaotic home lives, the upper-middle-class kids will vanish to private school (and then, with little regret, probably defund the local public schools, which they now have no stake in.) That's what happened in the South already.<br/><br/>I think it's better to build the poor neighborhoods up from the ground up, starting with educational programs for expectant parents, family support, and better pay for workers. <br/><br/>Asking people to sacrifice their kids for this cause is not going to happen. It just isn't going to happen. That's the one thing people won't sacrifice, period.",0.9207
27,"Oh Old School NM-your just that as your name implies. It's called being passionate about your job and the love of the sport. They set a high standard for themselves and it's reflected in their competitive spirit, professionalism, and expertise. You obviously have a twisted perception of what self respect means. ",0.9201
28,"I bet those with the best, well- rounded educations are the happiest in old age.  All they've been exposed to enriches their quiet days. Education is not only for getting a good job.",0.9201
29,"This is nothing more than a classic case of being entitled. Rubio just simply feels that he is entitled to all these material things, and  I'm sure he picked this up from living in flashy Miami and the rich kids that he went to college and law school with. I saw it myself during college and graduate school. Some may call it a personal or character flaw, and it very well may be, and if it is then it's for Rubio to resolve, I just don't need him doing it from the Senate, much less the White House.",0.92
30,"""Under the proposed changes in Wisconsin, faculty members would still advise leaders on academic and educational activities, and on personnel matters, but that advice would be “subordinate” to the powers of the board, president and chancellors.""<br/><br/>I.e.  In other words, the ""corporate model.""  Is that to infest every aspect of our lives in the 21st century?  When I was born, the University was still a unique space - a haven for thought, experimentation, intellectual growth, community of scholars and intellects.  Walker and the republicans want to turn it into just another business.  Disaster Capitalism is eating away the very institutions of our country that have made it great.",0.9194
31,"For the last few years I used to cringe when I heard people Parroting the Cliche that what we needed was skilled workers. Since the dot .com bust at the end of Irrational Exuberence in the Clinton era, salaries in high tech have gone no where unless you work in the office where the bean counters sit. In High Tech the only salaries that have gone up are in the financial offices, and interference from Beautiful People who sit on the boards, has only made matters worse for the workers when the Beautiful People demand that the company hire diversity candidates, participate in Green this and that, and do social engineering good works for PR purposes. The emphasis on not hiring so many white American nerds in the engineering department has led to hiring multi cultural engineers from around the world, for diversity's sake as well as that they will work for less pay.<br/><br/>Everyone knows that todays young American can't afford the Masters in Engineering separate from paying for their undergrad, and the foreign educated students don't have student loan debt because in their home country, only great math and science students go on to Uni, and it's cheap or paid for. They can afford a great American grad school.<br/><br/>And Everyone also knows, that in engineering, without a continuing ed program at the company they use them up and spit them out after 5 yrs. The tuition assistance programs don't pay for coursework to make them upwardly mobile, they restrict  the benefits only to relevant classes.",0.9135
32,"In 1967 I wanted to go into pre-med at the University of Utah.  In my high school I was the only girl in chemistry, physics, and advanced calculus.  I was locked in closets, jolted with 20,000 volts (low amperage thank heavens) and had the physics teacher tell the principal that he couldn’t teach a girl...I was much too distracting!  If I approached him after class to ask a question he would back away and run out of the room!<br/><br/>At Utah I went on a tour of the campus with a dozen other women students.  I kept asking where the science buildings were.  I was told “Don’t worry I doubt if you will ever have a class on that side of the campus unless it’s an overflow from a sociology class.”<br/><br/>I was the only woman in pre-med.  I was president.  Only woman in my science, biology classes, organic chem, p-chem, and molecular biology.  I had a wonderful professor in biology who got me interested in research, then had me take over teaching his class on vertebrate embryology when I was still a junior.  There were NO girls in any of the classes I taught.  I demanded respect and got it.  I graduated summa cum laude (despite having to work full time nights) and scored 93rd percentile on my MCATs.<br/><br/>I went before a board of five MDs...all Mormon who told me that I would be taking the place of a man who needed to support his family! So--NO!<br/><br/>I didn’t have the money or energy to apply elsewhere.  I went through nursing school, loved nursing,then went through med school elsewhere.<br/><br/>Humiliating.",0.9088
33,"This article is so well said and true.  I can barely claim to understand myself as a male or even human much less others.  A degree of humility is called for in this understanding.  Every time we claim this we put the other in a box to some degree.  So it is always best to honor the mystery that is the other.<br/><br/>If there is a commonality between us I always viewed it as lying on a continuum that contains both male and female. It is a possible way of defining things, but the most important thing is for each of us to learn the lessons of honoring our differences and commonalities as distinct human beings.",0.9074
34,"This week, I came across the article “Today’s Exhausted Superkids” by Frank Bruni.  Noting that this article would be about students like me, I immediately became intrigued.  As a teenager, I obviously have no way of knowing what school life was like anymore than 10 years ago. Thus, I can only assume that education today is even more time consuming and stressful. However, I agree with the article when it states that kids now a days are on a race to become successful, and that race contains no breaks and very little sleep.  I know many people my age take adderall to catch up in this so called race, and sadly, those who do not may fall behind. One classmate of mine even fell asleep at the wheel, hitting a telephone pole.  If his younger brother was in the passenger seat, he would have died.  Students nowadays are so kean on success that their lack of sleep is risking their lives, as well as the ones they love. Although school can be easier in modern day with the enhances in technology, our workload has increased and the standards we are given have been raised.  So I must wonder, is it worth it? Is all this rigorous work and little sleep worth the good grades and possible acceptance into ivy leagues?  With such an awful economy we are already worried if we will even get a job when we graduate from college, so we wonder, is giving up our childhood worth it? ",0.9048
35,"The soulless culture of Amazon is simply reflective of larger trends in our country and around the world.  As a mother I am terrified to see the level of achievement and recognition that our children believe is necessary to be worthy in today's society.  Too much is never enough.  There are no intrinsic goals, only external validation.  Competition for As, for scholarships, to be ""special"" is over the top.  Burnout in sports and academics is rampant in middle and high school students.  True happiness and contentment comes from work that provides meaning and a sense of purpose, and from relationships that nurture and validate us simply for who we are, not what we do.  History shows us that cultures that abandon these basic human needs in favor of relentless self-interest eventually implode.",0.9001
36,"Realistically, I listen to the teachers who are with the children every day and KNOW what works.  Some teachers have integrated children of different learning abilities, against the rules, it works better than segregating.<br/>The child who was asked to tutor another, he/she would have been learning a skill that the parents obviously did not see.  Poor child of those parents - have they not heard of sharing and helping others ???  Even in the classroom.  In one room classrooms it is part of their education, helping others.  I know people who learned that way, went on to college in the usual way - therefore did not suffer ANY setback.",0.8982
37,"Perhaps the source of some math anxiety is where you have teachers who teach to the front row.  I've had several math teachers who did this, who seemed jazzed to teach only those got it right away.  <br/><br/>I had a great teacher in high school.  I believe she had studied psychology as well.  She would walk among us, and gently remind me of my success in solving a similar algebra problems on previous occasions.  She noticed the process of learning.  Most math teachers seem to be oblivious to their effects on students.",0.8979
38,"“Privilege and resilience APPEAR to be be inversely  related to some.A headmaster of a prestigious prep school told me that a third of his  graduates did not<br/>finish college.Why?No resilience.No experience with hard time.”<br/><br/>In other words, you have devised a theory,based on your own speculation,then used a story about a headmaster  which you believe supports your theory, which it does not.<br/><br/>  There could be any number of reasons that 1/3 of the students  from that school do not graduate from college ,a rate which   which seems implausible to me.<br/><br/>     Do you believe that Bill Gates,and some of his fellow spectacularly  successful peers, dropped out of Harvard due to a lack of resilience,based on privilege,or did  he just decide to skip graduating college and get on with founding Microsoft? <br/><br/>1. At age 21, the students from the group which did not complete college received the first distribution of the principal of their trusts. <br/><br/>2. Students dropped out to rebel against their parents,as my older brother did.<br/>What better way to create angst for a father who,by age 19, had started Harvard ,than to drop out of college at the same age?<br/><br/>3.Any other number of possibilities.<br/><br/>As for a “course in resilience “being taught in college-haven’t you just contradicted yourself ?Did you not just argue that resilience is something that one gains with hard times ,which is not true,either. Those who experience hard times do not all become resilient. ",0.8978
39,"I went to college almost fifty years ago.  It was less expensive then and there were excellent state universities that one could afford to attend if one worked during the summer.  There were also plentiful summer jobs, and not  only in fast food.  This was at the beginning of America's decline which has been ongoing for the middle class ever since.  We should restore this.  Extend free tuition to any qualified student who maintains a B average, a real B average based on the curve, in an amount above what they can reasonably make in a summer job.  In addition no student loan should ever bear a higher interest rate than the rate given to big banks by the federal reserve--these days essentially zero. ",0.8973
40,"Law schools and law firms, the ones that pay enough to pay down loans, are about forced attrition.  Intelligence pays little part in the winnowing process. Cockroach-like ability to outlast is the key.<br/><br/>Re Joe, he is super smart (and deserving of his law job). He realized post-hoc (once in school and having already paid his money) that he should make a pre-attendance cost/benefit analysis of the worth of lawschool.  TOP analytical mind indeed!",0.8962
41,"Andy, as a teacher, I tend to overestimate my honors students – though I am pleasantly surprised by those able to start companies as undergrads.<br/><br/>But your class project seems to me more like having first graders figure out experimentally whether dynamite or TNT works better...",0.8955
42,"Back in the 60's my then wife and I tried to enroll our children in a More Effective School in Jamaica, Queens. These MES schools rivaled the best public schools in staffing, equipment and curriculum, and they appeared racially integrated.  Despite a school secretary who asked why we were doing this when the school was filled with ...(a derogatory Yiddish term for black people) we persisted until we learned that the Board of Education would not provide bus transportation for our children.<br/>Good luck.",0.8908
43," In 1964, I arrived at a Big Ten University, with a National Merit Scholarship and a gift for math and science.  I found that not all the science buildings on campus had rest rooms for female students.  That was a powerful statement about the attitude towards women in science!  I majored in English and had two successful careers after completing two very different masters degrees but have always wondered how my life would have unfolded if I had majored in physics or biology.......... I am happy that women are more likely to develop careers in the sciences now but am sad that gender discrimination still is so rampant.  And I wonder if I am the only one who thinks Mr. Hunt looks a lot like Caitlyn Jenner......",0.8908
44,"Love this guys optimism about online learning.  Today it is mostly a corrupt morass of swindling, for profit colleges and a huge cause of student debt.  The best example of what big business means when they fight to ""prahvatize"" education. Mostly a room full of servers and that attempts to reduce cost by replacing teachers.  Unfortunately it doesn't reduce costs.  Through the profit is everything motive it reallocates the money to corporations.",0.8885
45,"High school students do need a practical course in life skills, but traditional American education is far from useless. My study of Latin in high school launched me onto a satisfying life path that has allowed me to do what I enjoy and am good at, with time to smell the roses along the way. And I have Enough. ",0.8807
46,Our universities play a critical role in research and innovation that has contributed to what makes America great.  Tenure was created to protect academic freedom - removing fear the teacher will be fired or limited in how (within a range the academic department and university consider acceptable) they encourage students to consider a wide range of possibilities.<br/>Scott Walker and the reactionary legislature of Wisconsin are now trying to interject political positions into higher education.  That will be the undoing of the UW system.,0.8807
47,"Times have changed Mr. Brooks for both good and bad.  I went to college in the 80's and there were many, many of classmates that studied about 1hr a day alone.   It frankly depended more of what your major may have been (along with your motivation level).    I agree that the luxury level of college and the perks have gone up (along with tuition).   But the level of student dedication to study -  hmmm, I think you are a bit nostalgic. <br/><br/>The millennials are dealing with the world that they have been handed (by the way - just like you did). If they are taking longer to get ""the job"" or waiting to have kids then this their value judgement.    There are reasons (in my opinion valid) why this generation is not attracted to religion or politics.  The primary reason is that neither seems to offer much hope and frankly seem corrupt.<br/><br/>If you are lucky enough to go to college - you should also enjoy it.  There are very few times in life when one can experiment, slack off, etc.  This is also a learning experience.    Once work starts and then family - life narrows considerably.<br/><br/>I find it really difficult to bash this generation before they get started.  The world that they have been handed is not full of opportunity - many of the options (readily) available to their parents generation has been has been squandered.",0.8797
48,"If you go to the average school and ask all the teachers in that school to rank their fellow teachers (with confidentiality), you will probably get a pretty good indication of the teachers who either need additional support and/or have started phoning it in. I would love to see more programs that offer teachers the flexibility to take a break from the classroom, work halftime (job share), or retire from classroom teaching early and mentor younger teachers. Many teachers who haven't quite made it to retirement age are tired of teaching in the classroom but have invaluable advice and help to offer to younger teachers who are just starting out.  ",0.8689
49,"I've been educating students for nearly three decades and I agree that a strong foundation in basic computation sills makes all the difference. However, there is a challenge to commincate that to a young person without making them think that speed and an ability to "" do it in your head"" equal mathematical talent. Common Core does address issues of being able to communicate your thinking process and for many students they don't know how they know - it's for them that a focus on shared understanding and showing your work is crucial to their own continued success. Also - there's a ton of research on the developmental appropriateness of teaching certain ideas and I strongly believe that anyone can learn them but maybe not at the same time as their same-age peers. You tell a parent that their fifth-grader can do seventh-grade math and they'll sign off immediately - try selling the opposite - to parents or school districts.",0.8674
50,"I have this recurring dream about a Junior High student council race.  The candidate promises no homework, hours of recess, free soda and candy to all, ...  Then I turn on the TV and realize the character in my dream is really a 69 year old guy with funny hair.<br/><br/>I find it ridiculous that someone with a junior high age mentality can grab so much attention.  I guess the money helps.",0.8658
51,"Enough with these hopeless opinion articles on the legal practice! Any degree should be evaluated by considering income vs. cost.  Typically, a $160,000 education is not going to be worth it, except for those individuals that already have the wealth and are deeply interested in the subject matter.<br/><br/>Everyone is good at different things.  Some of us were not cut out to be lawyers.  For those who only qualify for a Tier 3 or 4 school, a different vocation should be considered. ",0.8624
52,"As a proud Badger alumna, I am here to tell you that you have absolutely NO idea of what you are talking about. My UW professors were world-class researchers who were always available for their students, often times outside of ""normal"" business hours. All of my fellow graduate students who were interested in staying in academia easily found positions. Tenured professors are not the problem, ignorant people like Scott Walker are. ",0.8606
53,"Some progress already is being made because the market, i.e. prospective students, is demanding it.  I often hear radio ads from some schools (even law schools!) that are offering to refund part of a student's tuition if he or she can't find a job within 9 months of graduation. Many schools have programs that offer college credit hours based on work experience. Schools must now list ""gainful employment"" stats for college majors. As a result, enrollment in certain community college majors is low in the less employable majors, and at least one major for-profit college is in bankruptcy proceedings. <br/><br/>Regarding student loans, interest rates should be lowered. Capitalized interest should be capped to avoid a near doubling of the original loan amount.",0.8553
54,"My college, Dartmouth, spent about that from their endowment and I believe they were spending money today that would better be invested for the future. Much of the money spent on college campus also takes the form of non-academic spending on different outreach and what not that is controversial to some.<br/><br/>Also, this article neglects the fact that investment is important for society as a whole. The money invested by these endowments surely has benefited society in ways that might not happen if their weren't large incentives for the managers to find the best investments.",0.853
55,"What a nice post for father's day.  Meditation should be taught in all schools so that kids can learn how to access their thoughts and feelings, find some peace and develop compassion.",0.8519
