,comments,scores
142,"We have to recognize that a country where it is acceptable that there is employment that pays poverty wages and that gives up on making a broad array of things is consigning a large part of its population, and ultimately itself, to failure.  It is clear that education beyond high school has become essential for a decent income.  It is equally clear that college, as currently constructed, is not the one answer for everyone.  Largely eliminating ""old"" subjects like shop and home economics from middle school means that many students don't even think about options other than ""academic"" education during and after high school.  By emphasizing manufacturing and trades, and making sorely needed investments in infrastructure, there can be career paths for people whose gifts lie in manipulating objects, not just words and symbols.  Knowledge comes in many varieties, and we lose as a country by only rewarding a few of them.",0.1531
143,"This Fall I will be leading the class I created titled Movers Shakers Troublemakers, the Constructive Role of Dissent, at the University of North Carolina.  I shall include this interview; thank you for its publication.",0.1531
144,"Taxpayer supported higher education at all public colleges and universities should not create any more UNEMPLOYABLE liberal arts graduates, political science graduates, history graduates, philosophy graduates with public tax created funds. <br/><br/>The three “R”s (Reading, wRiting, &amp; aRithmetic) are liberal arts topics that all students need, but students should not be allowed seek useless degrees in other liberal arts topics such as political science, history, philosophy, psychology, sociology, women’s studies, etc. that are offered by the liberal arts colleges at the universities, unless their parents certify that they will continue support those graduates after they graduate (and are unemployed due to their choice of degree). ",0.1513
145,"It is not about income, it is about IQ. The schools and teachers are just fine. It's the students who are the problem. Some just don't have the mental ability to do the work and never will. Nature is not politically correct.",0.1027
146,"I was surprised at the ""relatively few"" also. I would guess that every year there were cases in my kids elementary schools--does that mean we didn't escape the ""scourge""?",0.0982
147,"Larrye, While teaching is not a life or death occupation, I can definitely understand how the police officers have been demoralized. As a teacher, my every word is scrutinized and criticized by people not even in the room, so at a certain point, for my own mental preservation, I step back. I can't take my job as seriously as I should, because no matter what I do, I'm going to get flack.",0.0835
148,"""Times have changed, even though our ideas about public education haven't. In 2015 a bachelor's degree is the new high school education.""<br/><br/>The reason a BA is the ""new high school diploma"" is because government ""solutions"" to K-12 have amounted to, as seen in Hillary's Plan, incessant focus on the graduation rate rather than content, rigor, and value-added. ""No Child Left Behind"" encapsulates the absurdity of such thinking. <br/><br/>Hence why we've seen a decline in standards and test scores while graduation rates have soared for high schools in the United States. <br/><br/>The same perverse incentive will be thrown into overdrive under Clinton's proposal. <br/><br/>Why have standards at all when money is cheap and you're judged by how many diplomas you rubber stamp? For-profit schools, low-tier state colleges, and private universities (where grade inflation is rampant) operate under this framework already. ",0.0772
149,"The FAFSA definitely has its frustrations.  It is, however, so much better now than it was when I was a college student in the early 1980s.  I can remember my Dad growling through doing his taxes early so he could do the FAFSA forms -- on the typewriter, of course, as there was no website for one to fill in info.  <br/><br/>Still, now that I am doing the form for my son, I rue the New Year for the excruciating revisiting of ""that website."" Yes, the prior year's information is available, saved for my easy reference and updating.  The real problems arise later, after my son's university gets the completed FAFSA.  Then I am buried in supplemental (mandatory) requests for information that take at least ten times the amount of time and effort that the federal form took, and make half the sense (if that).  I'm left to wonder why I did the FAFSA at all, but apparently it is the ticket to the inquisition required before any aid might be granted. ",0.0616
150,"David, that's why I make the point about salary scales.  There should be relatively little difference between the pay of an older teacher vs. a newer one.  Then districts will have no incentive to fire older ones in favor of newer ones, and we can abolish tenure.",0.0516
151,Pre-K testing should be for establishing a starting point for kindergarteners.  A short assessment will do.,0.0
152,You seem to be ignoring the portion of Yale's earnings which are retained in the endowment for future earnings growth.,0.0
153,"""As her professor, I did not comment.""<br/><br/>Then why did you ask?",0.0
154,He's not qualified to teach. Not even knitting.,0.0
155,"I didn't think much of the as-then-unrenovated Pierson College at Yale in the mid 90s, but apparently it was a palace compared to some of these places",0.0
156,ColOmbia is the country. ColUmbia is the university!,0.0
157,Children today spend more time in school with teachers than after homework with their parents. Now explain to me one more time who isn't fulfilling a role of mentor.,0.0
158,"Right, because Local 8's 4-year apprenticeship program and 7,000 hours of combined classroom and on-the-job training doesn't count as an education ...",0.0
159,"As they say, ""Context, thou art a jewel."" <br/><br/>Hugo was writing in a time when any education at all was reserved for elites. But today in the 21st century, every single kid in America can go to school and be educated. This is category error, apples and oranges. A better question would be why people, having nearly free public education available to them, fail to avail themselves of such. How long will you liberals keep making excuses for laziness? ",-0.0
160,"Having worked through undergrad and grad school and not borrowed a dime from parents, bank, or government and lived away from home doing it, this all seems frivolous bourgeois blather to me.  If you can't afford it, don't go until you can.  But bottom line: Administrators are expensive as are their perks.",0.0
161,"It seems that more than education is involved here. Genes, maybe?",0.0
162,"This must be part of Walker's genius idea to let regents, etc have more say in courses taught.",0.0
163,"And in the mean time, the rest of the world continues to outpace the U.S. In academic achievement. ",0.0
164,"Google says professors earn an average of $69,000. Obviously, this varies by position and by institution.",0.0
165,Correction to my previous comment--University of Texas has an endowment of more than 25 billion (not million) dollars.,0.0
166,"My NYC public school kids have had homework since kindergarten - not an overwhelming amount, and most of it thought generating.",0.0
167,"<br/>But can any of these 3rd graders do basic math without the aid of a computer, calculator or their fingers?",0.0
168,"Let's try to keep this in perspective: the football coach at Arizona State University is still one of the highest paid members of the faculty, and that is what education is all about. ",0.0
169,""" I have been your boyfriend since 5th grade.""<br/><br/>Fantastic quote!",0.0
170,"Brown v. Board of Education was decided in 1954, not 1964.",0.0
171,"'...Tenure isn't justifiable solely as job protection...this matters, because universities are centers for independent thought...'<br/><br/>But that is what tenure has become, a way to guarantee someone a job for life and, just as with civil servants, it has become a race to the bottom.<br/><br/>Universities are no longer 'centers for independent thought', as the only thoughts, and indeed words, that are allowed are politically correct ones that correspond to the majority liberal professors world view.",-0.0258
172,"our daughter, B, was selected for a scholarship to Beiging University in 80-81. we went there to see her in the first group of US citizens to travel china- post communist. <br/><br/>The food- on our first class trip was awful. A standing bet, when meat was served, was whether it was dog or cat.<br/><br/>Now, we know. Dog. Not bad.",-0.0387
173,"Unfortunately we have to, because teachers are ill prepared to do their (math) job.<br/>I would just love for the teachers to leave my kids alone with the mind-dumbing homework once they got it. ",-0.0772
174,"Most parents are considering first in the selection of an alternative school over a public one public one for their children, the safety of the school environment itself and placing educational needs second. The entire  public domain is seen as dangerous and until that can be corrected, people will seek charter schools, home schooling or private education for their children.",-0.0772
175,I have read that anti-social behavior moderates as those with the diagnosis move into middle age.<br/>I have also read that empathy is something that can literally be taught in pre-school.<br/><br/>Early diagnosis and interventions may save us and them from lives of crime.,-0.0772
176,"I'll buy that for state schools.  But if you went to an expensive private school, you're on your own as far as I'm concerned. I don't want to be paying my hard-earned money to fund the schooling of anybody who run up a big bill to earn a prestigious diploma.",-0.0857
177,"Earth to Tsipras: your student-activist grandstanding tactics don't work in the real world. And those student loans? Guess what, you have to pay them back.",-0.1027
178,I am not sure why there is a particular brand of pencils that are needed but some schools require that each subject has its own notebook and they are color coded by subject. ,-0.1232
179,"""And then what?"" asks the fisherman. Then instead of lying around all day you could donate to your alma mater until the student center is named after you, thus making the world a better place.",-0.128
180,Education is driven by socio-economics. You can't compare schools in wealthy or middle class towns with poverty stricken towns and cities. Small towns in the northeast have small school systems with very little bureaucracy. They have intense scrutiny by parents who want a good education for their children. Totally different environment and very little concern for testing. Almost all students pass.,-0.1531
181,"So the male students were cultivating the professor, no doubt pandering to him and stroking his ego, to further their careers.<br/><br/>This is the way of the world and both sexes can do this and it is probably even easier for women.",-0.2263
182,"or that many students expect way too much, are under qualified and major in fields that have limited marketability. ",-0.2263
183,"I don't have math anxiety, quite the opposite.<br/><br/>My sister, on the other hand, has severe math anxiety.  I spent time with her daughter as a young munchkin -- bright, eager-to-learn, very curious and questioning.  Her mother's repeated statements, ""It's okay to be terrible at math [I am too]"", resulted in a 180 degree about-face, and a niece who could barely scrape by with C's in math from the time she was in grade school and on.  A crying shame.",-0.2346
184,"I don't have math anxiety, quite the opposite.<br/><br/>My sister, on the other hand, has severe math anxiety.  I spent time with her daughter as a young munchkin -- bright, eager-to-learn, very curious and questioning.  Her mother's repeated statements, ""It's okay to be terrible at math [I am too]"", resulted in a 180 degree about-face, and a niece who could barely scrape by with C's in math from the time she was in grade school and on.  A crying shame.",-0.2346
185,"When I was in college, it was easy to spot the rich students by their complete helplessness. They arrived armed with their parent's charge cards and had no clue how to care for themselves. (Or others.) They stood there waiting for someone to tell them what to do, step by step, as they had never actually done anything without help from others, from the time they were born.<br/><br/>The international students were the absolute worst, as unlike all by the richest Americans, they were raised with live in servants, and their haughtiness would have been annoying, except the vast majority of them dropped out after the first semester, as the coursework was brutal.<br/><br/>I remember thinking that after the apocalypse, us (very few) poor students would do quite well in the new world economy.",-0.2418
186,"Yes, Northstar5.  Our educational system has suffered grievously in the last 40+ years since financial greed took over at all levels, including at ""elite"" universities like yours.  It's disgusting.  ""Elite"" and major universities have become simple brain/profit breeding grounds for BIG corporate interests.  You and yours have been bought.  Meantime, funding for K-12 education is continually cut as administration/teaching costs rise to the point that many schools don't even provide books for students.  Your hand-wringing is totally inappropriate.  Why don't you and your ""elite"" friends figure out how to develop an excellent public school system in America for ALL students?  After all, aren't you the smartest people in America?  We could use your help.",-0.2453
187,Stop tenured teachers at the university level..Its the biggest drawback to our youth and future.,-0.296
188,"Charter schools do no such thing.  They are abysmal test-prep factories and their students are ill-prepared to think critically, if they are allowed to think at all.",-0.296
189,"If law school is such a bad bargain, why do students keep enrolling?    <br/><br/>That question has to be answered before any solution to this ""urgent problem"" can be suggested.",-0.3182
190,"Well, I started teaching in public education in the 1960s, so I can attest political sabotage began before the 1980s.",-0.3182
191,"Does anyone remember how, after Brown v Board of Education, Southern white supremacists used their control of local school districts to defund public school systems, while creating ""private"" segregation academies restricted to white students? Result: defunding and destruction of public schools, the only schools open to African-Americans. Add right wing Republican success in pushing for public funding of private schools, you have the result seen here: a zero sum game of blatant religious discrimination and funding of private religious schools with public money all at the expense of public schools. How is this not a clear violation of the basic Constitutional separation of Church and state?",-0.3217
192,"The rub is that the possible ultimate conclusion to this scenario is that the public schools are left with almost entirely nothing but the most disruptive, the most disabled, etc.<br/>As for the ""almost"" part, what are the well intentioned families and kids, who for a myriad of reasons can't afford to move out, even with the vouchers, supposed to do.<br/>I have no problem with a private school accepting or dismissing whomever they please, but I don't think the community at large, via their taxes, should pay for that private schooling...",-0.3269
193,"Bob Jones University's policy was to expel students that married outside their race?  Wow!  Really?  Seriously?  And the University was arguing to maintain this policy until it was struck down by the Supreme Court in 1983, not 1883?  Wow again.  Disgusting.",-0.3281
194,Didn't I hear that the Walker took money from their higher ed system for this? My god. What is wrong with these people?,-0.3313
195,This is yet another example of politicians (most of them Republican and most of whose children attend private schools from kindergarten through college) dumbing down and dismantling public education for everybody else.<br/><br/>If Walker wants to slash funding for the University of Wisconsin System let him state his case to the people and students of Wisconsin. But politicians should have absolutely no say on curriculum and what happens in the classroom.  The tenure system was created and has become the norm to prevent just that type of political meddling from happening.        ,-0.3377
196,"If the cost of your daughter's liberal arts education was so objectionable to you, why didn't you cart her off to the local community college for two years, followed by two years at a cut rate state public school?<br/><br/>Could it be you were buying the prestige of a pricey certificate you could brag about at the local golf course, and now you have buyer's remorse?<br/><br/>Tenure didn't cost you, administrators did.",-0.3527
197,"If you want a job upon graduation, it is better to major in a field which produces jobs. Until everyone does. If every kid in the nation studied electrical engineering, actuarial math, and computer science, we would have a lot of unemployed engineers, mathematicians and computer scientists. Likewise, if every graduate from our high school goes into skilled trades, we will have a lot of unemployed tradesman. Often, these skills and fields of study result in employment because not everyone does well in it, and the people who train in those fields have the skills to do so. <br/><br/>Our problem is that we have a limited supply of choices for the people who will not be cardio surgeons or invent a new battery technology.",-0.3596
198,"The Wisconsin legislature is also going along with Walker in eliminating all standards for K-12 teacher certification in the state, and over the next ten years they are moving $600-700 million from public schools to voucher schools. Walker's is a radical agenda to completely undermine public education to return us to the 1830s or 40s before there was any organized public education. This is not an exaggeration. ",-0.3597
199,"You will never get your criteria through DOE, which remains counseling-based.  As a former NYC teacher, there are children so damaged by their socio-economic conditions in the home that at twelve their eyes are empty.  Our country is not willing to expend the funds or do the hard work that can turn this around.  I had a dean once say, ""Sometimes I don't know how these kids get out of bed in the morning.""  This was the environment a wonderful, talented group of teachers worked in.  And when one of our children was murdered on the street, we all attended the funeral.  As a society, we need a bigger vision as well as a recognition of what we as a people have done.",-0.4101
200,Maybe he's also terrible at math.,-0.4767
201,Terrible idea.  Subsidizing student loans leads to higher tuitions and is counterproductive.,-0.4767
202,There has to be a full restructuring of the American educational system. That's awful that the majority of students receive such primitive knowledge so they can only be soldiers or gangsters!,-0.5093
203,Mr. Blue Collar has gone out of his way to hurt Ohio's public schools.,-0.5267
204,"So, you wouldn't mind if my children put down Black on college applications, since selective schools have lower admission thresholds for Black applicants (250 points lower on the SAT for example)?",-0.5267
205,"Unfortunately, it's not just this school board that is victimizing kids, so are our politicians and power players who find many ways to divert public education funds to private and parochial schools. David Greenfield's bill insisting that NYC taxpayers pay for security guards for all private and parochial schools is one example of this. Requests for tax funded daily sanitation pickups for private and parochial schools, crossing guards, busing and textbooks are also paid for with tax dollars. Then there is the charter school conundrum. Tisch, and Cuomo who are so supportive of charters schools to the detriment of the real public school kids. While I agree with this op-ed, I think Tisch should think about how she and Cuomo are also guilty of slashing public school resources.",-0.5475
206,"the schools are fine--it's the students who don't want to learn that make them bad.  A lot of students don't want to finish high school, they're going to go on to college? ",-0.6052
207,"""This will entail more money for education so these people can have some hope of earning a living besides selling drugs or gang crime. ""<br/><br/>you are aware that per capita spending in high schools in DC is about the same as surrounding counties? Yet areas like Bethesda and Fairfax graduate the overwhelming majority of their students while DC barely a third (at a very low attainment rate). How much more money are we to spend? What is (much) needed is family involvement in particular. Ger rid of illegitimacy and this problem will, to a large degree, go away. ",-0.6096
208,"Dr. Geoffman could easily avoided this controversy by simultaneously publishing a rigorous peer reviewed article, in which her supporting data would have been vetted by peers. By only publishing a book and destroying all field notes and raw data, she only has herself to blame. I would not like such a person to get tenure at a major research university and be responsible for shaping the minds of young scholars.",-0.6136
209,"This is all because of an unexpected flaw in the design of the system as created by the New York State Legislature.  There was never a thought of a district where 75% of the students attend private school.  The interests of this community, as reflected by their school board, are toward the private schools, not the public schools.  This is unfair and wrong, but it is a consequence of how the system was created.  It is very sad for the students enrolled in the public schools.  Only Albany or the courts can rectify this situation.",-0.6357
210,"As a ""recovering lawyer, (Retired in 2003),"" I concur with this frustrated veteran's spouse. I went to college and law school in the 1970's under the G.I. Bill, after Vietnam (USN, ""Yankee Station,"" 1969-1970) and worked for years in a grossly understaffed Public Defender Office. I graduated without debt, but earned an insufficient salary to finance a debt, if I had one.<br/><br/>Many law school graduates are now employed in unrelated occupations. I remember an old ""Blondie"" cartoon, which illustrates this point. Blondie looks askance when presented with the plumber's bill for fixing the kitchen sink. In outrage she comments: ""Our lawyer doesn't charge us this much per hour."" The plumber responds, ""Neither did I, when I was a lawyer!""",-0.6454
211,"Before law school, I earned an undergraduate degree in American history.<br/>What FDR did during America's 4 year involvement in WWII is in no way, shape or form anything like Barack Obama's wanton abuses of the Fourth Amendment with the NSA domestic spy program. There are absolutely no similarities. None. ",-0.6705
212,"As someone who teaches professional students, I can only say this is a hopeless battle.  Also, many kids don't even read emails, probably because they might be more than 140 characters.",-0.6808
213,"Ryan-<br/><br/>And medical school is flawless, eh? Up to 33% passed courses they should've failed? This is the group of MD's you must speak of when you rant on-and-on about NP's being so poorly qualified to practice medicine?<br/><br/><a href=""http://well.blogs.nytimes.com/2013/02/28/why-failing-med-students-dont-get-failing-grades/"" title=""http://well.blogs.nytimes.com/2013/02/28/why-failing-med-students-dont-get-failing-grades/"" target=""_blank"">http://well.blogs.nytimes.com/2013/02/28/why-failing-med-students-dont-g...</a><br/><br/>Admitting you have a problem is the first step. . .",-0.6848
214,"Considering his age, his indebtedness for college was probably manageable, but he subsequently did Masters programs, which are a tuition cash cow for Universities.  He seems to have been naive to taking on the additional debt.  Deadbeat. ",-0.7096
215,"I got it. What an epiphany. But that's mainly because I'm sick of reading this spitting in the wind contest.. All Pubilc Schools and Military Bases, and possibly even universities, ie anything in the public arena should be enumerated, not named after personalities. Robert E. Lee, George Washington Carver, Andrew Jackson, etc... Leave those for private schools or whatever. Getting an education or serving your county should not depend on who you identify with culturally. IT IS DIVISIVE. Public School 1. Military Base 62.... and forward!",-0.722
216,"I don't care if a candidate comes from limited or plentiful means. I do care if they can't master arithmetic, the only skill necessary to balance a checkbook.",-0.7316
