,comments,scores
44,"Another source of frustration: neighborhoods in the West Los Angeles area that used to be open to upper-middle class professionals--doctors, lawyers, accountants, etc.--have been taken over by the financial services crowd and the upper reaches of Hollywood players.  Whereas a successful doctor could previously afford to buy a post-war ranch on a 1/2 acre parcel in Brentwood Park, he or she would be hard-pressed today to come up with the 6 million plus that such properties now command.  The huge increase in value of these places is entirely due to the hugely inflated incomes of a small group of people, and then affects prices not simply in the tonier neighborhoods but the lesser ones as well.",0.7269
45,"""What is going to happen is Americans are going to flock to Cuba, they’re going to be staying in Spanish hotels, eating German food and using Chinese computers,” she said.""<br/><br/>I agree that the embargo should be lifted, but as someone looking forward to a visit to Cuba someday soon I don't think having a Marriott and a McDonalds on every corner would make that experience a better one. If I want to be surrounded by the usual mediocre  American franchises I can stay home.",0.7227
46,Dont forget the tacky interior decorating! That's a big thing with Trump :D,0.7176
47,"The tsunami will have to proceed east in the Strait of San Juan and only a portion of the surge will go south in Admiralty Strait. While Seattle will experience a surge into the wreckage of the older buildings downtown,very little can flow through Tacoma Narrows.  Olympia unlikely to flood much.<br/><br/>But I am happy that none of my children live on Lopez Island in the San Juans any more.",0.7096
48,"What a spectacular disappointment Cuomo is. One would've thought that the recent primary, in which a virtually unknown rival candidate made a terrific and surprising showing, would've chastened him into acting on behalf of New Yorkers, instead of continuing his petty and destructive actions. At this point, I've given up entirely on Cuomo doing anything that benefits citizens of this state. <br/><br/>What's truly surprising in all of this is that Cuomo is a person who clearly harbors presidential ambitions, yet actions like this, as well as his policies against public schools, anti-corruption commissions, and the poor, will act at slapping him upside his head on that score.",0.7096
49,"Perhaps China needs the greatest Boxing Day Black Friday sales of all time under the mandate of heaven.<br/>""Hi, I'm President Xi, and for this year only we have 50 per cent off on everything. Learn from the countryside, take a vacation in your new car. Learn from the workers at  direct factory outlets. Need home renos on your brand new apartment, we got 50 per cent off on all kitchens and home repair items.<br/>""In the spirit of proletarian internationalism we are bringing in 1,000 American television car hucksters. Learn from the Art of the Deal.""",0.7096
50,"3 meters are legal and to code in a 2 family. Most the new 2 families are built like that now.  1 meter for each family and 1 meter for any commons areas, basement etc.   Makes it easier to split electricity if both units are rented to tenants.",0.7003
51,"It is common knowledge that Europe is very liberal about nudity/public sex, but there is a level of respect for those around you that seems to be missing in this picture. Having lived in Europe the past 17 years, I can assure you that there are not topless or spray-painted women running around in the city centers/squares. Public nudity is illegal in most european countries due to the fact the there are children and minors in the area, and the government cannot regulate that. Entertainment acts of any kind require a legal permit, and the performers are fined large sums of money without one. It is important that the acts are decent (especially in a bustling place like Times Square, ""where 480,000 people — tourists and locals — walk daily""). I am not saying that nudity is wrong, but it is not appropriate in one of the world's busiest pedestrian intersections. Perhaps Vienese are less concerned about nudity in general, but they have a sense of propriety and appropriateness.  There is a respect for the many others who may not share their same opinion.  What might be fine on the Danube Island, would not be acceptable in the setting of the downtown pedestrian streets.",0.6982
52,Good Bless Nova Orleans ,0.6908
53,basic cheap housing would also help the homeless in american cities where landlords see raising rent out of sight as sport.  everyone needs a safe place to live.,0.6808
54,"So, the majority of welfare recipients are not Black but 2 out of 3 section 8 recipients are?  Something seems way off there.  Of course section 8 housing isn't going to be in any upscale neighborhood where people care about their properties.  Weigh the options. Take someone in who comes from a demonstrably uncared for area and drive your own down or don't accept low income renters.  After all, if they cared, the area they came from wouldn't be so bad and speaking of caring, how about you marry your baby daddy.",0.6713
55,"I was born in Burlington, lived for a  while on Long Island, and winter in Clearwater, Fl. and I definitely would not describe the 30 minute traffic jam as massive. I am hoping that it is big enough to keep some folks away.",0.6705
56,"Limousine liberals, indeed - in the UK, the call them the ""champagne socialists"" and ""metropolitan elites"". Only those living in the epicenter of inequality, Manhattan, with salaries that buffer them from said inequality, would have the temerity to point to northern Westchester and cite a line from ""Dixie"".<br/><br/>It's why I won't subscribe and keep to my little quota of monthly free articles.",0.6705
57,"""Populist tendencies""?  Last year when in SA I spoke to some elderly black people terrified by the crime in their neighborhood just northwest of Johannesburg. Said one; "" We see the politicians coming here with their promises just before the elections. When they win we don't see them again until the next election.""  And the crime and squalor continue in the new SA just as the same politicians reward themselves with new BMWs and lavish homes in Houghton every year. Sure South Africans are ""happy with the progress"" - just like the old lady I spoke to. <br/><br/>We can just call SA ,  ""Azania"" and tell the ""West"" to ""butt out"" , and tell ourselves we're fair and just and uncorrupt and smear everyone who disagrees, accuse them of being in the CIA, allied with enemies and so on. <br/><br/>Sounds like Animal Farm should be read again.",0.6597
58,"Time in these Southern rural towns have been frozen in the past. These super conservatives, to put it nicely, haven't been moving with the whole society into even the 20th century, not to mention the 21st. Is there a whole a lot we can do about it, through education and other means? I'm afraid not. The good news is, most of the country are moving forward.",0.6591
59,Hooray!!! Hopefully other cities follow Boston's lead. The games saddle citizens with white elephants and debt. Scale them down or let them go. ,0.6571
60,"I have found swim towels in all sorts of bizarre and remote places after we have had a crowd of kids in for a pool party.  Kids by nature are negligent and inattentive, and even well-meaning parents can be too distracted to notice every single thing they do. Rational pool owners buy lots and lots of cheap towels and expect to experience some attrition. This neighbor should stop hosting pool parties, both for her own good and for the good of her neighbors.",0.6486
61,Try supporting a family on $69000/yr in NYC. A 2 or 3 bedrooms apartment can easily amount to more than 50% of income for a family making $70K/yr.,0.6486
62,"As a native New Yorker I really have no nostalgic tie to the Bodegas. Back in the day they served a need. Back in the day when big chains avoided these neighborhoods like the plague the bodegas was the neighborhood's Stop and Shop. Living in the city most people were forced to shop locally for most people didn't own a car. If you were one of the lucky ones who owned a car you would lose your parking spot if you made a milk run to the not so local supermarket. You understood that the owner of the Bodegas had to charge more for his goods just to stay above water. When big chains made attempts to open up in these areas the Bodegas owners fought them tooth and nail. Now that the demographics have changed and the new people in the neighborhood require you to sell fresh food and not overcharge them you have to close shop? To the good owners who didn’t sell old meat, beer and cigarettes to minors and did their best to serve the neighborhood I wish you the best of luck. To the stiffs who exploited the poor people who couldn’t afford to go anywhere else I say Que Sera, Sera.  ",0.6319
63,"A while back, I was led to a video of surfing or kayaking on the River Doubs, which led to a Google Maps expedition to figure out where it (and similar) videos were from, which led to Street View, including Besançon.  I'd been aware that a lot of prime Europe is off the tourist paths, but the city and river, including its villages, impressed.  ",0.631
64,"When I bought my home, I replaced the chandeliers with antique ones and donated the old ones (not my taste). When I move again, I will substitute attractive, inexpensive chandeliers that I found at the local Habitat Restore for about $20 apiece for my antique ones, which will go with me. ",0.6249
65,"Well, in Wisconsin, home of Scott Walker, there were newspaper reports of offices where you could get an ID restricting their hours, closing locations, moving locations. It was all too cute by half. I saw a report on tv from Ohio, home of John Kasich, where they moved a city location for voting, which you could readily reach by walking or bus, to a suburban location where you had to take a lengthy bus ride, and when you got off the bus you then had a long walk. Really handy for older people in a northern clime in November.  I agree that voting should be more convenient for people, and once you're registered you are registered.",0.6249
66,The sophistication rating of a city must include adequate public toilets. And ones that are open at all hours (take note Paris!). With ageing populations in the western world we have more &amp; more males (in particular) trying to find somewhere 'to have a pee'. Better planning and public services are the key.,0.6239
67,"When you left Ludingon for Traverse City on Highway 31, you missed out on the prettiest part of the eastern lake shore.  Highway 22 follows the lake along the ""pinkie"" of the mitten of Lower Michigan.  The sleepy beach towns of Empire and Glen Arbor, Sleeping Bear Dunes National Lakeshore, and the drive from there around to Traverse City are spectacular.  <br/><br/>It's just as well, though.  A big influx of tourists would ruin the relatively quiet charm of the area.  Take your family there next time, but don't write about it in the NYT, OK?",0.6186
68,This was true of every visit I made to NOLA after Katrina as well. I was there to study and write about the storm; could have written about the food.,0.5994
69,Should not be allowed if you can afford elsewhere it is a necessary safety net for many.  What about the professionals making well over/into six figures who stay in rent-controlled apartments for over 40 years?,0.5994
70,"We had a similar problem in Hawaii, where people hauled white coral from the beach and made 'coral graffiti' along the roads, mostly things like 'Billy ♥️Suzy'. They accumulated over 40 years to become a major eyesore. Although some people thought it was cute, local people finally said 'enough is enough!', and removed them all. Now it looks pristine, as it was.<br/><br/>I have seen the locks on Pont des Arts multiply like a cancer growing over the past 50 years, and wondered why Paris tolerated this. Let the bridge go back to its graceful old self.",0.5983
71,If parents are worried over lead levels in neighborhoods undergoing much needed renovations why are they buying there? Because those safety issues mean the real estate is cheap. Instead of seeking profits from gentrification why not just buy newer fully code compliant  housing while their children are young? ,0.594
72,The city has never been or smelled so putrid.  Garbage and urine all over.  <br/><br/>Maybe it is a union problem?  Sanitation??  All I know is that the level of filth is beyond emerging market cities.<br/><br/>Another gift from the de Blasio legacy.  Thank you good-for-nothing-mayor!!<br/><br/>Our quality of life is decreasing day by day.,0.5892
73,"The Upper West Side was ranked the second-best place for people over 50 to live in a recent poll. I assume that's because the city is easy to navigate without a car, there are networks for older people, and there are many sources of culture and entertainment that don't require robust physical health.<br/><br/>Of course you have to be able to live there.",0.5667
74,"It's still possible. My husband and I were from PA. We decided to ""pick up and move"" to CA in the mid-70s.  No jobs. No home. We rented an apartment, found jobs, bought a home in San Diego, made friends and lived there 7 years. Then, we picked up and moved to Seattle in the 80s, same thing-no jobs, no home.  But, we both were hard workers, had initiative and again, we got jobs and bought a house.  We eventually divorced in the 90s, and I picked up and moved again, to a small town in Northern WA state, got a job, bought a condo and continue to live my modest, middle-income life.  If you're willing to work hard, understand that not everyone can or should earn $100,000 a year and have an open mind, you can live a better life. I now look out my windows at grass, trees and sun. Deer come up to my deck at take apple slices I offer. I wouldn't go back to a city for any amount of money. Life is too short not to take a chance on having a better life.",0.5632
75,"de Blasio is out of step with the majority of law abidign NY'ers and has been from the begining. He is polarizing and inept in his current position as Mayor. Perhaps he can take his act back on the road to say Podunk and stay there on a more permanent basis, he seems to be more comfortable when he's selling his shtick on the road. ",0.5563
76,"I have the impression that the true problem with Mr. Cuomo, in the eyes of de Blasio and his ilk, is that Mr. Cuomo is unwilling to go rogue and push the state's policies far to the left, like what Mr. de Blasio does in the city.",0.5423
77,"Even Ms. Wade doesn't want to live next to ghetto neighbors.  It's okay for her to feel like that, but not okay for middle class people to feel that way--especially if the middle class people are white.  ",0.5329
78,"What we need in NYC in Google Fiber which is now in several cities including Kansas City and will soon be in Atlanta.  $70 per month for 1 Gbit service.  Whenever Google Fiber comes to a city competitor rates drop and service improves.<br/><br/>Google owns one of the largest office buildings in the city and has a very large engineering facility located there.<br/><br/>Dan Doctoroff, the former CEO of Bloomberg LP and Deputy Mayor of Economic Development and Rebuilding for the City of New York, is now the CEO of Sidewalk Labs, based in NYC  and funded by Google.<br/><br/>I hope now that Google Fiber is coming to Atlanta, The current NYC government will work with Google and Dan Doctoroff to ensure that NYC will soon have Google Fiber.",0.5267
79,"Welcome to Winston-Salem, David C!  Didn't realize you were in the neighborhood.  I think of Bowman Gray as the School of Medicine at Wake Forest.  I didn't realize that name had gone away (some time ago now) until I moved back to NC.  I have a second cousin going to med school there now.",0.5093
80,"""Landlords"" are not longer Mr. Roper. Financial capital owns New York real estate. They want a return on their money, so rents go up and into their investment portfolios. This is why neighborhoods have become one bank and chain store after another. It has nothing to do with serving the needs of the neighborhood, yet everything to do with serving the greed of a few pockets. <br/><br/>New York, like San Francisco, should pass a city ordinance limiting the number of chain stores to keep the city from looking like a strip mall. I want to live in New York, not Ohio. ",0.4939
81,"You are so right!  NYC is truly a melting pot and it is very common to find persons of all nationalities either cohabiting, or simply socializing together.  Income, class, etc gets erased at some point, even if temporary.  Especially when smashed together on the subway.  ",0.4926
82,Thank you Professor Krugman for another insightful column that requires simple logic not an advanced degree in economics.<br/>My wife often tells the story of her grandparents working their shipboard way across the Atlantic by doing what everyone else on board was doing: Taking in other peoples laundry.<br/>The dirty clothes have gone south but the new money all is going to the ship owners. The housing boom means very little here in our abandoned mill town a house that cost well over a million in Toronto cost under one hundred grand here.  The housing bubble was simply supply and demand and cheap housing in a cheap labour market is simply a reflex action rather than real GDP growth.<br/>Canada's prime rate is .5% and real growth may not occur until the banks pay us to take their money.,0.4819
83,"While I admire the intent of this piece, its conclusion is misguided: Ms. Wade wasn't confined to black neighborhoods because she was black. If she'd been white, the Section 8 housing would STILL be located in black neighborhoods.<br/><br/>This means a WHITE person with Section 8 housing ends up in a black neighborhood. This isn't racial segregation: it's economic. <br/><br/>Section 8 pays almost nothing. It's not enough for landlords with higher priced properties. ",0.4767
84,Try living in a tiny idyllic hamlet somewhere a few hundred years ago. Living around some factories and freeways and taking the occasional vacation to the mountains or the shore would start to sound really nice,0.4754
85,"Totally agree.  Instead we are engaged in the Big American Rat race. Look at the morning commute in a major city such as Los Angeles 405 freeway or Wilshire Blvd at 6:30 am on a weekday.  You have to ask yourself, ""this is living?"" All these miserable people choking on fumes going to a job they would quit in a heartbeat if they won even a little money on the lottery.",0.4754
86,"The majority of listings are not single individuals  who need a little extra income.<br/><br/>That is PR from Airbnb and is an insult to our intelligence.  The Attorney General's<br/>report on these listings proves that.<br/><br/>I support individuals renting space in their owner occupied dwelling both as a concept,<br/>and because it is within the law.<br/><br/>But since this is a business and safety is a valid concern, the city should<br/>require inspections and commercial liability insurance.   A homeowners<br/>policy will not cover injury or damages for a business that doesn't<br/>carry that insurance",0.4646
87,"I moved here 2 years ago.  The big difference for me (besides all the nature beauty) is the friendliness, as compared to urban areas I have lived in (Silicon Valley, Boston, etc.)  One of the other things about Sandpoint you didn't discover is that it is a haven for ""Preppers""...",0.4588
88,"He's not the only politician to do that kind of self financing.  Norm Coleman, FORMER senator from Minnesota took his relatively modest house just off Grand Ave in St Paul ( an upscale neighborhood there) and refinanced his house 14 TIMES in 18 months from 2006 to 2007, going from $280,000 to over $800,000 in valuations for a three bedroom house built before WWII.",0.4588
89,"If you look at dats on affordable housing built in high income areas you find that none of your right wing assptoons are true. If you educate yourself about affordable housing in high opportunity area you find that most of the people who move there are white but the blacks who do get out  thrive , along with the community at large.",0.4215
90,"City officials call a news conference to introduce the public toilet model that they plan to buy from the Netherlands for $5,000 per unit.<br/>""Wait!"" says the NYC Public Advocate. ""These seem to have no safety features, which must be added.""<br/>""These would be built without union members,"" said the city's top labor boss. ""Unacceptable. We must put them out to bid only to union shops.""<br/>""Hey, NYC's 120 different religions have different bathroom customs. All must be accommodated,"" says NYC diversity officer.<br/>""The mayor intends to put 50% of them in Manhattan? Unacceptable,"" say the borough presidents of the Bronx, Brooklyn and Queens. ""We've already filed a class action lawsuit.""<br/>Final cost for each unit, $1.3 million, delivered 14 years late.",0.4003
91,"""Middle class hard working people""...<br/><br/> who were already here to benefit from rent stabilization. Ones moving here now are sol.",0.3818
92,"Please come to London, too!",0.3802
93,Good for Boston. It's about time that cities stood up to the sports industry and made them pay for their own facilities.,0.3612
94,where would she find a place like that?,0.3612
95,"Game over, SCOTUS has ruled, time to move on to bigger issues like income inequality and housing affordability.",0.3612
96,Move to Brooklyn and you can take your toddler to the bar like tons of other parents here. ,0.3612
97,"Native utahn here who went East (NJ, DC) then boomeranged back -- and I haven't  looked back. The West is hard to beat. Gotta think your last two paras have more than a few city slickers on the right coast now turning their gaze leftward. Nature does the mind-body-spirit (soul) good.",0.3612
98,"Bernie's form of socialism does. Burlington Vermont was very well run, and fairly, when he was mayor.",0.3384
99,"Imagine ""Primates of Harlem.""<br/><br/>Immediate condemnation as racist. But trashing successful people and their families is de rigueur.<br/><br/>PC runs amok, once again.",0.3182
100," I can't drive in Midtown, between 9th/8th Avenue on 36th street in the morning and afternoon without a vagrant blindsiding me, aggressively asking for money and so forth. And its DeBalsio's fault. In fact, the Police Commissioner is very smart. He is letting this all fester so he can overthrow eventually the Mayor.  Good work!",0.2926
101,Supply and demand.  The current generation of New Yorkers don't want bodegas and don't feel any of this nostalgia.  The bodegas are being out-competed by others offering a better product/service.  The proof is in the closings.,0.291
102,"@Blossom: in Cleveland -- no, it's not luxury.<br/><br/>In Manhattan or Brooklyn, it is INSANE luxury for the 0.1%....we are talking MILLIONS of dollars to have a 4 bedroom apartment. Heck, even a 3 bedroom would be rare. I understand even 2 bedrooms are now hard to find.<br/><br/>That is the difference. For what you spend to live in Dickensian penury in Manhattan, would pay for not merely a 4 bedroom house, in another city/state, but likely a high end McMansion with every bell and whistle, plus your utilities, plus maid service, plus your car payment (AND insurance), plus tuition or day care for your kids, PLUS retirement savings.",0.2694
103,I found this article very interesting because i myself question how skyscrapers dont fall today in these massive storms now a days. The only way for these massive skyscrapers to fal is if we have a devistating earthquake which we rarely get in the tristate area. I mean you have to give it to the constructors of the buidings. But in the future we'll see what happens with these buildings.,0.2492
104,"<a href=""http://www.nytimes.com/2015/08/04/us/hitchhiking-robot-safe-in-several-countries-meets-its-end-in-philadelphia.html"" title=""http://www.nytimes.com/2015/08/04/us/hitchhiking-robot-safe-in-several-countries-meets-its-end-in-philadelphia.html"" target=""_blank"">http://www.nytimes.com/2015/08/04/us/hitchhiking-robot-safe-in-several-c...</a><br/><br/>Sadly, i was unaware of HitchBot until i heard the news of its demise. The idea behind HitchBot is incredibly fascinating and is something that i wish i could have been a part of. Upon viewing the pictures of the dismembered robot i felt as if i was looking at pictures of a crime scene, it felt as if there was a murder of sorts that had taken place. Although HitchBot made news when his trip was over i believe this incident shed more light on a project that can be taken to bigger and better levels. The Creators should take this as a learning curve and implement new ideas in order to make the robot more resistant. I will be on the lookout to see if a new HitchBot or a similar project will be coming in my area. The idea behind the robot is fascinating and should not be discarded after one failure.",0.2316
105,"The Palace of the Inquisition in Cartegena, Colombia was built during the 16th Century. It features a ""denunciation window"", whereby community members could easily report upon one another's misdeeds, anonymously, while passing on the street. Such an addition might be very convenient for future Amazon locations. ",0.2263
