,comments,scores
184,"If Ms. Dolezal had been born to a ""white"" mother and a ""black"" father, and raised solely by her mother, would she be black or white? When President Obama identifies himself as black, where are the critics pointing out that he is, after all, white?<br/><br/>Or are we still stuck in the old paradigm that, while other ""races"" can be mongrels, to be white you cannot be impure? And if one is pure, it is a betrayal of your kind by identifying as mixed-race (not to mention offensive to those who really are)?<br/><br/>Whether she intends to or not, I appreciate Ms. Dolezal's poke at how we define our differences and what that identification means to others.",-0.8695
185,"Ms. Harris is right.  Consider Michael Jackson who claimed his bleached skin was due to a skin disease or the treatment for it.  That disease is real, although whether or not Mr. Jackson suffered from it remains unclear, particularly given to what he did to his nose, surgeries so drastic that he lost part of it in the end.  <br/><br/>If a black person today underwent similar pain and the risk of disfigurement to ""express white identity"" would anyone be arguing that this need was in-born, similar in any way to being transgender, as opposed to a reflection of self-hatred, culturally imposed, a need to escape a feeling of being trapped in a society where being black still imposes substantial hardships and risks, a frantic attempt to run from stigma?<br/><br/>Would anyone -- white or black -- take that person's claim to be white seriously?  White people choosing to cross over is not the next new civil rights frontier.  It is a reiteration of privilege, white privilege, white superiority.  We get to do it; you don't.  ",-0.8699
186,"and: 53% of police who are killed are killed by whites <a href=""http://www.copinthehood.com/2015/04/killed-by-police-2-of-3-race.html"" title=""http://www.copinthehood.com/2015/04/killed-by-police-2-of-3-race.html"" target=""_blank"">http://www.copinthehood.com/2015/04/killed-by-police-2-of-3-race.html</a>",-0.875
187,The essay was off the topic - about appropriating feminism as a consumer strategy rather than about appropriating cultures. You have to buy that feminism is a separate culture to buy the essay as a response to the question.<br/><br/>But this comment is a complete non-sequitor. Think about it: <br/><br/>A. Cultural appropriation undermines the core culture (Thesis)<br/>B. Commercial consumerism undermines feminism (Response)<br/>C. Why isn't anyone worrying about miseries suffered by men? (Response)<br/><br/>Anyone have anything to say about cultural appropriation?,-0.8757
188,"Eric Garner was killed because of the color of his skin and how law enforcement deals with seemingly insignificant infractions of the law when race and social class are involved. It's as if the civil rights movement never took place. It seems that if society provided opportunity and support for all of its members, this dreadful killing would never have taken place.",-0.88
189,"I wish the NYTimes would fill in the gaps in this story, so all commenters could respond based on an understanding of facts:<br/><br/>Rachel Dolezal apparently did not begin to claim black heritage until after her unhappy experiences at Howard University, per one adopted sibling, who said she experienced discrimination and a lack of acceptance, as a white student.  She had been admitted based on her portfolio which was entirely black-themed, and Howard assumed she was, in fact, black.<br/><br/>Rachel is on the opposing side in a legal case against her biological, white, older brother who has been charged with sexual abuse of a minor.  Her parents support her brother's claims of innocence and he will be going to trial.  <br/><br/>Rachel has involved one adopted sibling in her lies by representing him to the world as her son, and asked another adopted sibling who visited her not to ""out"" her.<br/><br/>But it's not just issues of how she presents herself to the world.  She has repeatedly filed police reports claiming to have received hate mail and other threats, aimed at her and her household.  If these are false allegations she has repeatedly made false police reports--which are crimes.  She has thereby damaged the credibility of the organization she led and represented until today.<br/><br/>These are not negligible actions.",-0.886
190,"Do you have to be Black to understand the struggles Black people  have faced in America? If that IS the case, then we are doomed to failure in our efforts to end racial strife in this country.<br/>The question would seem to be....""Is she doing her job?  If the answer is ""Yes""...then what's the Problem????",-0.8992
191,"Janet, of course there is no single gene for race. A race is the largest grouping of genetically semi-isolated breeding populations. Which is to say it's rooted in biology and can be assessed by the frequency of polymorphisms and measures of genetic distance.<br/><br/>Also, to be sure, my DNA test shows that a percentage of my ancestors were relatively recent emigrants from Africa -- which is to say they were black, unless sub-Saharan Africans were a different color 200 years ago than they are today? DNA evolves and the term ""race"" refers to current or recent genes, not the genes of 200,000 years ago. Analysis of DNA is done to a specific target point, e.g., I believe 23 and Me uses 200 years ago -- which is to say, the breakdown is based on inferred population patterns of that time.<br/><br/>Basically, people are coming up with some very lame and different hand-waving arguments in an attempt to demonstrate that race isn't real, despite the fact that it is detectable on a DNA test (no one has gotten past that one) and that you'd have to blind not to see that an American Indian and a Hottentot are from groups that differ genetically.<br/><br/>Confirmation bias is a curse.",-0.9061
192,"And the nonsense just keeps rolling along at the Times, this bit if inanity goes off the rails pretty quickly. <br/><br/>Evil does not just reside in the soul or consciousness of “white” people. Evil resides in the souls of everyone. Mr. Caputo uses color as a political and historical club just like every other liberal. That his examination of man is so superficial that it stops on the surface of a person’s skin is appalling. Maybe white philosophers don’t look at race because that they know it is irrelevant to the true nature of man and that man has committed horrific acts like slavery and the holocaust only when he has made it relevant. <br/><br/>Mr. Caputo quotes Hannah Arendt “about long arm of thoughtlessness, which she ventured to say reaches as far as the death camps”. However, Arendt was talking about a specific time and place and a specific generation of Germans who thoughtlessly allowed evil to grow in their midst. It was a warning to future generations but she wasn’t asking for mea culpa’s from Mr. Caputo, she didn’t believe in generational guilt. We won’t get to the world Mr. Caputo envisions by guilt tripping people. <br/><br/>Mr. Caputo, the Times and just about every other liberal today thinks we should take care of the poor and the disadvantaged because as whites we should feel guilty for the past, I think we should do it because we are supposed to love all men regardless of the color of their skin. ",-0.9153
193,"---the stigma of mental illness<br/><br/>I am not sure why people want to disguise prejudice as ""stigma"". I suppose it is to keep from acknowledging their prejudice.<br/><br/>I am not sure why people against whom a prejudice is directed want to disguise it as ""stigma"". <br/><br/>It is not as if we had not encountered that disguise before,",-0.9173
194,"Here is another ""conversation:"" Americans did not sail to Africa under the confederate flag and start rounding up black people.  The Black kings of Africa enslaved blacks in Africa and they sold their product all over the world.  American whites fought and died to free the slaves, among MANY other issues that caused the Civil War.  Most folks suffer from selective amnesia regarding these facts.",-0.9182
195,"Ms. Bennett’s article did a fine job of advertising the release of her debut novel, but otherwise it has no merit.<br/><br/>Her article, and the content of some of the replies posted here, would have us believe that the United States is a sick place and that white terrorism is fundamental to our social fabric. But I do not see it that way. This country is as healthy as they come, thank you very much. To follow the logic of Ms. Bennett’s polarizing diatribe would be analogous to burning down a beautiful garden just because there are weeds growing in among the favored plants.<br/><br/>I believe we will deal with the armed lunatics who kill people in movie theaters, on school grounds, and in churches. And we will not let their insanity cripple the rest of our society. Nor will we accept the absurd idea that we are a country of white terrorists.<br/><br/>To do otherwise would be an insult to the memory of Abraham Lincoln, and the thousands of other white people of his generation, who lost their lives in an effort to help black people and to end slavery in this country. ",-0.9228
196,"I agree with many of the comments here that speak about the stifling of any genuine participation on the part of ""white"" people (notice that we, too, are lumped together regardless of our cultural variation). Many, many ""white"" people have not led lives of privilege (the highest rate of poverty in this country is actually among white people). Most of us come from families that fled oppression and poverty in old world caste systems. We are not the descendents of slave owners; our ancestors who arrived here were persecuted, too; and we are struggling only a few steps ahead of ""black"" and ""brown"" people as our tenuous middle class standing is ripped out from under us by corporate greed and politicians from the millionaire class. So, while we understand the advantages we've had, and abhor the injustices we see and support the struggles of minorities, we already feel powerless in our own lives. Making us constantly apologize is not a dialogue. Equating this as a class struggle, while denounced as ""socialist,"" is actually quite appropriate. More appropriate than the one-sided PC so-called ""discussion"" the media is foisting on us.",-0.93
197,"This op-ed is really racist.  As usual, Times people can never put issues in front of race.  Do I think Trump is a racist?  No.  Trump is just telling us what is wrong with immigration, black, white or brown. ",-0.9311
198,"It is often difficult for white people to talk about race because any deviation from a somewhat leftist and PC perspective is immediately labeled as racism and bigotry. If one doesn't believe that race should be a factor in college admissions, or that it is reasonable to have to present ID to vote (to cite just two examples), and one has the conversation with others who disagree, all to frequently, the charge that one's position is founded on racism or bigotry comes up. There are legitimate and non-racist arguments to be made for both of these issues, but when the immediate default position is to accuse me of racism for these views, then yes, a conversation is going to be difficult.",-0.9354
199,"I venture a guess that most ""white"" philosophers fear discussing whiteness or white philosophy because anything positive they might say about cultures or philosophies  that spring from cultures that are ""white"" would be branded racist.  Lets face it, being white is viewed as being an undercover racist even if you support civil rights, equality under the law and have relatives that marched with Martin Luther King at Selma.  Allowing a negative comment to escape your lips about cultures associated with ""blacks"" or nonwhites  even if it springs from an objective assessment of the facts brands you a racist. <br/><br/>Now it appears that not talking about it makes you a racist too. There is no question that there are racists, vile and violent (the murdererof 9 human beings because of their race in Charleston is a good example.) but the word and accusation is overused.   I sure wish we would ditch the names and work on the issues that lead to income inequality and the rise of corproate control of our country but then accusing everyone of being a racist is so much easier.",-0.9404
200,"While I'm no Huckabee supporter, it's Mr. Rosenthal, and others like him, who misses a very important point -  as long as Black Americans continue to invest so heavily in being victims and always blaming everyone else for their predicament, they will never rise up from it.  We white Americans aren't allowed to raise the issue of ""personal responsibility"" because even that phrase is seen as racist, and while much good is coming from the BLM movement (changes in police tactics and logistics, etc.) I think the movement a complete failure if it's only about perceived police oppression and not also about the incredible criminal activity and dysfunction in so many minority communities.  Both sides have to acknowledge their contribution to this situation or there will be no enduring resolutions.",-0.9404
201,"Professor Dyson,<br/>For the life of me, I cannot fathom the huge divide which continues to exist between Blacks and conservative White  Republicans. They preach so cavalierly about what Black folks need to do to rid themselves of the ghetto mentality which has somehow kept them in the ghetto through no fault of White folks, who initially banished them there. <br/><br/>Bring up the removal of the Confederate flag to the governor of South Carolina and she plays the avoidance game, and has the nerve to tell us this is a time for healing and mourning and not a time for politics. It is this obstructionism, not listening, falling on apathetic Republican ears, which foments mistrust and lack of support. <br/><br/>When on FOX ""News"" the governor of Louisiana blames President Obama of all people, for playing politics by bringing up Race and Guns, two white elephants so obvious to us all, and accuse the President of inciting racism,  please, how stupid do Republicans think Blacks are?<br/><br/>Perhaps Republicans believe this will all blow away shortly, that Blacks will forgive and forget the hypocrisy being preached at them, forget the injustices, the lack of respect, the accusations that 95% of us vote Democratic so why bother paying us any attention.<br/><br/>Maybe when the Republican/FOX ""NEWS"" axis stops attacking people whom we admire, from President Clinton to President Obama and Hillary Clinton, and remove a symbol of Slavery and Treason, maybe then we will listen. But I wouldn't count on it.<br/><br/>DD<br/>NYC   ",-0.9423
202,"Still, there's the question of why she must perform this racial kabuki to feel as though she's a legitimate purveyor of the message of racial tolerance; not to mention the problem of her veracity. If she goes around protesting things like racial animus and falsely claims to have been a victim of hate crimes (thereby casting doubt on the legitimacy of actual victims of true hate crimes and acts of racial bigotry), either she's got a problem, or we've got a problem, or both.",-0.9493
203,"Not at all analogous. Black Americans, including the president and his wife, have often been subjected to vile racist comparisons to apes.<br/><br/>The title ""Primates of Park Avenue"" is a witty way of saying that the book (supposedly) takes an anthropological approach to a group that ordinarily does the studying, rather than being studied. Or at least it tries to be witty. <br/><br/>""Primates of Harlem"" would not have that purpose, and because it would elicit the iconography of racism, it would be in exceedingly bad taste.",-0.9493
204,"It is simply the continuing legacy of white supremacy that sees people of color in generally, and black people specifically, as the enemy and less than.<br/><br/>The white supremacy lens refuses to see or acknowledge black suffering and pain, because to do so would mean that America would be looking at itself.<br/><br/>This society was built from the beginning with racial oppression as a central part of its societal structure and it still remains as a foundation of this country.  <br/><br/>Beginning with the genocide inflicted upon the indigenous people of the this land to the forced enslavement blacks, to state sanctioned segregation of blacks, to state sanctioned lynchings of black men, woman, and children, to state and federal mass incarceration of blacks and Latinos, and to state sanctioned killings of unarmed black children, women, and men by bullies with guns and a badges, the oppression of people of color is a major piece of the American fabric.",-0.9517
205,"I don't disagree with you. But the problem is that all discrimination is subjective. There is no fact based reality for any of it. Unfortunately we (the human species) are still tribal people and tribal people have always viewed the other as an outsider to not be trusted.<br/>As long as we remain a tribal culture, there will always be hate and discrimination against someone else. Quite frankly, I don't see that as ever changing. Just as we evolved in social skills and other areas, so did we evolve with the outsider to be feared.<br/>One can fight those forces, but one can never do away with them completely. Just like we all have what people call good and evil in themselves, we can only choose to act upon what we fear or love. But it will still be within us, no matter what behavior we choose.",-0.952
206,"This cop wants to know stress?  <br/><br/>Then exchange places with a Black male stop by cop who exhibits his racist character or exchange places with the young Black woman that he slammed to the ground!<br/><br/>If it's not stress, then it's that they feared for their lives when coming in the presence of Black people.<br/><br/>Any pathetic excuse will do. ",-0.9565
207,"No one is the victim of more racist criticism and ridicule, than the poor black man or woman who dares to strike out on their own and attempt to work inside the system to become successful.<br/>Dont believe me?<br/>Define the black community's insult,,,,, ""acting white"".<br/>""uncle tom"" of course is the older version of this insult, but there it is.<br/>Nothing can be more hurtful to a black man than if another black man accuses him of ""acting white"".<br/>What exactly is ""acting white""??<br/>Seems like I've had to do this every waking moment of my entire life!<br/>Doesnt it just mean ""american""?",-0.9569
208,"Phi Z: No, ""the racism of the worst kind"" is the racism of the folks who imposed the unequal caste system of social privileges by racial appearance and ancestry. Generations after slavery no longer legally exists,  the island of Hispanola shows that the legacy of caste by color thrives. Descendants of the most exploited slaves of the slaves (and mixed-race freedmen like the family of Alexander Dumas) have adopted a practice associated with their former slave masters. ",-0.9577
209,"Leaving aside whatever else Ms. Dolezal has done in other aspects of her life, let's focus on her ""I identify as black"" statement.  It is problematic that she went from feeling an affinity for African-Americans, to claiming to be one.   But some (not all) of the anger, indignation, offense, is misplaced.  Did Ms. Dolezal institute the ""one-drop"" rule?  She did not, so why blame her for it as though she supports it. So Ms. Dolezal reminds Ms. Harris that race is not malleable and I am reminded, too.  But we can place anger about race being malleable only in one direction at folks more deserving than Ms. Dolezal.   And sad to say, there are so many.",-0.958
210,"The NYT likes to promote the benefits of diversity. However, it rarely acknowledges any counter argument. Out here in suburbia though, diversity is not ""all good."" With greater diversity something has been lost. It's hard to establish trust and common ground between people. Having shared traditions helps. These traditions were once common bonders, but they have been extinguished (like our neighborhood wide holiday caroling party). The minority racial/ethnic groups hold their own gatherings (at Chinese language schools, for example) while the whites are left out in the cold. No one complains when the ""norm"" gets hurt.<br/>Westchester has been harshly labeled as ""racist"", for its natural instinct to prefer its own. No one else is held to such a high standard though.<br/>Spike Lee gets applauded for lamenting the Black loss to gentrification in Brooklyn, while whites are called out as ""racists"" to minimize the problems that come with  low-income housing. It's unfair. Struggling, upper middle-class whites are under assault from every direction and they have very few tools with which to protect themselves. The one-sidedness of the NYT only makes things worse.",-0.9581
211,"Crime is bred from economic hardship. Sad as it is to say, you have only to look at the racial makeup of the poorest boroughs and neighborhoods to understand the imbalance in race when it comes to stop and frisk. That doesn't make cops racist. It just means there are more black and latino males living in the underprivileged neighborhoods who turn to crime. This is itself a tragedy, and without going into a broader sociological discussion on race and income, I want to refute the idea that police investigation is racially driven. ",-0.9583
212,"SV/VR,<br/><br/>Black people have been apologized to continuously since 1960s both here and in Europe. Our current president has been nothing but such apology twice, so has been the affirmative action aka self-oppression by Whites.<br/><br/>There will NEVER be any apology to White people for Ferguson, LA, or Chicago riots and carnage; or for murders, rape, and dispossession of White farmers of Zimbabwe and S. Africa.<br/><br/>Jus as there never was any apology by slaves of Rome who turned on the very masters, who freed them, killing them and destroying their houses along with one of the greatest civilizations in history.",-0.9673
213,"Why do innocent people have to be murdered by a racist terrorist before we have this supposed ""enlightenment"" that maybe we should do away with symbols of racism, and eventually, racism altogether?  How many murders are ok?  How many people have to pay with their lives before we decide that enough is enough?  <br/><br/>Maybe it's time to embrace a different paradigm in this country...",-0.973
214,"I was with you until you mentioned black racism.<br/><br/>Seriously?<br/><br/>White racism has a much higher body count. It's also a matter of simple arithmetic: There are almost ten whites for every black American, and the whites are still the ones with all the power.<br/><br/>I'm not even positive you can call it racism when a person is constantly confronted with evidence that the group in power is out to beat, imprison and/or kill people just like him. It's not a matter of thinking that one race is superior to the other so much as fear driven by an instinct for survival.<br/><br/>So let's start there. It's possible that as we rid ourselves of white racism, black racism will start to diminish, too.",-0.9753
215,"Robert Tyler, you realize don't you, the constitution and bill of rights, was written by and for, rich, white, men, who owned LOTS of property.  Many  owned, bought, sold, raped, murdered, lynched, beat and enslaved with impunity, other human beings who were black.<br/>(These same ""founding fathers"" justified the massacres and genocide of indigenous populations of this continent, by calling them ""savages"", many of whom had been living here for *thousands and thousands of years. *Note - Probably somewhere between 15,000 and 30,000 years or more.)<br/>And you realize, don't you, that powerful social conventions and justifications arose from that original hierarchical social structure, and in the aftermath of that genocide.<br/>You don't have to be a philosopher to realize those powerful social conventions and justifications don't disappear overnight.  In fact, even 150 years after the abolition of slavery, many of the surviving attitudes of those times, live on.  Lingering racist attitudes include the mistaken belief that black people are inherently ""lazy"", ""ignorant"", ""unskilled"", ""criminal"", etc..<br/>I am caucasian, living in a fairly ""tolerant"" region, (N. California) but i've seen and heard, many examples of racist attitudes that continue to live on.. ie. i grew up in a ""liberal"" household, my parents had black maids, and ""house-cleaners"", but they did not have black friends. Even though it was something i more or less grew into, i was a teen-aged racist.",-0.9762
216,"Hey Charles, the theme of your column is that white people target blacks for race influenced killings even in 2015. You evoke the brutal killing of Emmett Till, some 60 years ago, to support your case that we really haven't come that far in race relations.<br/><br/>Till did not run from the cops. He did not break any laws. To my understanding, he had no criminal record. To compare his murder with Travon Martin and Michael Brown, etc. is ridiculous. Apples and oranges.<br/><br/>And I am still waiting on race baiters like you and Reverend's Jessie and Al to wax poetic on the senseless murders of inner city blacks at the hands of blacks. ",-0.979
