,comments,scores
0,"The point of dialogue is not simply to share points of view or experiences. We have now reached a point in time where real structural change is critical, not only to black people but to the nation as a whole. So for me dialogue needs to focus on what policies continue to reflect and reinforce white domination and how we can come together to change them. In high school I was part of a ""Human Relations Club."" That was over 50 years ago and its premise was since we lived such separate lives it would be good to come together and share things we had in common.<br/><br/>While that's all well and good, it won't change the policies of mass incarceration and the racialized manner manner it which it is carried out. Nor will it change policing policies to require policing methods based on service, community involvement and community cooperation. Some police forces do this and have few racial incidents, but many don't. That needs to change.<br/><br/>Health care is crucial to all but as a commodity it is measured out with profits and privilege in mind. This literally costs black lives, as do environmental policies that overload minority communities with toxic materials.<br/><br/>I welcome a dialogue about race on these issues. As we work to better understand just how racialized many public policies have become I expect that many whites will proclaim that they never knew this was being done in their name. This struggle for justice for all of us is the new common ground for better racial understanding.",0.9832
1,"Anne, you have some unusual friends!<br/><br/>I founded an organization in college called HAPA (the half Asian people's association) in a playful riff on both the proliferation of ethnic-specific student associations and the Hawaiian pidgin word for 'half.' Of the many scores of multi-racial students I interacted with, none identified solely, or primarily, as white. Almost all identified as X-American, where the ""X"" might be African, Asian, Mexican, etc. Many identified as bi/multi-racial. Of course this was at a very diverse school, and differences were celebrated, so there was safety in differentness. And that really seems to be the root of the difference. People often identify with the culture in which they were raised. Asian Americans whether biracial or not often work with and live near many Caucasians. They don't identify as 'white' but feel perfectly comfortable operating in that world. Uniquely, African- and Native-Americans still often live in segregated fashion, so whether someone is bi-racial black-white or 'just black', they often spend inordinate time around the black community, which naturally shapes their identify.<br/><br/>I think your friends' response is very far from the mainstream with respect to how most bi-racial Asian Americans would respond.",0.978
2,"Claudia Rankine: Thank you so much for telling the truth about this story. The best quote which I am going to frame in my head and on my wall is: “The notable difference between black excellence and white excellence is white excellence is achieved without having to battle racism.”<br/>I have been through that, and it is even more difficult if you are black with an accent. They approve of the accent of the Europeans but not the non-Europeans. One of the best articles ever!!!",0.9585
3,"The whole premise that culture can be stolen or borrowed is based on ignorance of history. Should native Americans give up technology and stylistic influences that are post 1500? Should African Americans give up the tempered musical scale developed in Europe? It seems that only whites are being asked not to borrow, and then only certain popular themes like dance moves or hair styles. <br/><br/>Even worse, who owns culture? Do you need to have a certified pedigree or DNA analysis to adopt cultural themes? Or a politically correct stance before you can, say, buy certain clothes or dance a certain way? Or did you have to grow up in a certain neighborhood? All this flies in the face of our basic American value - freedom to express yourself, freedom of speech. My clothes, my accent, my music, my furniture, etc. is my way of expressing me, politically correct or not, and THAT is the core of what makes me American. ",0.9465
4,"There seem to be some parallels with the affirmative action debate in the US, particularly this: ""Many Patels, Hardik included, readily agree that the government should give extra help to poor families, regardless of caste. They object, however, to India’s quota system precisely because it is built around caste, not economic status."" <br/><br/>It's a commonly heard argument against affirmative action in the US, that economic class should be used rather than race. That a parallel argument is made in each society might point to some common root cause, namely the deflection of the respective privileged groups. <br/><br/>I wonder if that argument exists to sanitize their opposition to caste quotas or affirmative action, while seeking to minimize the role of the caste system or racism in limiting people's opportunities. In essence, saying that really economics alone is what's important, as if someone who is relatively affluent but is from a lower caste in India or black in the United States has the same opportunities as a person of higher caste or a white person respectively. <br/><br/>That each privileged group is more comfortable with economics as the cause of inequality than caste or race might suggest just the opposite.",0.946
5,"Race is the lie that has been used to justify genocide and many ""well meaning"" white people have historically and to this day fell for it. Ethnicity is a diferent type of classiification based on culture, language and cultural geography, shared social practices and geographic origin. Many white Americans are just flat out confused when it comes to race except when they are committing race-based crimes against humanity, whereas Ms. Dolezal appears to be one of the least confused about race. Genetically, we are all mutts and can interbreed, hence there is only one race, the human race. Spread the love, not lies and war. Peace. ",0.9243
6,"Racism can be applied to other people of color. In my community, with a growing population of Hispanics, we see bigoted attitudes towards them. (African Americans are a small population in Utah.) And yet... when people are polled here, the majority think race relations are good. Their opinions do not reflect the experience of many Hispanics. Perhaps they think the questions only apply to African Americans. Most people want to believe that they are not racist. Recently a seemingly tolerant, ell-educated friend returned from his annual vacation in  Newport Beach and remarked that ""Mexicans"" are taking over California. He would be surprised to be called racist. But he is. We are having our own controversy over Dixie State University in St. George, Utah. Many people love their Rebels.",0.8992
7,"There is a a very simple reason why Trump is popular with the Republican base. Like other plutocrats such as the Kochs and the Waltons, he has spent his entire life perfecting the moral justification of unearned wealth. The corollary of that life quest is the moral justification of the poverty of those who do not inherit wealth whether they work or not. The white Republican base never tires of hearing implicit moral justification of white privilege and black poverty. That racial rhetoric, blunt or coded, is second nature to Trump.",0.872
8,Nearly 60 years ago my parents accepted a request that they enroll my sister and me in a majority-Black YWCA summer program for low-income girls.  We two white sisters were meant to be part of a desegregation effort.  My life was immeasureably enriched by this introduction to children whom I otherwise would never have met.  It predisposed me to be far more open-minded and interested in subsequent studies in boarding school and my universities.  Thank goodness I wasn't confined to the homogeneous environment of my own cultural and economic background!,0.8707
9,"This is not the first instance of a ""race change"" from white to black. Fans of the old ""Kudzu"" comic strip may remember that Nasal T. Lardbottom, the Cartman like character of that strip had a ""race change operation,"" so that he could dunk basketballs effortlessly and ""high-five"" without injuring himself. <br/><br/>One of the funniest ""Kudzu"" strips showed Lardbottom in his High School  language lab, where other students were practicing their French and Spanish, repeating ""Ebonics"" idioms: ""What it is!,"" ""What it be!"" and ""Yo Momma!"" Maybe Rachel Dolezal, like Nasal T. Lardbottom, could star in her own comic strip on the ""race changing"" experience!",0.8679
10,"Small but important edit needed: The law doesn't protect certain groups from discrimination.  The law protects people  (i.e., all of us, depending on which law we're considering)  from being discriminated against on certain bases - race, gender, religion. So just as black people are protected against being discriminated against because they're black, so are white people protected against being discriminated against because they're white. Just because the former occurs in the U.S. more often than the latter doesn't mean ""certain groups""are being protected against discrimination.",0.8504
11,"The NAACP was founded by white people too ... The mission and purpose of the NAACP isn't to advance the well-being of black people (though that's a part of it). The mission and purpose of the NAACP is to work with other like-minded Americans toward fulfilling the promise of a living together in a more perfect Union. In any case, Americans (black and white) are too focused on race rather than on character. Where's MLK when we need him? You know, ""judge a person by their character and not by the color of their skin?""",0.8501
12,Right. Because for the last 500 years white people have done a splendid job of protecting people of color. We feel so safe. ,0.8196
13,"great, not even mention about asian, it seems like the race relationship only exists between black/whites. too bad, even electing a black president can't solve the proble, what would american do next?<br/>I sincerely wish somebody will read history book, the problem hasn't been solved in the past 5000 years, clearly, it won't be solved in 500 years neither, maybe we can encourage interracial marriage by cutting tax on these couples. ",0.8166
14,"Brought up with white privilege, she used this to her advantage to climb the employment ladder, sell her paintings, and speak out in the media. If she had been a volunteer or low-level employee for NAACP, that would be honorable, but she used her white privilege to assume she could lead the organization and be their mouthpiece. All the while pretending it didn't exist.  I find that reprehensible. ",0.81
15,"Well, not YOUNG, but at least solidly middle aged. The Founding Fathers were very sound in setting the minimum age at 35 (considering what 35 meant in 1789).<br/><br/>45 is about right on the younger side, assuming one has been a Governor or something other high level management job -- and 65 is about the MAXIMUM, because you are expected to serve EIGHT YEARS. Unless you want to end up senile like Reagan.<br/><br/>Meaning Biden -- and Hillary -- and Sanders -- are all way too old. And too white and too rich. They have no appeal AT ALL for blacks or hispanics, and plenty of white people dislike/distrust them.",0.81
16,Great point Dave.  It's pretty much how lots of folks reacted to interracial marriage in the 40's and 50's too.,0.8074
17,@mjb<br/>Johnny is talking about cultural diversity whereas you are talking about genetic diversity. Genetic diversity is good like China. Cultural diversity is bad like the Soviet Union. Think how successful your platoon would be if everyone have different opinion,0.802
18,"Yes, that's it.  Like dem black mammies, having chillun all the livelong day, way down along the Sewanee River....",0.7845
19,"MLK believed in non-violence, he wanted equality where folks of all colors would be on the same level- educated, well-spoken, god-fearing, dressed for success and married raising children. <br/><br/>Even Richard Nixon had better policies than Hillary, believing in Black capitalism, ""because Black capitalism is black power in the best sense of the word. It leads to Black economic influence and Black pride"".<br/><br/>Hillary's fighting for Hillary. She'd pretty much say or do anything to get elected, feigning support and speaking in riddles to avoid pissing anyone off. She's just too dishonest for me. Bah!",0.784
20,"Why SHOULD we trust the government? It's made up of people, with their own individual and group interests, just like every other organization in society.",0.7783
21,"Do you think white people should not go to historically Black universities? Or do you only object because she pretended to be Black?  I am truly curious, not trying argue. ",0.7647
22,lets talk about Light black privilege.  Yes that the lighter blacks have it easier /privileged than dark skinned blacks.  Its well documented with in the black community.  Once you start with identity victimhood it never stops.     ,0.7611
23,Your perspective is a bit narrow.  The entire concept of race is a nineteenth-century artifact of social sciences at that time. Most of us who consider ourselves of European descent have more in common genetically with those of African descent than those of other ethnic and racial groups.<br/>Why do you care how she chooses to identify herself? If affirmative action is such a great deal how come there aren't droves of European Americans jumping at the chance to declare themselves as African American? what harm has  declaring herself an African American caused?,0.7461
24,"This is about two rich guys with egos the size of Texas. BUT, I'm glad that you were able to find a racial issue. And that you have concern for The Blacks.",0.743
25,"Black and black crime is a function of the gun lobby dumping upwards of 300  million guns into America's streets, redlining blacks and other minorities into ghettos for decades (centuries?) and sending blue collar jobs to China, Mexico and elsewhere thanks to free trade/trickle down economics. Those black and minority communities are filled with young, unemployed and anxious and stressed people with easy access to guns. Gee - what the heck do you think is going to happen? <br/><br/>And many whites simply say/think, ""those animals are just killing themselves - so be it.""<br/><br/>Those are not bugs of that system but features. <br/><br/>Conservative intellectual William Buckley once told Gore Vidal that inequality is the byproduct of ""freedom"" - he was correct, we are seeing that idea play out in America on a daily basis. <br/><br/>Are conservatives (including Dem conservatives) and the GOP prepared to roll back trickle down economics, return the tax code to sanity and stop the aggressive hollowing out of American's working and middle classes via free trade? <br/><br/>Because if not, then the answer to inequality is the free trade/trickle down economics mitigation plan - guns everywhere, segregated neighborhoods and schools for whites and an aggressive, racist police state for blacks and other minorities.",0.7041
26,"My feeling is that this woman should be left alone.  She was outed by someone who was unhappy with her choice and the publicity has played into the hands of that person or persons.  By all accounts, she did a great job and is a good person.  I am disappointed by the condemnation she has received.  I do think this situation has been of great service to the country.  It is long past time we had a real discussion about race and privilege.  It is not black and white.",0.7003
27,"Once again, please remember that a good number of Hispanics ARE white, White Cubans, most Argentinians, etc. - if their ancestors had come straight to the U.S. there would never be a debate whether they are white or not. They are White, they are treated as such, just benefit from checking the minority box. This is problematic because there are many people of color who continue to experience discrimination. White Hispanics being counted as a minority masks this. And as Alba points out, the one drop rule continues to matter for those of African ancestry. We need change, real change!",0.6996
28,"why do so many blacks and other minorities (a misnomer but more about that later) vote democrat?  because they don't have to think about it.  they get favors and money and eat at the trough.<br/><br/>as for the term ""minorities"" the people who wrote the civil rights act were brilliant (but flawed) in that the term ""minorities"" relates to a federal aspect of the number of non-white races in the country.  however if you live in dc and are white then YOU are the ""minority"" but have no special treatment because of the federal jurisdiction of the term ""minority""<br/><br/>brilliant.  flawed.  shame.",0.6956
29,"President Obama's relationship to Kenya is complex - how deep his connection to his Kenyan father went, how he also identified as the child of an American-born Caucasian mother - and it is precisely these levels of nuance that add to Obama's intelligence and insights as a leader.  Even in 2008, Obama made clear that his personal background gave him unique understandings about people and about life outside the US.  From a foreign policy based on assessments of a world that is complex and not managed by reductive thinking and one-size-fits-all policies, to his hold of racial relations, the complexities of President Obama's life have made him a standout. ",0.6908
30,While there's been talk for some time of the Republican party being taken over by the extremists this is proof that the pendulum has swung far to the left in the Democratic party. It's radicalization has begun and the impetus is the black lives matter movement.,0.6705
31,"WOW!  Any of you out there who are not offended by Gay's article are fanning the flames of racial strife and conflict.  If you are white and are not offended by this race baiting article that portray's the white community debtors to the black community as soon as they are born; you are missing something.  If you are black and are not offended by being linked to imbeciles by Ms. Gay, you are missing something as well. ",0.6646
32,"??""The white mind is incapable of displaying empathy for non-white people...."". <br/><br/>When someone says ""The X Mind"" it is racism, prejudice, etc. regardless or what ""color, ethnicity, etc."" the ""X"" is. <br/><br/>I appreciate your outrage, which many of us share, but please don't forment more hatred. This is a time to realize that people of all colors are disturbed by what happened in Charleston; I hope that is used consructively.",0.6638
33,And it know it is pretty common for Africans to plunder Africa and it seems it is ok.,0.6597
34,"Oh please!  I'm a light skinned black man who could pass for white if he wanted to and I think Dolezal's story is hilarious and pathetic, but mostly hilarious.  Her story keeps reminding me of a line Chris Rock used during one of his riffs on race...<br/><br/>""There isn't a white man in America who would trade places  with me, and I'm RICH!"".<br/><br/>Well, I guess Chris should have asked more white women from Idaho. ",0.6467
35,"We know what her patents look like and their basic background. The DNA treat will prove nothing, other than perhaps she is one 64th black or whatever. <br/><br/>I'm an eighth Irish. It does not make me Irish.",0.6369
36,Please tell me where on earth Blacks are treated better or given more? ,0.6369
37,Please will always be judged by the color of their skin and not their contributions to a better society. ,0.6369
38,Was this woman looking for acceptance or advantage? A chameleon changes color in order to blend into the environment a matter of safety-a politician changes stripes for votes. Ms. Dolezal appears to be both. ,0.6249
39,"A number of years ago, I worked with a predominantly African-American school district.  Because of my position, I presented at the graduation of a middle school with 98% African-American children.  One of the things I began with was:  I look white, but we are all out of Africa—so I am Black.  The children knew me and the children cheered.<br/>I’m married to a Mexican-American man and have a Hispanic last name.  I have a little Native American ancestry from my mother’s side.  My father’s family was from Virginia and given the amount of black crossover, many of us (as reported in the Upshot section the NYT) carry traces of more recent African-American ancestry. I concluded that as a possibility, but it was nice to see it verified in the Times.<br/>I have never checked anything but white on college or job applications.<br/>But, we are indeed all Black and out of Africa. Maybe it’s time we all thought of ourselves as Black.",0.5927
40,"The original ‘‘Star Trek’’ pressed for racial equality, which was one of its best characteristics, but it did so without sermonizing?<br/><br/>CLEARLY Mr Cruz has never watched Episode 15, Season 3; ""Let That Be Your Last Battlefield."" The aliens who are white on one side and black on the other? THAT'S not sermonizing?",0.5845
41,"Not sure how you missed out on NWA. Perhaps you're a little far removed from pop culture on top of being old. Oh sorry... I'm probably not acting in line with your standards imposed on the ""urban community."" And FYI–the police aren't just terrorizing black youth, they are terrorizing blacks, period. ",0.5828
42,"The white privilege behind that comment is stunning.  If anyone can define themselves as being a member of any race or ethnicity, such traits will no longer have any true meaning.  You cannot call yourself African-American just because you want to, having paid none of the dues of experience, upbringing, and DNA-embedded history that contribute such a huge portion of meaning to that term. I can say I'm 'WrongSpecies' and claim to be a bird, but when I jump out the window to fly, reality will catch up to me rather quickly. ",0.5647
43,"There's only one treatment that works for the condition known as pseudofolliculitis barbae, which is an endless, unsightly and often plain painful round of dealing with ingrown hairs. (Any chap with very curly hair can have it, black, white, or whatever. Take it from this tightly curly-haired paleface.) And that treatment? Grow a beard.<br/>Granted, in my time (the '60s and '70s) that pretty much disqualified you from a corporate career, and it seems to do so now, too. From what I've seen happen to friends who went THAT route, I'd have to call it a side benefit.",0.5574
44,"I love how people (typically white conservatives) keep whining about the media reporting this, as if racism would magically go away if we ignored it. They used the same argument in the 1960s, back when they referred to MLK as a ""dangerous, race-hustling communist.""<br/>By the way, these poll results shouldn't surprise anyone. After all, last summer a Pew poll showed that almost 80 percent of white Americans don't have a single nonwhite friend.<br/>When it comes to race, there's always a remarkable unity among whites, regardless of political affiliation. After a racial controversy, you always see polls showing that 70 or 80 percent of white Americans agree in one way (support for the Trayvon Martin verdict, for example), while blacks see it otherwise.<br/>Whites liberals and conservatives are largely in agreement on race, only their styles are different.<br/>Malcom X was right.",0.5402
45,There is a fundamental difference between passionately identifying with being Black versus claiming to be Black.  Why is this concept so complicated to comprehend?,0.5267
46,"This incident has sparked a major debate over the social construct of race. In the case of Ms. Dolezal I think we have to consider several complexities that have turned this issue from a simple case of I identify and empathize with African Americans into I am African American and can identify with the everyday struggle of racism in America.<br/>Race as a social construct has historically been used to oppress, classify and discriminate against people of color. When we make the agreement that this is simply about race being a social construct, therefore Ms. Dolezal’s actions were harmless it completely undermines the African American experience. It negates the fact that our struggle in America is based on race which has been socially constructed and defined by the color of our skin<br/>Through Ms. Dolezal’s black face charade she figured out that being a light skinned, light eyed black woman would be more beneficial to her career In African American studies. This masquerade caused her to manipulate, deceive and concoct elaborate stories of racial discrimination. However, she conveniently omitted the period of her life where she did identify and classify herself as white and sued Howard University for racial discrimination. Ms. Dolezal has managed to become a master of disguise for her own personal gain. While I do not consider being white a privilege, it does come with privileges and economic advantages that most people of color are not afforded unless your name is Rachel Dolezal.",0.5106
47,"Well race matters to a certain segment (not all, or even a majority) of cops, so there's that.",0.5106
