,comments,scores
48,"While most of us feel that we were born into our gender, our race, and our class--both burdened and privileged by unchosen identities--there have always been people who were born ambiguous or mixed, people who found ways to cross boundaries, people who were torn from or fled from their birth-lives and remade themselves--remember the story of Joseph living as an Egyptian? The kindness showered on Caitlyn Jenner should be offered to all those who try to ""pass"": the blacks who passed as white, the Jews who passed as Christians, the poor child who becomes rich, the rich child who  ""slums"", the immigrant or expat who speaks in local slang, the old man with the fake hair, the woman with the pumped-up lips. Whatever historical, sociological, or psychological explanations we might have for their behavior should be kept tactfully to ourselves. ",0.4939
49,Poignant?  It's an offensive falsehood.  The amount of aid that the U.S. gives to African nations for the benefit of African people dwarfs the money given for animals.  The notion that Americans care more about African animals than African people exists only in the author's mind.,0.4939
50,"""And why aren't I a member of the NAACP? I believe strongly in equal rights. I admire and agree with its work. But it never occurred to me that I, as a white person, would be wanted as a member. ""<br/><br/>Thankfully, it did occur to the organization's founders. Click here for a lesson in irony: <a href=""http://www.loc.gov/exhibits/naacp/founding-and-early-years.html"" title=""http://www.loc.gov/exhibits/naacp/founding-and-early-years.html"" target=""_blank"">http://www.loc.gov/exhibits/naacp/founding-and-early-years.html</a>",0.4678
51,"In the US Black is a culture as well as a race, one can be African American and not adopt or relate to the black culture, one can be white but adopt and relate to the Black culture or one can be both. She is obviously she has adopted the Black culture but is white. Happens all the time with Hispanics. I would accept her at her word.",0.443
52,"Race relations were better? Issues having to do with race were hidden from you, more likely. ",0.4404
53,"This author acts as if he won the war and the conservatives are isolated.  However, the Supreme Court via Kennedy cut off democratic discussion of this topic and imposed its will on all of the states.    Some Black LGBT persons have argued that this Supreme Court decision is a win for white supremacy and that this fight is not the fight for black lives.  I think that Obama and others have used this marriage fight as a distraction or excuse not to fight for black lives in other civil rights areas and that Obama feels he is free to discriminate against blacks.  For those who are christian and feel the need to defend their christian faith, a Supreme Court decree does not mean that the fight is over and/or won.",0.4404
54,"Thanks for this summary, Rachel. ",0.4404
55,"I hope for a South that can find its unique cultural identity while leaving behind the minority frozen in the Jim Crow past. Too much political capital has been invested in this subculture, starting with the revolting Southern Strategy of Atwater and Nixon.<br/><br/>Maybe it will take some reconstructed personality to lead the way. How about it, Paula Deen?",0.4404
56,"this article is a typical charles blow article, a panoply of excuses for criminal behavior in  the black community.  it is always some outside power that is responsible for anti-social behavior. poverty is not an excuse for criminality. it is questionable even whether true poverty exists in america in the large urban areas.  between food stamps, free lunch , free medical care free education and myriad benefits including free cell phones and 250 free minutes a month  automatically for anyone on medicaid. there is little to complain about. while it cannot be denied that people fall between the cracks or people make poor eating choices  at food pantries per article in nyt, poor people particularly the urban poor have pretty easy lives.<br/>as to racial skew in the use of force typically charles blow has no statistics to prove his case"".unarmed African-Americans were more likely to be shot and killed than whites or Hispanics"" of course the numbers are not likely to be the same.  the difference is never even discussed. for all anybody knows from this article the difference could  be minute to the point of being  statistically insignificant.   ",0.4334
57,"Maybe it's time to abandon the idea of race, except at is applies to cultural differences due to local geographical conditions. We are all related, and can interbreed. Humans, never abundant until the period after the last glaciation, experienced major population bottlenecks in the recent past:<br/><br/><a href=""https://whyevolutionistrue.wordpress.com/2011/09/18/how-big-was-the-human-population-bottleneck-not-anything-close-to-2/"" title=""https://whyevolutionistrue.wordpress.com/2011/09/18/how-big-was-the-human-population-bottleneck-not-anything-close-to-2/"" target=""_blank"">https://whyevolutionistrue.wordpress.com/2011/09/18/how-big-was-the-huma...</a><br/><br/>Blacks, whites, and Asians are more similar than, say, various subspecies of deer and birds scattered around the world. Classifying behavior based on skin color or facial features is intellectually lazy, and is the work of people like Southern racists and the Nazis. <br/><br/>Dolezal did something a little silly, but maybe she can open our eyes a bit. Racial stereotypes are always inaccurate. Her goofing on it should not be described as crossing any ethical lines, because racial descriptions are themselves arbitrary.",0.4317
58,"Many years ago, an African American friend struggling to persevere against race-based bias in the world of interior design, lamented, ""I wish I weren't Black."" As we were close friends, I could reply, ""Just don't tell anyone."" Rachel Dolezal would not get the point of my quip, but my friend sure did. Dolezal's choice was not one of empathy or sympathy, it was one of deceit, presumably directed at her parents, whom she so vehemently rejected. ",0.4277
59,"I think that is actually a beautiful line. White people and black people smell categorically different. I have rather intimate knowledge of this. My wife is mostly African. It's not differences in diet or lotions used. It's a difference in scent from the skin. I didn't realize that to be a right-thinking person we had to deny all differences exist. Must we contend that black people and white people look the same, too?",0.4019
60,"Blacks escaping the racial terrorism of the South found that the “Promise Land” of the North was not flowing with “milk and honey.”  <br/><br/>Fueled by discriminatory and racist federal policies that relegated them to infested segregated ghettos,  along with discriminatory hiring practices in the northern unions, inferior schools, and of course police brutality, many Blacks, in turns of material opportunity, found that the Promise Land was not that much different from the brutal South.   <br/><br/>As the article highlights, at the root of the problem is the framing.  Professor Joe R. Feagin writes in his book, “The White Racial Frame:  Centuries of Racial Framing and Counter-Framing,” “How we interpret and experience our racialized present depends substantially on our knowledge of and interpretations of our racialized past.  The collective memory of that racist past not only shapes, but also legitimates, the established racial structure of today’s society….those with the greatest power, principally white Americans in the U.S. case, typically have the greatest control over society-wide institutional memories, including those recorded by the mainstream media and in most history books, organizational histories, laws, textbooks, films, and public monuments.”",0.4019
61,"Are ethnic restaurants allowed to hire servers who look a particular ethnicity or race (e.g., Asian)?  Of course they all do it in practice.  Is that discrimination considered acceptable?",0.3939
62,"For white evangelicals, it used to be about Catholics, Jews and unions as well as Negroes. Add Hispanics  and LGBT's, but subtract  Catholics (if white), Jews (they need the ones in Israel to facilitate the Second Coming) and unions (they don't exist).  So now it's brown, black and pink. The fact that so many whites are turning gray (old) offers a small opportunity for Democrats involving Social Security, Medicare, etc., but the main way this bigotry will be resolved will be by the birthrate, or more accurately the death rate. ",0.3928
63,"The recent escape from the Clinton Correctional facility demonstrates there are ""bad"" whites as well as ""good"" whites.   So much of our news today singles out non-whites.  Let us be honest.  There are ""bad apples"" among us all.",0.3818
64,Not a single sentence you wrote is true.  Not one.  Not a single one.  <br/><br/>What color are the skies in Opposite World?,0.3773
65,Looks like it's Snow Off-White vs. the Seventeen Dwarfs.,0.3612
66,Really? When I look around I see white privilege everywhere. ,0.3612
67,"Like dropping the label ""black lives matter""?",0.3612
68,"I agree with you. But, unfortunately, race has loomed so large in this country that achievements like this do attract a racial angle.",0.3612
69,"If this woman was blonde and pale in 2004, how was she able to pass herself off as a black person without some deception.",0.3412
70,"I still don't see what the big deal is here and why this woman has to be so vilified. It occurs to me that the biggest thing that bothers people about this story is that a white woman, who could have enjoyed all the privileges that go with being white, chose instead to align herself with a group that has historically been thought to be inferior. White people cannot imagine doing such a thing.",0.34
71,This makes me curious as to how and why racialism developed. Our origins seem so very entwined. ,0.3182
72,"Apparently, ""passing"" is acceptable to Ms. Harris only as a one-way street. What tomfoolery.",0.3182
73,"This articles compares apples to oranges,that is, economic solidarity to racial and sexual identity. The goals are to achieve both. History tells us that it took the power of people acting together to get voting rights for all over a period of time and it is still being worked on. Give up people power and you will achieve none of the goals.",0.296
74,Because Transgender is officially accepted by medical world. Transracial is made up.,0.2732
75,"It is true that the socioeconomic plight of many African Americans can be traced all the way back to slavery but it is equally true that most cannot get out of it because of the socially constructed idea of race in the contemporary American society. Whilst Ms. Dolezal is verifiably not a descendent of slaves, she has changed her appearance, has many African American family members, has immersed herself in the culture and has advocated and fought for the struggle. She is denied the ""racial"" part of the ""black experience"" but the cultural part of it she certainly has plenty. So what if ""she did so by choice""? How else can one ""become black"" (as in culturally, rather than ""racially"", black)? We can fault her for lying about her ancestry but let us not be so self-righteous and smug as to overlook the work that she has put in, as a member of a privileged ethnic group, in ""becoming (culturally) black"".<br/>I wonder what people would say had it has been ascertained that Ms. Dolezal does have black ancestry but looks exactly like she does pre-transformation? What would Mr. Blow say then? Race is real because people see it as real. Some are so shackled by their corporeal experience that their mind cannot transcend to see what is actually possible. She does not seem to me to be someone who's trying to exercise her privilege to hijack the struggle but more like a religious convert who's trying to be as close to the struggle as possible.",0.263
76,"Through all the furor over the past couple of days, no one but the New York Times has mentioned the salient fact that her parents (including them, in the interviews I have seen on television) adopted 4 black children when she was a teenager. Perhaps that might have something to do with her race identification issues?",0.2617
77,"Again, using children to get away with exploitation of the American system. Again, another article that clumps ""Hispanics"" into a homogeneous group and ignores the diversity and difference of individuals from different backgrounds and countries that only share a common language. Of all the Hispanics, Mexican culture is the most different from Hispanics of other countries. Moreover, Hispanics are not all uneducated and poor. Hence, not all Hispanics are afraid of Trump nor do they support him. You want to immigrate to this country? Do it legally instead of thinking that it is your right to demand and force acceptance. And respect children instead of using them as a shield against the bullet.",0.2598
78,"“The gay world as such is no more prepared to accept black people than anywhere else in society.”<br/>I'm seeing the opposite now too. That is the black world is no more prepared to accept gay people than anywhere else. In fact homophobia is bigger factor in black America (and I hate to use that term - because I don't be believe in a Black America VS a white America) than it is in society in general.<br/>Since bigotry knows not just one group, I remember this from Martin Luther King Jr.: ""We must learn to live together as brothers or perish together as fools.""",0.2531
79,"Ms. Dolezal grew up with four black siblings. That's a lot of family connection to the black experience, regardless of her own genetics.<br/>As for genetics, who can say?  When I worked in an office as the only white employee, I was constantly informed that I probably had black ancestry that I didn't know about.  And one of my blond blue-eyed friends with a German surname had a black grandparent.<br/>Others have noted that race is a social construct. Sometimes, given the sad and convoluted history of race relations and the uncertainties of parentage and ancestry, one's racial identity can also be an honest choice.",0.2263
80,"Roof says his political views were shaped by a Google search of ""black on white crime.""  Jihadists normally go well beyond a Google search in developing their beliefs.  When one bases an entire ideology on a narrow foundation, there isn't much logical thought going on.  I believe that it is far too early to assess Roof 's state of mind.  But schizophrenia, rather than White Supremacy, may be his core identity.",0.2144
81,Does anyone seriously believe that if the parents had been white and/or  wealthy this would have happened?,0.2023
82,".<br/>To the Readers,<br/><br/>Man has been inhumane to his fellow man since time began.<br/><br/>In many ways, if it's a group we're talking about, there is no good way to make amends:  Too many of the supposed ""oppressors"" had nothing to do with the oppressing.<br/><br/>I believe that Roger - while he talks about WWII - is really concerned about a different situation ... one occurring today.  And, I believe, one always needs to be aware of history even when one is dealing in the present.<br/><br/>Perhaps Roger is just asking for some leniency towards, inter alia, the financial morass in which Greece now finds itself.",0.1779
83,"When Hisoanics and blacks get wealthier, they become Republicans. See mayoral race in San Antonio. It's taxes stupid, plain and simple, social justice be damned. ",0.1531
84,"""It's not 1955"". Nope, it's 2015 and black 12-year-old girls get beaten by cops, vigilantes shoot unarmed kids, and cops treat white people with guns far differently than they do blacks. Of 200 church bombings and massacres in the last 3 decades, 90-95% were by whites against black congregations.<br/>If you're not among the mourning, ok. But can't you grasp why others are?",0.1414
85,"She has two children - did you even read the article? - and perhaps she had them when she could afford them.<br/><br/>As for ""This kind of 'situation' seems all too common in low income black neighborhoods,"" it is also a very common occurrence among low-income white neighborhoods.<br/><br/>Why is white Section 8 acceptable but not black Section 8? ",0.1179
86,I don't understand why she would want to claim to be black.  Beginning one year after the Niagara Conference white people have been an integral part of the NAACP. ,0.0772
87,I don't think of the Black Lives Matter movement as interrupting.  I think that the rest of us have interrupted our country's movement toward justice and equality and all those other fundamental societal infrastructure elements.<br/><br/>Black Lives Matter is just getting us back on track,0.0516
88,"""Yes, they’re a racially diverse group...Marco Rubio and Ted Cruz, who are Cuban-American.""<br/><br/>Cuba is a country, not a race.  Based on appearance, I'm guessing Rubio and Cruz have 100% European ancestry.",0.0
89,"In the 1860 census, there were black, white or Indian, with some Chinese thrown in (they were building railroads or mining) none of which are races.  Now we have a plethora of choices, and none of them are races.  Ethnic origin doesn't count for beans, either.  I respond to the race question with ""other"".  If I'm asked to expound, I say ""human"".  And that is all anybody needs to know,",0.0
90,Black people have different feelings about that flag.,0.0
91,Black people have different feelings about that flag.,0.0
92,"The minds of whites don't have to be read, merely look at the things they do, or don't and won't do - that tells you everything you need to know.",0.0
93,From the audience at the Met I never knew she was black until I read about it ... ad infintum.,0.0
94,I think this is Jeb-speak for America Deserves Whiter. ,0.0
95,Age discrimination here????   Old people still count.,0.0
96,identifies as black or appropriated a black persona for personal gain?<br/><br/>i'll go with the latter.,0.0
97,The U.S. line-up looks very WHITE !,0.0
98,"What are you talking about? What do you mean he ""choose"" to be Black?  ",0.0
99,"Scientists say the first humans came out of Africa, so technically arent we all African??<br/><br/>The race debate needs to grow up in our country",0.0
100,"And those from Eastern Europe weren't ""white"" either. ",0.0
101,"Hispanics are now the majority in California. Among young people, there are twice as many Hispanic children as non-Hispanic children. Game, set, match.",0.0
102,"'the race, gender, and looks of the server throw everything off' What does that mean???",0.0
103,"@ Mark Thomason but to every reader of the last line of Mark's comment. Let's hear from readers who hold firm to the American belief in a distinct black and a distinct white ""race"".<br/><a href=""http://Only-NeverInSweden.blogspot.com"" title=""Only-NeverInSweden.blogspot.com"" target=""_blank"">Only-NeverInSweden.blogspot.com</a><br/>My dual citizen logo tells you what I think of that belief.",0.0
104,"Concerned -"" most Southern states are majority black""?  Here are some states and their % of blacks:<br/>GA - 30<br/>FL - 16<br/>SC - 27<br/>NC - 21<br/>AL - 26<br/>MS - 31<br/>LA - 30<br/><br/>Not understanding how you convert those into majorities.  ",0.0
105," I Wonder what you ""racially sensitive"" folks think of the NBA diversity thingy?",0.0
106,"Now we hear what he said, do you still say it is simple and nothing to do with race?",0.0
107,"""ALL African Americans are Black people.""<br/><br/>What about non-black Africans who have migrated to America?  May they be properly designated as African-Americans?",0.0
108,So non blacks get up in the morning and think racism? Start looking at yourself . Change your role models form Jay Z to Ben Carson is a great place to start...,0.0
109,"A small minority?  Where have you been.  Just look around you!  Obesity is endemic.  ""Self-help movements"" haven't made a dent in it.",0.0
110,I'm guessing that you are white.,0.0
111,"Not that it matters, but aren't the President's daughters just as ""white"" as they are ""black""?   ",-0.0096
112,"""There's just no true way for any non-black person to know what that feels like. Ever."" What about having black sons and fearing for them every day? I know a number of white women in this situation; I have a black stepson myself; it may not be the same as being a black woman, but it can be a heavy weight.",-0.0387
113,"Assuming that you are not black, please consider how you might direct another group of people to respond to this situation.<br/><br/>Problematic with this response is the assumption that black people are a monolith and think as such. Perhaps Jesse Jackson will tell ""us"" via mass email to the black list serv that Rachel is black, set her place at the table? Additionally problematic is the assumption of a sufficient familiarity with the complexity of this situation and the experiences of many black Americans--political, social, spiritual--to make such a cavalier suggestion.<br/><br/>Given the spirit of reconciliation you seem to be offering, perhaps it is more understanding to simply suggest that others (not a blanket ""black people"") consider Ms. Dolezal's opinion and experience with compassion.",-0.0418
114,"I find this campaign to prove her right uncomfortably like campaigns to prove that people were only ""passing for white"" back in the 1920s.  Judge people by what they do not the color, real or alleged, of her skin.",-0.0516
115,They should be identified and their license to practice challenged.,-0.1027
116,"Thanks for the info, Bill.  That's even sadder, isn't it?",-0.128
117,"NM, I think you're missing the point. With lying and ethical issues how can she be a credible leader? Identifying with the race of adopted siblings is fine. Stating that you have different race parents and are of a race different then your own, and then using that lie to get preferential treatment is not.",-0.128
118,It just shows another example of how entrenched racism is in American culture and how ready America is to forgive itself.,-0.128
119,"She is welcome to work for the NAACP and for the causes they support, but there's something offensive about pretending to have walked in someone else's shoes.",-0.1406
120,"Remember when going to college meant that you found out that the world and life was not black and white, but varying shades of gray?  This process was associated with maturing, critical thinking, and most of all tolerance.  I miss those days.",-0.1666
121,"The reason we're talking about this, right now, is because of Rachel Dolezal. The issue with her, though, isn't that she self-identifies as black. It's that she lied and that she lied in a way that seemed always to be to her advantage. If she felt a particular kinship toward African-Americans, that's fine. I'm Italian-American, with 1/4 Sicilian, but I frequently refer to myself as Sicilian because that's the branch of my family that I was raised with and am closest to, so that's how I self-identify. Nevertheless, on the occasions when there is a more substantive discussion of ancestry I always talk about the other areas of Italy that my ancestors are from.",-0.1779
122,Unless I am BADLY mistaken B.O. never lied about his heritage. This person is obviously using the Black community for her own financial gain (professsor of African American Studies?),-0.1899
123,"Jon,<br/><br/>The thing is, it's not the ""new"" norm for blacks and hispanics in this country.  It's been that way for decades.  It's only now that there is video evidence to back up what minority communities have been complaining about for a very, very long time.",-0.2023
124,Tim's right to say what he thinks is real.  His capacity to lead an educational or research project is hindered by his prejudice against women as a group. Therefore Tim does not belong in jail. Neither does he --  or boys like him -- belong in a positions of responsibility. ,-0.2023
125,@ Yusuf - exclude the US from that group and I'm with you,-0.2263
126,"A ""race traitor"" was someone who was tolerant, that's all. And black people, who are being stopped and frisked, stopped for driving while black, walking while, shopping while black, etc. do own their own experience. <br/><br/>Can we do that? Can we own our life experience?",-0.264
127,"Hooey, you sure don't see the good, solid, loving and decent black people in our nation, do you?   ""They"" are all the same to you, and bad, the essence of racism, really.  When you say ""we"", they sure aren't part of that group, are they?  No, that would be the virtuous white group which includes, of course, you.  You could've been born black, and achieved whatever success you have, and you'd be hearing people talk about you just as you talk about others.  I bet you wouldn't like that, either.  But never mind.  I live in Oklahoma, and the woods are full of fellas like you; talk doesn't change them.",-0.2693
128,"It's possible, if she's been living as black, that she has suffered discrimination. Some have suggested, that if she were to be pulled over in a traffic stop, that she would have the privilege of playing the white card. Given what's been revealed about her, this seems unlikely.",-0.2732
129,"Obama addresses black America, when he needs it, all the other time he ignores it, that is why African Americans do not believe him any more. Beside that democrats need new votes, so they target other categories.",-0.2732
130,"Can't agree with you, Chris.  So much of various cultures (especially today) comes to the rest of the world through its fiercest feminist elements.  Appropriation of feminism is often (though not always) a direct avenue to wholesale cultural appropriation.",-0.2755
131,Can you name one of those policies that caters to blacks? Apparently I've missed this.,-0.296
