,comments,scores
61,"thank you for giving me a nudge over my hesitancy to retire - as a teacher I love my job - but the endless mindless tick-box required paperwork has me looking for the door - finances look OK - just waiting for the nudge<br/><br/>your comments about tiresome snobs reminds me of a favourite quote - <br/><br/>'Money-makers are tiresome company, as they have no standard but cash value' - Plato.",0.2142
62,"This punk, or someone of his ilk, has stood next to you at every tea party rally you have ever attended.  This type of punk doesn't steal beer, his daddy gave him all the poison he needed.<br/>Maybe he is you.",0.2091
63,Please save your pathetic name calling for when you look in the mirror,0.2023
64,you were willing to take the money and let it enrich your future....but when it comes to living up to your obligation you decided not to.  Tough!,0.1685
65,"Careful Lucian, you're exhibiting common sense.  Or, when it comes to managing our money, contra sense.",0.1531
66,Make other friends.  You don't have to spend time with someone you aren't enjoying spending time with.,0.0834
67,"The blood that is on everyone's hands, does that include the hands of Charles Blow, the NYT, Mother Jones and the Democratic Party whose tax and spend policies created the 'need' for 'punish and profit'? ",0.0772
68,What could be better for crooked politicians than a public that doesn't care what it hears?,0.0701
69,"SCOTUS decisions over the past 7 years have institutionalized political corruption in the Unite States of American by allowing individuals and corporations to give unlimited sums of money to politicians with no transparency which means foreign dollars can easily pour into the coffers of U.S. politicians thus influencing our legislation.  If U.S. citizens knew how Western Europeans live, they would not be so enthralled with life in the U.S. for the average citizen.",0.0516
70,"We are truly a nation of cowards to allow the Koch Brothers and their ilk to buy our government, deny our citizens the right to vote and steal every penny they can to make the average American poorer, sicker and dumber.  Thomas Jefferson once wrote that the tree of liberty must on occasion be watered with blood.  I would like to see these billionaires, these Wall Street thugs, these corrupt bankers and the politicians they buy hang  from the same tree and let the crows have what is left.  ",0.0258
71,"Not possible, the corporation that owns the Times has already given HUNDREDS of THOUSANDS to HRC.",0.0
72,But they got a lot less.,0.0
73,"A lot of people are going to make a lot of money. And, that money is going to come from the bottom. The more things change.....",0.0
74,The issue is crystalized if he decides not to run.  Then his contributors will howl.  ,0.0
75,How many schoolteachers' pensions<br/>did Scott Walker steal<br/>to build a shining palace<br/>for billionaires to watch<br/>millionaires play<br/>for middle class folks<br/>paying through the nose for seats<br/>and beer?<br/><br/>Take their bread<br/>and give 'em the circus ,0.0
76,Just to let you know FDR once nationalized all the gold in the U.S. then sell them back to their owner at a premium thus making billions (in 1930s' dollar) in the process.,0.0
77,This old dinosaur couldn't reshape a pile of mud if you gave him a shovel. Someone needs to tell McCain that the 1960's ended over fifty years ago. Let's move on.,0.0
78,"as everything else in life, money is to be used, not shelved for a future that<br/>shrinks back everytime a penny's pinched.",0.0
79,they and their ilk cost me nearly 1/2 a mil.  they should give the money outright.,0.0
80,As opposed to a real psychic?,0.0
81,Coca-Cola's only reason for existence is to make money.,0.0
82,I can't wait until life is not all about money. Wasn't there life before money? ,0.0
83,"Majority of the comments are about its not a big deal. I have 10K in student loans, a car debt, and no home, with monthly expenses. I'm working towards a retirement saving rather than buying a house and a speedboat. And currently trying to save some money for an MBA.  I haven't taken a vacation since I graduated from college in 2013.  I don't plan on it either. Marco Rubio is a total disaster to the American people, economy, and the world. I'm sure China and Russia are looking at us and laughing.  ",-0.0258
84,"Fortune telling is a lie, a misrepresentation, promising one thing but delivering something else. If you tell someone you are selling them an 18 karat gold coin but deliver a painted trinket it is clearly fraud. The same applies here. You may have your own feelings about the value of the entertainment industry, but it's an entirely different thing. <br/><br/>More to the point, fortune tellers sometimes prey on people who have psychological disabilities and don't have the same defenses as everyone else. One acquaintance of mine who suffers from a type of schizophrenic disorder was convinced by a psychic to pay her thousands of dollars. The psychic fed into and amplified the specific fears with which my friend struggled in order to convince my friend to keep feeding the psychic money. <br/><br/>Further, even if it is just a ""tax on the stupid/gullible"" that doesn't make it legal or right. Many criminals prey on gullible people. In fact I would expect most of us have been gullible at least once in our lives. I would hope the law would be there to protect us in those cases.",-0.0657
85,craig;<br/>That's why he is trying soooooo hard to communicate with the liberal socialists.<br/>Someone needs to save these poor souls. ,-0.0772
86,"The Greek citizens who didn't pay their taxes have moved themselves and their money elsewhere.  Thus, the thieves got away.  In the US it's called moving businesses and money offshore.  Forgot about recouping the money they stole when they lived and worked in Greece.  Check out the crowdsourcing site which is raising money to help Greece from small, individual donations.",-0.0783
87,"Why is it that one individual's statements can shuffle tens or hundreds of billions of dollars from the hands of one person to the other?<br/><br/>Let's see if I can produce a 4% spike:<br/><br/>""The Chinese economy is actually doing very well; signs of weakness have been exaggerated.""<br/><br/>There. Let's see what happens.",-0.1045
88,"Funny how there is never any money to fix roads, or brink Detroit back from its near 3rd world decline - but there's always hundreds of billions to arm Israel and Ukraine, and always money to garrison one of the many hundreds of bases the US maintains all over the world.<br/><br/>Meanwhile, we would all do well to study the influence of private central banking prior to world war 2, and, especially, world war 1.<br/><br/>The truth of the matter is that warfare is a tremendous waste not only of human life, but of resources.<br/><br/>But bankers need more and more debt to keep trading little pieces of paper for real assets.  <br/><br/><a href=""http://www.zerohedge.com/news/2015-06-14/cornering-earth-how-rothschilds-controlled-least-one-third-global-wealth-over-100-ye"" title=""http://www.zerohedge.com/news/2015-06-14/cornering-earth-how-rothschilds-controlled-least-one-third-global-wealth-over-100-ye"" target=""_blank"">http://www.zerohedge.com/news/2015-06-14/cornering-earth-how-rothschilds...</a><br/><br/>War is the bankers' greatest harvest.<br/><br/>Do not be so quick to race into this war.<br/><br/>It could be the last, and neither Jesus, not Moshiach, nor any other denizen of humanity's fair tales are coming to save us from ourselves. ",-0.1243
89,"She's nothing better than a con artist. ""Fortunetellers"" are masters at cold reading their intended mark. She probably could easily see that he was in emotional distress and wearing nice clothes or an expensive watch and charged him $2500 right out of the gate to test the waters. Once he gave the money without contest, it was smooth sailing from then to $700K. She's completely immoral and should be held responsible for her role in this.  Just because others do it does not mean that it's acceptable and should be seen as his lesson to learn. ",-0.1278
90,He is beholden to a large donor- who also employs his wife. Once he fails at this- he will have a huge payday.,-0.128
91,"I think part of the problem is that the mega rich know that they won't live forever. And it just isn't fair, they've hoarded all of this money, and should be given extra time to enjoy it. Maybe something like one extra year for each million dollars, so that a billionaire could live for a thousand years, plus the eighty or so that the peons get.<br/>Anyone who is paying attention will have noticed that the billionaires causing the most trouble, tend to be the oldest ones, they see it coming and are having a tantrum. Kind of like the yellow jackets at the end of summer getting meaner, they feel the cold coming in, and want to cause some pain before they go.",-0.1668
92,This is a dog bites man story. We should not be surprised when crooked politicians do crooked things.,-0.1695
93,"Fortunately, withdrawing your own cash isn't criminal. Intentionally structuring transactions to avoid IRS reporting is illegal. (Not that I'm a big fan of the law.)",-0.1838
94,"Ou AG is after 10 million US. A large amount of money in my eyes. I can only imagine how much money that is. Great!<br/>But wait a minute. Didn't the Koch Bros. authorize One Billion, that is 100 times 10 million to purchase a President for their private use?<br/><br/>Well, I don't want to rain on anybody's parade, but shouldn't they be looking somewhere else first? I mean, they do not have infinite resources and we do not have eons of time.",-0.1933
95,"Let me just cut to the chase. Whether the coin number from the greedy algorithm is truly the minimum depends on the specific coin set. For example, for coin variety (1,7,8) and try making a sum of 14. Greedy algorithm: 14=1*8+6*1<br/>Minimum:  14 = 2*7",-0.3612
96,Shouting into the wind is all your doing here. In your opinion the situation in Washington is bleak and hopeless unless you are a lobbyist or billionaire with a all the power. Try telling us some thing we don't already know? Try to teach us something new and give us something to think about. This is just lazy journalism for informed Americans. You can do better.,-0.3818
97,I don't care over much about Rubio's personal peccadilloes &amp; extravagances. The real issue--'he sometimes intermingled personal and political money'--gets buried in this story.,-0.3875
98,"Good for Boston.  Find another sucker, IOC/USOC.  If you can.  The Olympics aren't important enough to justify all the extravagance that is now expected.  There are many, much more important things to work, concentrate, and place priorities on.",-0.3987
99,"This sounds like parts of the company are bleeding money and parts of the company (the Google part) are raking in the dough, so board of investors insisted that the parts of the money that are bleeding dough be canned. Last ditch effort to restructure so the money-losing ventures are now funded by the money-making ventures but under a new name. Nothing new to see here, just reshuffling the chairs on the Titanic. In a year or two when Alphabet ventures are still losing money those projects will be abandoned for good. ",-0.4215
100,""" Lloyd Blankenfein, Jamie Dimon, Jon Corzine, etc.,""<br/>Wow did any of them take bribes and somehow fore people to buy homes they could not afford, and then try to use the equity in them to buy boats, home entertainment systems, SUVs?<br/><br/>What criminal statute can you cite showing where they committed some defined crime?  Suppose their banks had refused to buy those mortgages from the brokers who sold all those overpriced homes, what do you think the Bushies would have done then?<br/><br/>You seem to forget how Bush and his cronies were crowing about how good the economy was doing. You do know what would have happened if the banks had turned down buying up those mortgages, do you? maybe you forgot what did happen when the home buyers started defaulting. <br/><br/>Those people did not bribe the pension funds to buy those CDOs, they did not bribe the mortgage brokers. You go and buy a home with monthly payments higher than your income, and see how long you last. Oh I know, you are going to use the quick gain in equity to make up for it, and then do it again. But you are not engaging in a pyramid scheme?",-0.4257
101,It's always awful when you run out of O.P.M. (Other People's Money).,-0.4588
102,"""Wall Street and the big banks practically destroyed America""<br/><br/>You got that right! There are no competent Republican, presidential candidates. You might want to give it a, shot.",-0.4753
103,Not to mention that Wilson makes some negative comments about people who take from the government and don't work. Maybe he should look for a different job rather than living off the proceeds of supporters - does he ever think about the racial attitudes of those who give him money? I'm willing to bet they're not sympathetic to the plights of African Americans.,-0.5426
104,"Stop Universities From Hoarding Money...<br/><br/>Yes indeed, they should be stopped. And university presidents could begin by lobbying our government to fix the student loan, which remains unconstitutionally stripped of all consumer protections. This is in marked contrast with the unjust rewards for hedgefund managers.<br/><br/>oz. ",-0.5574
105,How do they put money in without a SS card? By stealing someone's identity.,-0.5719
106,"@stu - That is an interesting point.   <br/><br/>The amount of money Donald Trump inherited from Fred was not large compared to the fortunes he has made an lost several times.   But the main reason people will see him as not a part of the business establishment is that he is not a mere manipulator of balance sheets and financial instruments, but actually builds buildings, and either makes or loses money in the competitive market.   <br/><br/>Many people see CEOs and boards as parasites that are looting the companies that are owned by the stockholders through mutual funds and retirement accounts.   Trump owns his businesses outright, and keeps whatever he makes and loses whatever he loses.   There is still a lot of admiration for that, while no one admires the CEO who lots his money losing company through a compliant board.",-0.5859
107,The stupid excessive pursuit of wealth by people looking for quick returns has brought the world stupid excessive efforts to wring out any money to pay off these same who are now called creditors.,-0.6124
108,Newsflash - it is not your grandparents country anymore. No one is denied the right to vote.,-0.6249
109,"Jim,<br/><br/>you hit the nail on the head!      They know what they are doing and don't care.   until we stop re-electing the same ole crooks it's status quo.",-0.6273
110,"It's incorrect that there is no system of compensation for living donors who lose wages. The American Transplant Foundation helps financially vulnerable living donors by reimbursing them for lost wages, and The American Living Organ Donor Fund recently starting doing the same. That being said, these two small nonprofits can't fund the entire country's living donors, so some sort of state system would be ideal!<br/><br/>(<a href=""http://www.americantransplantfoundation.org)"" title=""www.americantransplantfoundation.org)"" target=""_blank"">www.americantransplantfoundation.org)</a><br/>(<a href=""http://www.helpinglivingdonorssavelives.org/)"" title=""http://www.helpinglivingdonorssavelives.org/)"" target=""_blank"">http://www.helpinglivingdonorssavelives.org/)</a>",-0.6996
111,"The deal was, we'll give you money, but you have to buy our weapons.  We'll give you money, but at a steep interest rate that you'll have trouble paying back, and then we will demand that you let us buy your resources, for cheap.  Don't worry, the rich bankers got plenty.  ",-0.712
112,So many people who spend years on or around lawns seem to die of ALS. <br/><br/>Can no one figure out what the connection is?,-0.7269
113,"<br/>Folks, dont donate your money unless you know exactly where it is going.  <br/><br/>If you cannot be sure, dont donate money.  <br/><br/>Every time I get asked to donate a dollar at a retail cash register for a tree, or babies, or god knows what, you have to say no because you have absolutely no idea what happens to those dollars.  Same goes for those donations you can make on your tax forms and on your cable TV bills.  It is ""legally"" exploiting the working classes for a buck here and there.  ",-0.7321
114,"Scalia's hysterical dissent .<br/> This from a man, who with his fellow thieves, stole an election from the American people and then put buying and selling elections on the same plain as paying for the services of a prostitute.  The analogy is not perfect ; he made buying and selling elections ""legal"". ",-0.7505
115,We are wasting money on stupidity while China is getting wealthy. I am starting to think we should be like them sit back and watch them fight it out and then get the oil contracts for us. It is like this you don't see China hopping to a war they are smart and will not waste money on a foolish war.,-0.7627
116,"Unfortunately, the US already spends more money per student than other industrialized nations with poor results.  Pouring more money into a flawed system will not improve the results.  ",-0.7849
117,You have to come up with at least some effort to put forth something constructive - anger alone is not enough to help anything,-0.7881
118,"Did you hear or listen to what President Obama said? It is the frequency of these killings which set us apart from other first world countries. Norway, 2011, and you use this one instance to blow the whole rest of his remarks away. The saddest aspect of Obama's words is that it will not change anything. I'm so sick of people who say ""well, he should do something"", really what. If our representatives would not make even the most minor of changes after Sandy Hook why now? Why waste time and energy as nothing will change, it isn't worth the effort. Why offer our prayers to God now, where was he when this evil was occuring? So please go ahead and pray, I'm sure it does make you feel better but understand God isn't coming to save us from ourselves.",-0.8028
119,If this woman can go to jail so should every scam artist money manager that promises huge returns on investments on complete gambles and often loses the whole lot.  That sucker probably would have gotten bilked out of his probably ill gotten fortune by someone else anyway.  <br/><br/>I say free the witch!  and give her a reality show!,-0.8099
120,"The entire justice system is completely broken, like every aspect of this so called government.  Turns out everything theoretically designed to help mankind was really put in place to control, extort and steal.  Every aspect of life is now under control of a psychopathic evil group of greedy money hoarders and this problem won't fix itself without real action by real humans. ",-0.8196
121,"Makes me wonder how we can make such a big deal out of ""marriage equality"" which amounts to privileged treatment for a small, select very white special interest group with a lot of money and political influence and allow black churches to burn to the ground and innocent black churchgoers are gunned down in cold blood by an evil racist maniac and we can't do anything.<br/>America's priorities are way screwed up.  I don't know whose fault it is but things are way screwed up and have to change or we are in really big trouble.  ",-0.8679
122,How desperately we need single-payer health care!  And how sad that dishonest arguments are holding center stage while the greedy run away with the loot.,-0.8883
123,"Charles, what we are still seeing is limited velocity of money which has the effect of lowering the amount of money in the pool.  Also,  the collapse of oil has destroyed millions of US jobs and weakened our economy.",-0.891
124,"We drop trillions of dollars on unnecessary wars, and we're now threatening to stop helping millions of needy people pay for health insurance. What happened to us.",-0.8979
125,"No where to I see it mentioned that anyone who wants to join a union still can join a union.  Or that if you want your dues spent on a liberal agenda, you can vote to spend those dollars.<br/><br/>People call Scott Walker all sorts of horrible names.  But who was it sending death threats to his family?  Who was it behaving like spoiled children in the rotunda?  Who was it damaging private property or utilizing physical intimidation against people who disagree with them.<br/><br/>Guess what...it wasn't Scott Walker. ",-0.9648
