,comments,scores
0,"Your friend, who is not in need of household toys and clothes, which presumably she can afford to buy,  accepts your free and generous offers, left for those who may benefit to take them for free. Obviously your intention is for these items to find users, who would not need to pay for them, for these item to e still useful rather than thrown in the trash and to be used and enjoyed by those who like them, but may not have time the means to buy them. But, your  intention is not to make a financial profit. Therefore your friend's action of taking advantage of your honorable intention and turning  your genres gesture into a commercial profit venture for herself is not honorable nor decent, therefore not ethical. This is not a high principled person and your instinct is right. Best not to leave more items or share them with her, but directly donate to those in need. ",0.9902
1,"Thanks for reminding us.  One good turn deserves another, so let me remind you about the willingness of SOME scientists to be complicit in tobacco companies' efforts to hide the dangers of their products.  It's not that all private funding corrupts the scientific efforts, but the public is robbed of their ability to judge for themselves whether or not they trust the source of this information because the research group in this article ""forgot"" disclose a donor with an unquestionable conflict of interest.  Not only that, the same research group's findings just happened to be advantageous to that same undisclosed donor's pecuniary interests.  Finally, the disclosure might NEVER have happened if light had not been for exposure (i.e., the cat is out of the bag).  We wouldn't be having this discussion if Microsoft secretly donated money to research the causes of obesity and it happened to benefit Coca-Cola, but that's not the case, now is it?  This is more like Exxon donating to a research group that just happens to publish a study indicating that crude oil is actually more beneficial to marine life than most people think!  It's fine for them to donate, but you'd best be transparent right from the beginning about such conflicts of interest if you want to be taken seriously.",0.9733
2,"I think what DRS is saying is, ""I worked hard and made something of myself... and those jerks can now steal my money for health care they're too lazy to afford on their own.""<br/>  Some are lazy. Some not. The proportion of lazy poor to poor is probably about the same as the proportion of avaricious rich to rich. Some of ACA beneficiaries have congenital conditions. Some had very productive lives until the cancer (or whatever) started beating them with a large stick. Some are making something of themselves in ways that don't make large incomes.<br/>  When government helps individuals, there's always outrage from some. But our money supports a lonely highway in Wyoming that sees 10,000 sets of tires a year. No benefit to me. Our money supported research that didn't work out. That scientist ate on my dime and produced nothing! A hurricane of our money blows into the military. Why punish me to protect Okinawa? Our money goes a million places providing no that benefit for me, yet somehow it's especially offensive when the money goes to feed, clothe, shelter, and yes provide health care for some people less fortunate than me.<br/>  A preacher I used to play racquetball with told this story about trying to get relief funds. A particularly successful church member said, ""I've worked hard for my success. I work hard every day."" The preacher answered, ""Do you think the woman in Uganda who walks seven miles every day to get water for her family is not working hard?""",0.9698
3,"<a href=""http://www.nytimes.com/2015/07/03/us/anonymous-donors-give-over-3-million-for-charleston-scholarship-fund.html?&amp;moduleDetail=section-news-2&amp;action=click&amp;contentCollection=U.S"" title=""http://www.nytimes.com/2015/07/03/us/anonymous-donors-give-over-3-million-for-charleston-scholarship-fund.html?&amp;moduleDetail=section-news-2&amp;action=click&amp;contentCollection=U.S"" target=""_blank"">http://www.nytimes.com/2015/07/03/us/anonymous-donors-give-over-3-millio...</a>.®ion=Footer&amp;module=MoreInSection&amp;version=WhatsNext&amp;contentID=WhatsNext&amp;configSection=article&amp;isLoggedIn=false&amp;pgtype=Blogs<br/><br/>This is amazing and very generous of these unknown people! It really is truly amazing to see the love, support, and power of how people in the local town just all work together and help out anyway they can. In just the matter of few days the power of the people can make such a big difference. The city states that scholarships would pay for the advanced degrees for ""members of the extended"" church community. The fund also carries the name of the senior pastor of the church, Clementa C. Pinckney. Who was also unfortunately one of the nine in the killing.",0.9614
4,"Better stated one party believes those who are successful should be robbed to potentially assist those who are not.  Republicans give way more to charity and thus are very interested in helping others, as long as those are really in need, and not just lazy or not responsible.  Simple!!!",0.9581
5,"I encourage everyone to read Dr. Tober's article. It is fascinating but limited in scope. If you read my book, you will see that one of the things that amazed me was how different the Iranians treated the ideas of ""selling"" or donating a kidney from one province to another. Shiraz, where Dr. Tober did her research is a province in Iran that has never implemented the national policy of allowing recipients to ""buy"" kidneys. It was always the convention of the Shiraz medical community that there was no buying or selling going on there -- Only compensating donors for their expenses. Now, in Shiraz, living donors are not even given enough to cover their expenses but only the small token gift from the national government.  Dr. Tober's insights are worth reviewing, but it is also worth noting that my book explores those regions where the legal sale -- or the national policy of allowing compensation for donation is implemented (e.g. Tehran)  AND I also explore regions that have taken a different approach to compensating donors -- namely Isfahan and Mashhad where donors are given a set payment to cover expenses and then other types of material benefits other than money. Tehran does some of this as well, but their general approach is a regulated market approach, while Isfahan and Mashhad have a social service approach. To understand more of what I mean by this watch my TEDMED or, if you can, read my book.",0.9578
6,And how would you feel if you spent 20 years and millions of dollars inventing a revolutionary widget but then had to hand over your patent to others to profit from your idea (and to your detriment) after 17 years?  How would your benefactors feel?  Once again the socialists want to benefit from other people's efforts.,0.932
7,This great fort LGBT community and having a dialog for transgender rights however this coming out as been carefully orchestrated.  Carolyn's manager is making her a tidy sum of cash on this newly found freedom and yet another 15 minutes of fame for Jenner. ,0.9136
8,"Ultimately, the experts in finance will Trump the rewards to those who have dedicated themselves to superiority in any other field.<br/>The purpose of finance is to make money based on the value of others' efforts.<br/>We spend all our time studying the economic benefits that others provide and the means to extract those benefits for ourselves.<br/>That's Capitalism - do you have a problem with that?",0.9081
9,"Angst, angst, the world financial system worries the Greece problem will spread to others. Worry that borrowing money to live on might catch up with others.  <br/><br/>It is a make believe world we live in.  Economic geniuses unite!  Money isn't real, it is a phantom. Un-tethered to anything real . . . work, effort, accomplishment or thing.  <br/><br/>It sloshes out of central banks to water the seeds of politician's promises. As they pander to populations clamoring after the wealth of others.  But needing the support of the wealthy, they deliver by slight of hand.<br/><br/>Money - once the symbol of work and savings.  Now a fool's gold mystically  created to enable lifestyles unearned. <br/><br/>There is no light at the end of that tunnel.  For the very reason you can't run a train through a mountain until the whole tunnel is dug. The effort and work must come first before the champagne party ride.<br/><br/>Enjoy your ride America, your children will pay for it. VOTE FOR MORE!",0.9008
10,"""f we had had an unnaturally low rate these past 7 years, we should have seen accelerating inflation; we haven’t.""<br/><br/>Oh my goodness<br/><br/>That's because the unwashed masses, the people that make your car, build your house, and serve you Burgers, haven't seen a salary increase in 7 years, their wages being held down by outsourcing, immigration, and automation. Indeed, the fell, in real terms.<br/><br/>The 0.1%, on the other hand, that being credit worthy got their hands on the money the Fed printed (read on how Mark Zuckerberg refinanced his house at 1%) did see inflation in their goodies.<br/><br/>When you move to NY, Dr. Krugman,  where as you noted nice places can be have on the upper West Side, you will experience, first hand, were the printed money went to work.",0.8919
11,"   I feel there was an unspoken agreement that these items were being given for her friend to utilize. To then turn around and make money off of the gesture is just plain tacky. If the friend used them for awhile and then sold them, that would have been okay.  ",0.8885
12,"Yes, he has. Know how? By working, by his wife working, by their not buying three fancy houses they can't afford and an $80 thousand dollar boat, by their paying off their student loans, by writing and selling two best sellers, crazy, un-American stuff like that.<br/><br/>Oh, and not wailing about how his family can't get by on a mere couple hundred grand a year.",0.875
13,First of all these are PUBLIC companies so therefore the public has a need to know. Hopefully it will pressure corporate america to give there workers better pay and benefits. That would be good for the economy as well as America. Someone making 30 mil cannot spend that much money. If you spread it out in the hands of the workers 99% will be spent. ,0.8625
14,"The first month I invested in a 401K I took the advice of experts and put the money into a T Rowe Price index fund.  It lost 6%.  It was MY 6% and I am adverse to losing money so I immediately put all my money into the safest U.S. treasuries fund TRP had.  True, I didn't make BIG returns and, true, the esteemed George Bush, Jr. and friends used MY money to bail out the banks when it all crashed, but I did not lose a dime.  I have kept it there and have never lost a dime.  Most of my friends and acquaintances lost one-half the value of their homes and 401Ks and, regardless of what the experts say, they lost it to the top 1% global financial elite who control it all.  They lose value every time the manipulators decide to tank the economy.  America, WE must regulate and tax GREED.",0.8282
15,"OK, Lucian, how about this? My wife and I are both 66. We have NO debt (cars, house, etc.). We are not making payments on anything. We pay off our credit cards monthly. We have enough money left over to invest, and donate to charities. We live so much WITHIN our means you wouldn’t believe it, yet we live well and comfortably, and no one would call us rich. Anything I left out?<br/><br/>Here’s a lesson in personal finance you can pass on to Sen. Rubio, who seems to have missed it:<br/><br/>If you earn this: 50   don’t spend this: 51.",0.8105
16,"After viewing Let's Make Money (2008), I feel that the elite in western nations are partially responsible for the world conflict we are now in along with the corrupt regimes in the Middle East and Africa.  One of the refugees in the article commented that she had never had to worry about money before.  In our own declining democracy, this could be any of us in the coming future.  If I put my spare cash where my mouth is, I will contact that Greek restaurant owner through her restaurant FaceBook page and better yet--interdenominational churches everywhere could spread the word throughout their communities, reminding those in the US that their charitable donations are tax deductible if they itemize, rather than taking the standard deduction.",0.7909
17,"Oh yes, that money thing again…the stop gap of supposedly grown up thinking! What about the chasing of money that causes the wars to begin with? How grown up are those theys who fund and profit from these wars? Are they somehow more moral because they make money on the misery of others, but its ok because they are wealthy? Yet the peoples of the world are expected to accept this as part of the nature of things? I don't get it. ",0.7877
18,The Donald is a gift to both the media as well - and most importantly - the Democrats. May he stick around for a very long time!,0.7836
19,Right. Women getting all those free goodies are just living high on the hog. What a grand lifestyle it is. Those takers!! *snark*,0.7835
20,"Yeah that something is that many of his cohorts are indicted, and cowards like that will always snitch on eachother. He's done, and I don't mean just in terms of his $65mm a year job as the head of a very corrupt organization. I wouldn't doubt 1 bit if he fled to a country that won't extradite him. Hopefully they seize all his assets, though a fat cat like him probably has hundreds of millions stashed away in far away lands and shady banks...",0.7752
21,Lol.   Are you serious? The pharmaceutical companies give our politicians millions and millions of dollars and the politicians turn right around and give them a ton of money. The system is corrupt and that is why I love Sanders and Trump. Both of them are talking about the corrupt American political system.,0.7717
22,"I simply could not be more disgusted. Public higher education, which serves the state and country enormously by investing in the middle and lower classes, is robbed of $250M and that money is given to a sports team, which is enjoyed by a relative few. I hope people are paying attention and that this exposes Walker for the corrupt hypocrite he is.",0.7482
23,Thank you for putting this so clearly.,0.7177
24,"Won't ever happen, people who have hoarded wealth are addicted to making money simply by having more than they need, e.g. payday loan stores and car title loan stores.<br/>We should all take the credit cards flooding our mailboxes, and max them out buying Krugerands, and just throw away the bills.<br/>We of the 99% outnumber them and they can't get all of us. ",0.7003
25,"I'll bet that Trump has bought and paid for several politicians in his time. Most likely he has received a few paybacks for the ""Donations""  in his day. Neither him or the Politicians want to talk about it because they would probably both be in the slammer. But I'm sure there is more than one candidate that is wary of pushing Trumps hand. I think he can help fix some problems, he knows how to negotiate better than the clowns in charge now, He would fix the immigration problem just by enforcing our current laws,  although I agree making Mexico pay is a a bit far fetched. But watching Fox driving him out so the RNC bought and paid for Jeb is shoved down our throats is infuriating.",0.6956
26,"One indication of how the ""sheeple"" fail to better their lot is the use of the 401 (c) 3 charitable foundation ruse. Obscenely wealthy moguls are able to use their fortunes to brainwash the ""little people"" in believing they are unworthy and deserving only of receiving alms from worthy businessmen who really know how to make do. The former publisher of Harper's (Lewis Lapham) spells it out in the latest issue of his quarterly ""Philanthropy"". Lapham is a national treasure.",0.6908
27,"""Instead, what we’re seeing is what happens when too much money is chasing too few investment opportunities"" -- and yet aren't you the one advocating keeping interest rates low, thereby creating more money to chase the ""too few investment opportunities""?",0.6908
28,"Free markets?  What about the hundreds of billions every year  in corporate welfare to Fortune 500 companies that make gazillions, pay no taxes and keep all the profits offshore from here they were made? Lobbyists actually writing th e laws?  What ""free"" market""?  They have already surrendered themselves to corporations",0.6767
29,The easiest way for Hillary to help those who have less is to give all of her money away.,0.6705
30,"The writer should know that, next time, she should just lug it all to Goodwill or another charity that distributes things. Also, perhaps her neighbor who seems to be in the same financial bracket is no longer so and truly needs some money... I would just let it go and not be so judgmental of a situation you may not understand completely. Another thing to think about is that, unless the sale was the next day, the neighbor may not even remember where things came from...;perhaps relatives have also given her tons of hand-me-downs....",0.5829
31,"So this is what we've come to.  A presidential candidate with the moniker of Jeb! Following in the foot steps of a brother who led us into an  unnecessary war which cost countless lives and cost hundreds of millions ( I'm being generous here folks, it was more like billions of U.S. tax dollars). And I'm gonna vote for this guy?  Fat Chance!",0.5827
32,"Contrary to some commenters, this is not ""progress"" but bad entrepreneurship. If I was an investor I'd be pulling my money out.",0.5824
33,There is one very real difference with Greece - who wants to buy new Greek debt?<br/><br/>If you lend a dollar to Greece they don't make enough to pay the interest  and keep the lights on. So nobody wants to lend them a new dollar so you can get your dollar back and spend it on something you need.<br/><br/>Would you put money you need (say for your teenage child to go to college in a couple of years) in Greek debt? <br/><br/>It is the confidence that you can get the cash back that drives everything.,0.5803
34,"The problem with expecting Obama to come up with alternatives for fossil fuels is that the government is not allowed by conservatives to spend money to find alternatives. The fossil fuel companies certainly will not spend the money or do the research to compete with their business. Small businesses can't afford to do research or compete with fossil fuel money and their campaigns against change.<br/><br/>So, even though energy is freely available everywhere, how is Obama going to come up with alternatives?",0.5719
35,"Avery, socialism doesn't preclude your earning over 200K and buying all your goodies (I assume you meant 190K) -  but can't you care about other people too?  It's not ""either-or.""  I too like having stuff!  But there's also room left in my brain for EMPATHY. <br/><br/>I am willing to give a little more (and no, I'm not in your income bracket) in return for the knowledge that it's going to make life better for people who really need it.  It gives me PEACE OF MIND and that makes me happier..... I dunno, is that logical enough for you? ",0.5303
36,"Avery, socialism doesn't preclude your earning over 200K and buying all your goodies (I assume you meant 190K) -  but can't you care about other people too?  It's not ""either-or.""  I too like having stuff!  But there's also room left in my brain for EMPATHY. <br/><br/>I am willing to give a little more (and no, I'm not in your income bracket) in return for the knowledge that it's going to make life better for people who really need it.  It gives me PEACE OF MIND and that makes me happier..... I dunno, is that logical enough for you? ",0.5303
37,"Earl Holt, Roof's mentor has given large sums of money to Ted Cruz, Rick S antorum and Rand Paul. He was an inspiration ofr those candidates that took his money and Roof bought in. This is the first time that we can really say it and mean it. ""Why not throw the baby out with the bath water.""",0.5267
38,"Let's make them move to D.C. That's where all of the BIG Government Contractors moved to. It's a lot easier to line the pockets of Pols when your kid plays on the same Soccer team as theirs does. <br/><br/>Or, send them to Ireland or the Caymans, the address of some of the biggest Corporations in America...I mean world.<br/><br/>Whatever happened to ""let's make the corporations pay their taxes?""",0.5267
39,"Paul, read Brian's comment that follows yours. His statement makes sense. If the companies (coal, oil) put integrity before greed and used the billions they now use to challenge EPA laws and instead conformed, our planet would be a safer place to live. Those billionaires cannot breathe money, but they do BUY our law makers! Lobbyists = a legal bribing system!",0.5162
40,Constraints lapsing tomorrow with sanctions still in place vs. hopeful compliance with constraints PLUS hundreds of billions of dollars.,0.5106
41,"And what about all those investors who have been ""duped"" by the 3–piece-suit gangs???  Come on, guys.... Let's also go after those creeps who stole millions upon millions from ""gullible"", trusting investors.",0.5007
42,"Too many references to count to the ""shocked, shocked"" line in Casablanca over the last several years, the scene I think that is more representative of the Times in which we live is the scene where Inspector Renault offers to buy the champagne for Ilsa and Vic and they object and Renault comes back, saying, Oh, it's a little game we play. They present me the bill, and I rip it up.<br/><br/>And that's what we have here. The Times is presenting the bill, knowing full well the Pentagon will rip it up.",0.483
43,All psychics are not scam artists. ,0.4585
44,It's completely different here. We have an advanced democratic system that makes actual bribery unnecessary because thee are completely legal ways of buying politicians.,0.4201
45,"Lynn - I too would like to see a debate between ""politicians"" who spin for a living and a self made millionaire who is not a politician!",0.4199
46,"Why do people who rail against the people who came or stayed illegally never rail against the people running big agricultural operations, big sweat shops and big private estates who hired all these people - yes, illegally?",0.4019
47,"Why change the faces on money at all?  Why change the names of streets?  Want to change the designs, want to change the names?  Tell us why.  And BTW:  change for the sake of change is a shallow endeavor. <br/><br/>Are there no serious problems in the USA?  Why do we have people in Washington, D. C. concerned about non-serious, non-problem things?  <br/><br/>Instead of designing a new $10 or $20 bill, try to design a truly counterfeit bill.  That's a serious endeavor.  <br/><br/>Instead of spending $$$ on endless discussions about changing the design of money, spend time tutoring children in schools in Washington, D. C.  That is a truly serious endeavor. <br/><br/>People who work for government should be serious people.  Serious people should be concerned with serious things.  Helping children learn to read is a serious thing.    ",0.3736
48,There are millionaires and billionaires in places like Saudi Arabia -- why don't you ask THEM to step up to the plate here?,0.3612
49,"Scalia wrote: “It is not rational, never mind ‘appropriate,’ to impose billions of dollars in economic costs in return for a few dollars in health or environmental benefits.""<br/><br/>Should we ever need to attach a dollar value to a person's health and life, am sure Antonin could do that.",0.3612
50,"Looking back one administration--was there an attitude of ""lock them up and throw away the key""?<br/>Did it work?<br/>Is the story worth telling?",0.3485
51,"Looking back one administration--was there an attitude of ""lock them up and throw away the key""?<br/>Did it work?<br/>Is the story worth telling?",0.3485
52,"Given FIFA and Qatar's donations to the Clinton Foundation,  seems it would be much more likely for him to join as Hillary's running mate.",0.296
53,"Yet another state to which I will never return. For any reason. I will also rethink the money that I spend ordering from online business in the ""Don't Mess with..."" state.",0.2755
54,"Why does ""consumption"" matter?  People all around the world are having sex with each other for free.  But as soon as money changes hand, it's a crime?",0.2755
55,"She's the digital version of the blood-sucking leech who has fattened her coffers with the sweat, toil, tears and intellect of other people -- the legion of contributors who sell their labor for ""exposure,"" and she gets all the publicity.",0.2732
56,"Well said, drspock.  You summed up all the essentials.",0.2732
57," The sense of entitlement is shocking. Why is it not called a fraud? I never even saw anyone who has four bedroom apartment but I and all of us middle class losers are paying for Mr. Acevedo's pleasures who somehow is allowed to steal our money. Yes, Mr. Acevedo and people like him are allowed to fleece us. Some animals really are more equal than others.",0.2349
58,"If a woman is placed on the ten dollar bill, will it only be worth seven dollars?",0.2263
59,"What is your basis for these accusations?  I've read several articles about her mentoring younger players.  Not sure what charities she donates to, but could probably find some information on line.  What kind of charity work do you do?  Do you tutor, mentor, donate?",0.2157
60,And u.s. health care isn't terrible if you have a job and have health insurance that doesn't nickel and dime you to death.,0.2153
