,comments,scores
35,"Social Security started with this: about 15 contributors for every beneficiary when SS began in 1940, after 2-3 years of taxation to help front-load the system. The average life expectancy was about 62, so even if you received benefits you wouldn't get them for very long.  Now there are around three contributors for every beneficiary, and the average life expectancy is in the upper 70s.  Social Security outlays exceeded payroll taxes by $138 billion for FY 2015.  So Professor Krugman can try to paint this as an evil political ploy all he wants, but Social Security is not sustainable in its current form.  As President Clinton once remarked, ""It's arithmetic.""",0.8201
36,We have an unfair economic system where the 1% don't have to pay their fair share....they stash their tax money overseas.  The republicans... still this day ... are advocating even more ludicrous tax cuts for the rich as if they don't have enough money for food or medical care. I believe Bernie Sanders understands America's income inequality better than Hillary. The republicans really don't care about income inequality no matter what they say...not believable !  Tax cuts for the rich really doesn't address income equality. ,0.816
37,"I am curious as to which questions on the FAFSA that make the application difficult?  I assume that it is the income and asset information.  The income/taxes paid/untaxed income questions clearly reference where this information can be pulled from - right down to the line # depending on the tax forms filed. To make it even easier - they now allow for the IRS system (if the timing is right) to populate those answers (with the users authorization) to avoid mistakes.  I am still not sure what is so difficult about the application. It seems like people just don't want to be bothered and expect funds to be thrown at them just because. There is no other means of comparing apples to apples when it comes to awarding federal funding (Pell, Federal Work Study, Subsidized/Unsubsdized Direct Loans) other than a formula that every college bound financial aid seeking individual is asked to provide data to, in order to help with the calculation.  If the FAFSA application was eliminated - what would be done with the families that experience mid-year financial hardships or extenuating circumstances?  What would be the means of establishing a benchmark and eventual recalculation?  Maybe a better idea would be that a family completes the FAFSA one time (in the first year) and they get the same aid each year based in that one initial application.",0.8103
38,"There IS quite a bit of wiggle room between 39% and 90%.  There's even MORE room between 90% and the 20% capital gains rate that the richest of the rich pay.<br/><br/>Of course, if your sole allegiance is to Grover Norquist and the notion that we force government to be drowned in the bathtub.............the notion of ""soaking"" the Waltons by ""confiscating"" the money that they've earned by working so hard and acting so virtuously is of course, completely unthinkable and repugnant.",0.8047
39,"The reality is that this generation has and will continue to receive far more in welfare benefits than they ever put into them. Their social security and medicare contributions were very low as % of income during their working years. This is a generational Ponsi scam.<br/>I have in part benefited from this unsustainable business model through the comfort of my mother. She retired at 55, and has excellent benefits 30 years later. But my contributions are increasingly more burdensome. And then there is a good chance such welfare services won't be available to me when I need them. ",0.8008
40,"I suggest a supplemental tax to be paid by an employer on any wage or salary that is paid, directly or indirectly, to an employee who is not a resident of the U.S. and domiciled in the US in an amount sufficient to reduce the profit generated by not employing US residents   <br/><br/>I also suggest eliminating any tax advantages for employers and employees for employer paid health insurance premiums thus leveling the playing field for employers who must compete in markets with government sponsored Plans.   This will also result in less disparity among workers in the U.S. not all of whom have employer paid or sponsored Plans and also level the field for self employed people<br/><br/>There should be a limit on the favorable tax treatment of investment income<br/><br/>There should be a lower limit on the home mortgage deduction and no deduction for expenses not related to a primary residence    This will eliminate the distortion in real estate costs <br/><br/>The ceiling on deductions for college expenses should be raised.   There should be expanded student loan forgiveness in exchange for needed public service (emphasis on needed)<br/><br/>These are just a few ideas that will reduce income inequality without resorting to ""pitchforks""",0.7906
41,"""Big Pharma doesn't pay for the basic research to develope these drugs and it deducts each and every dime it spends on R&amp;D from its taxes.""......It is true that big Pharma does not pay for the basic research, but it is also true that it does pay for the applied research which is not only essential, but every bit as difficult and challenging and very often more expensive then the basic research. And they don't deduct the cost of research from their taxes as you have miss stated. The cost of research is a business cost - taxes on any business operation are applied to the net profit.",0.787
42,"So, you suggest cutting taxes for ""middle class' workers and directing some of the excessive profits into productivity - where it will yield tax benefits for owners.  Really?  This is your answer to the problem?  Still not talking about cutting the greed at the top nor adding hefty taxes on those making millions every year!  Sorry, to effect wealth redistribution, you need to reduce the top $  and increase the bottom.  Tax reduction for all!!! is not a plan.",0.7846
43,"I am shocked. Not only is Trump saying something worthy of more coverage... I find myself actually agreeing with the man. And this from a liberal Democrat who wouldn't vote Republican if you had a knife to my throat...<br/><br/>I was beginning to think we'd never hear another candidate for office propose raising taxes on the rich, and I certainly didn't expect a candidate to come out in favor of penalizing American corporations who move jobs out of the country. These are common sensical ideas for many of us, who see such moves as key to filling American coffers again. But to hear it from the loud mouth of Donald Trump? I'm intrigued and I want to hear more...<br/><br/>If his whole ""build a wall"" immigration plan was like throwing red meat to the Republicans, talk like this is no doubt red meat for liberals.",0.775
44,"hmm, as is often the case in comments (mine included) you're drawing way too much inference, and you didn't read my comment carefully.  In my world, I am completely in agreement with you that Corinthian should pay for its harm.  Thus the second clause in the second sentence of my comment.<br/><br/>And I agree with you and GMooG and Roy and r... Our nation would be a far better place if companies like Corinthian were forced to pay the full costs of their business.  This includes traditional bad actors like oil companies, whose profits directly link to polluting our earth and changing our climate, and traditional good guys like Apple, which evades taxes on its profits but makes full use of our public infrastructure.",0.7607
45,"Think all the flag wavers want to increase their taxes to properly take care of our service personnel?  Aye, there's the rub.  Much easier to let the guy cut in front of you. ",0.7579
46,"I'm ready to have the service fee included in the bill, just like it is in many parts of the world. It is clearly written on the menu so there is no surprise when paying bill.  Many restaurants in the U.S. do this already.",0.7458
47,"It is distressing that we do not recognize that housing which is safe and affordable for all is not something we should be trying to enable. Study after study show that this pays for itself in reduced crime, better parenting, better educational achievement, better jobs, and significant contribution to society and to our GDP. It pays for itself.",0.7351
48,"Can  you substantiate these ""huge tax surcharges""? And as for all Americans paying for subsidies equally, well, the 1% have done quite well ensuring that they do not pay their share of taxes. Now, go on and rant about something else. PPACA works, and it works well. Deal with it. ",0.7172
49,"@ Bill, The Clinton's finances have been sliced and diced since they have been on the public stage and most recently the Time's did some pretty heavy reporting on their income stemming from speaking fees and their charitable foundation.  This kind of scruitny comes with the territory of running for president it seems. The question you might ask is when will the Time's do some investigating reporting into Jeb Bush's private sector pillaging of the past seven years?  ",0.7096
50,"So you've priced the cameras, seen municipal budgets and tax revenue, and confirmed that it's do-able?<br/><br/>I used to think that the Times attracted the better sorts of readers.",0.6908
51,"One of the more reasons why you, I &amp; others who can afford to pay more than our share towards community is same as the reason why america keeps paying for problems half way around the world-because we are ""alive, happy and rich at the same time""<br/><br/>Think about the places on this earth about people who work very very hard still cannot get a decent living.",0.69
52,"For goodness sake, do some research. This is not about pensions and benefits.",0.6808
53,"""Congress surely did not want to give companies a more efficient means of slashing payroll costs while pushing more people to the curb""?  Given all the other manifestations of class warfare, can we be so certain Congress did not intend or at least anticipate this outcome? Also, I love the reporting. We are told there are loopholes, but not one example is provided. ",0.6774
54,It isn't the presence of crucial safety nets; it is the issue of who pays for them? And what happens when life spans grow and birth rates shrink? Who pays the taxes to pay for those benefits?,0.6747
55,"Funny isn't it, how these areas ""far removed from D.C."" voice no such misgivings about the disproportionate stream of government pork flowing their way, even as they benefit from the spending and employment engendered by military bases and defense industry contractors. Talk about dissonance!",0.6696
56,"Paolo may be right Professor. Indeed, one can make an argument rates were held too high in this period and QE changed the income vector through the carry trades required to implement the thing. Rumor was that Fama was looking at the data to show how the short end of the curve was being held up. (Certainly on the TWIST stuff.) Further, the Fed is sending over 100 bil back to the treasury every year above the expense of running the place. That income is derived from borrowing short and lending long, with no capital call or mark to market. Every bank and the wealthy have done the same thing in some form.<br/>""never have so many been responsible for the wealth of so few"". ",0.6557
57,"Having retired I have no need for an extensive wardrobe - I gave half of it away and still have a lot of things I don't wear.  I also do most of my shopping, such as it is, on-line.   I have a house full of ""stuff"", and don't need to accumulate more.  I would rather save up and spend what extra funds I have on travel and visiting friends, rather than just accumulating.    Retailers also need to realize that incomes for the vast majority of people - whether working or retired- have been basically stagnant. ",0.6557
58,"Besides making some people feel better, proposing higher taxes on the ""rich"" may not make a substantial difference.<br/><br/>First, a reality check.  Accoring to 2011 CBO data on American household income and taxes, the upper 20% of households paid almost 70% of all federal taxes.  The lowest 40% of households paid less than 5% of federal taxes.  Incremental tax policy changes since then will likely show a small progressive shift.  We can still argue about fair shares of the tax burden, but let's start with the data.<br/><br/>Second, if you seek to equalize economic status through taxes, be careful what you wish for.  If you capped ""legal"" income at the level of the 99th percentile, taxed away the 1% ""excess"" and divided that among the rest of US households, each family would get about $8000.  There is no magic teasure trove that if rescued from the ultra-wealthy would fix the inequality problem.<br/><br/>To do that, we need to address the actual earning potential of US workers",0.6374
59,Barbara Ann<br/>The money going to the government goes into a general fund<br/>How would you feel if the trustees of your retirement plan spent the reserves on battleships instead of conserving them for the beneficiaries like you?<br/>Don Levit,0.6249
60,"I for one welcome the rise in taxes that Bernie Sanders will bring.  <br/><br/>This nation was sold a bill of goods during the 80s that government was the problem, when most of us -- including even the wealthiest amongst us -- receive much more collectively than we would ever be able to afford individually.  <br/><br/>The George W presidency left billions of dollars for the war and occupation of Iraq off the books rather than raise taxes to pay for it.  Instead we've seen those dollars redirected away  from public libraries, public parks, public roads, public schools and public colleges, public policing and public fire protection  -- those shared institutions and basic infrastructure we all need as a nation to surviive and thrive into the future.  Right now the nation is literally crumbling around us.<br/><br/>Imagine if just a tiny fraction of all the wealth that is being held by a few families in this country were reinvested in the nation.  This is a goal we should all be working for.<br/><br/>I support Bernie Sanders for President, even with his unruly hair.",0.6249
61,"The GOP has convinced many voters that they are suffering economically because of spending on social programs like SNAP and ""entitlement"" like Social Security and Medicare.<br/>Unfortunate some Times columnist such as Thomas Friedman, David Brooks and Steven Rattner have espoused this false concept.<br/>The Democrats must make clear to voters how the tax code is the culprit.<br/><br/>This table shows tax breaks main ly for the rich.<br/><a href=""http://www.nytimes.com/interactive/2013/03/17/business/tax-breaks-mostly-tilted-to-wealthy.html?ref=economy"" title=""http://www.nytimes.com/interactive/2013/03/17/business/tax-breaks-mostly-tilted-to-wealthy.html?ref=economy"" target=""_blank"">http://www.nytimes.com/interactive/2013/03/17/business/tax-breaks-mostly...</a><br/>160 B /year is lost by not taxing capital gains and dividends as ordinary income. The top .1% receives half the capital gain income.  However the ordinary person with a 401k/ 403B plan has all of his capital gains and dividends taxed as ordinary income [and not the lower capital gains rate] upon withdrawal. He is getting shafted.<br/>About 43 B /year is lost by not taxing unrealized gains at death [the step up in basis].<br/>In addition about 400 B /year in income tax due under the present tax code is uncollected. In 2011 7000 millionaires paid no tax.<br/><br/>see  <a href=""http://www.economist.com/news/united-states/21578387-irs-has-behaved-badly-real-villain-congress-who-will-tame-taxman"" title=""http://www.economist.com/news/united-states/21578387-irs-has-behaved-badly-real-villain-congress-who-will-tame-taxman"" target=""_blank"">http://www.economist.com/news/united-states/21578387-irs-has-behaved-bad...</a><br/><br/>Yet the GOP plan is to cut Social Security and Medicare instead of removing tax breaks for the rich.<br/>This is the case the Dems have to make and they must make it in terms that lower class voters [who have been voting GOP because of guns, school prayer abortion etc] will understand.",0.6239
62,"Nice to know that “Los Angeles still has a much larger middle class than your average developing-world city.” If not for that grudging admission, we might think L.A. was actually Guatemala City.<br/><br/>That will be my last attempt to one-up Ann Coulter. She’s MUCH better than I could ever be at this.<br/><br/>But it says a lot that some of the most energetic support for illegal immigration amnesty as well as unrestricted immigration comes from a state that has such problems with homelessness. California’s unemployment rate is 6.3% while the nation’s is 5.4% and that of Texas 4.2%. And it’s not like the L.A. area and CA generally couldn’t generate employment – the author’s own citation of the middle-class strength of manufacturing long ago enjoyed in L.A. attests to that. Of course, that was when CA was solidly Republican. Seems its economic troubles really started with Jerry Brown’s FIRST gubernatorial term, starting in 1975 (I was there).<br/><br/>CA is one of the most heavily-taxed, most oppressively regulated states in the Union. Its income taxation is so lopsidedly focused on the “wealthy” that when a recession hits affecting the income of those actually taxed, they become an economic basket-case because revenue is available from no other source. Yet despite all this high taxation and regulation, their middle-classes are disappearing. You suppose there may be a connection there that has nothing to do with the fact that despite the taxation and regulation, there are still a few who have money?",0.6174
63,"...""our government officials — who, unlike our friends and neighbors, are paid by you and me. ""<br/><br/>Oh please. Nearly every company email address involved here is subsidized by the public some way. Don't just point out the government officials. We all pay for everyone.",0.6124
64,"When Professor Krugman writes about the long-term funding shortfall being closed easily with modest increases in revenue, he's not talking about raising taxes on younger workers, contrary to Fox News' propaganda.  What he's talking about is lifting the earning cap on FICA taxes so that people making over $117k will actually continue to pay into the Social Security system, even after they've reached that cap.  Most younger workers, even those holding three part-time jobs, make less than $117k annually.  I'm old enough to start collecting on my Social Security, and just so you know, my 401k was depleted drastically during the financial crisis of 2008, so I'm really glad I have something other than Wall Street to depend upon during my ""golden years""!  ",0.6058
65,Sort of like here where the average citizen pays taxes and the well connected do not. Maybe they got the idea from us!,0.5983
66,"We should charge Government for medical research, since it should benefit every citizen.  There should never be profit connected to health care, Ever.",0.5851
67,But there are none so blind as those who believe they are being paid not to see.,0.5811
68,This only helps if the employer would be required to pay the fee into a fund that would be entirely redistributed to any displaced workers.  Having them pay the $50K to the Federal Government doesn't do those workers any good.,0.5719
69,"$127 Trillion:  the bigger, more ominous threat facing taxpayers are unfunded liabilities—the difference between the net present value of expected future government spending and the net present value of projected future tax revenue, particularly those associated with Social Security and Medicare. Source: <a href=""http://www.forbes.com/sites/realspin/2014/01/17/you-think-the-deficit-is-bad-federal-unfunded-liabilities-exceed-127-trillion/"" title=""http://www.forbes.com/sites/realspin/2014/01/17/you-think-the-deficit-is-bad-federal-unfunded-liabilities-exceed-127-trillion/"" target=""_blank"">http://www.forbes.com/sites/realspin/2014/01/17/you-think-the-deficit-is...</a><br/><br/>Still feeling comfortable, Mr. Krugman?",0.5616
70,"I've paid more than $250,000 into Social Security so far. If I had invested that money in the market, even with the past two days dismal performance, I'd have several million by now. If I collect Social Security for 30 years, the best I can hope to get back is about $300,000--a DISMAL rate of return. Keep Social Security for those who want to pay into it, but allow younger people to opt out BUT require them to invest that money elsewhere.",0.5549
71,"I have lived in Kansas for 13 years and the state is truly an embarrassment.  If I could leave and take my job, I would.  I truly resent being taxed on food so that rich farmers and business owners can avoid income taxes they can easily afford.  I am constantly bewildered by the outright ignorance of our state government and their denial of the obvious: trickle-down economics is a right-wing myth that only feeds inequality and exploitation of the working classes. ",0.5542
72,"You prove how hard it is for the left to debate politely. You make no point, you simply state ""you don't understand"". If the NYT will allow it I will gladly cite academic sources describing how Democratic Socialists wish to transition away from private property in favor of a more communal social sharing of property. They believe private property accelerates social inequality. Just own up to what you believe, stop being so ashamed. ",0.553
73,"The issue is not only the tax exemption to the religious body, but that contributions to those organizations are tax deductions to the donor as charitable contributions.  ",0.5499
74,Here's a question:  Would richly paid CEOs reduce their effort if their income was halved?  How would someone making $50 million per year reduce his/her effort if the only positions available were for $25 million per year?  Would it even matter?,0.5484
75,"As someone old enough to know - this is starting to become a lot like a Mcarthy witch hunt. I'm starting to believe that some of the American public would rather tear our public servants to shreds over nothing (advice communication!) than really have a functioning country. We have a choice to have a forward thinking, solution oriented government or a government that uses our money to hound good public leaders until they find the one teeny thing they can hang them with. That is not the country I want -it's not the way I run my life or household either. Shame on these small mean spirited 'so called' representatives. May you all be voted out.",0.5377
76,If you giv em independence you'll have to re-imburse all of the social security deductions with interests.,0.5267
77,"Now us regular folk get to pay fealty to them, aside from our tax bail outs. Wonderful.",0.5106
78,"No, we should not. I can immediately see unscrupulous 'researchers' (yes, there's a ton of them) jumping on the public money band wagon and cooking up purported benefits of various therapies. People with loved ones with dire illnesses will be very likely persuaded to part with their money if given any hope. <br/><br/>Instead I propose that we establish a federal government monitored fund for medical research. Anyone would be able to contribute into the general pool and the contributions would be state and federal tax deductible. Only genuine researchers with promising therapies, reviewed be a panel of scientists knowledgeable about the subject, would be able to pay for their research from this general fund..",0.5106
79,"Does anyone in their right mind still think trickle down works? We've had over 30 years of legislation favoring Big Business and the wealthy, and we have yet to see any sustained improvement for the middle/working classes. <br/><br/>Now we have Rubio wanting to cut taxes on investment income to zero, in a Country whose income inequality is the highest in 100 years, and whose debt is unsustainable. This, with a shrinking manufacturing base and a growing financial one. Patent lunacy. <br/><br/>Passive income should never be taxed at a lower rate than labor - that's a**-backwards. Talk about a laissez-faire fantasy. ",0.4939
80,"You fund private sector lifestyles with your spending choices just as much as you fund public sector employee wages with your taxes. And why do you care what people do with their wages, anyway?",0.4939
81,"Social Security has been paying out more than it takes in for years, eating into the ""Trust Fund"" of IOUs.  The problem is that those IOUs are going to run out in 10-15 years, and the current intake will only support about 75% of the benefits being paid out.<br/><br/>The short answer to the problem is that people are living too long.  Social Security was only supposed to provide income for a limited time to the average recipient, but the life expectancy and cost of living have risen faster than the eligibility age.",0.4678
82,"I reached 85 in March and haven't retired yet.  I lost my wife 20 years ago and promptly forgot about retiring.  Having the benefit of academic tenure I can choose when I will retire.  Being able to walk to work is also a factor governing this, as well as being fortunate to be in good health and owning my own home.  I am now thinking about retirement but haven't made a final decision yet.  So I don't fit the description of the people you chose as typical of this group.",0.4675
83,Who pays for a presidential run by a governor? Taxpayers? I'm sure he gets support from PACs and other places but do NJ taxpayers contribute to his run? We've already paid out millions to defend his corruptness and also over a million so he can go to football games. ,0.466
