,comments,scores
0,"I admit this is tax wonky, but it doesn't make sense to tax income attributed to a ""carried interest"" partnership investment any different from that attributed to a passive partnership investment (i.e., the current law makes the most sense--the tax characterization depends on the nature of the underlying income, not the ""type"" of partner you are).<br/><br/>However, it does make sense to tax the grant of the ""carried interest"" partnership interest as a tax realization event subject to ordinary income treatment.  The issuance of the carried interest ""profits interest"" is currently not taxed because it's ""out of the money"" and ""too indeterminate"" to value, although clearly in the aggregate this is a huge amount of compensation being tax free when you think of every partnership formed with a carry (from a restaurant LLC to a real estate investment fund).  <br/><br/>The simplest solution is to tax the grant retroactively after the profits interest becomes subject to a reasonably ascertainable value--after a liquidation event or when distributions start to look like an annuity.  You just go back and time and value the profits interest grant with full knowledge of its investment performance using a simple DCF analysis.  Then you apply some additional interest to compensate the IRS for the deferral.  In the end, only the winning investments are worth anything and pay tax.  And in the aggregate, the exact right amount of tax is applied by those who were granted securities in exchange for services.  ",0.9982
1,"For Greece, or any city, state, or nation (or any family) to support and sustain a Republic, Democracy, Theocracy, Capitalism, Communism, Fascism, Dictatorship, Kingdom, Principality or any other form of government that they select and/or is imposed upon them, that nation still has to have their privately owned businesses continuously create sufficient new taxable national wealth (and jobs) in their nation so that there is enough available wealth in that nation for that nation's government to confiscate a portion of that new taxable national wealth and/or profit that was created by the private sector businesses plus additional amounts confiscated through income taxes, sales taxes, property taxes, tariffs, etc., and other taxes by the government tax collectors to pay for their wealth consuming government activities.<br/><br/>This can only be accomplished by limiting government spending to less than the government collects in taxes!<br/><br/>Hopefully this can be done by each government without borrowing wealth from individuals and governments  (mostly in other nations who buy that nation’s Sovereign Treasury Bonds) to pay for their various wealth consuming government activities including any distribution of wealth confiscated from the wealth creators and then handed to the tax supported citizens.    ",0.9895
2,"It seems we are jumping in the middle of the argument instead of going back to ask the most basic questions:  What do we think a retired person should expect and who should supply it.  While there are surely risks we all take over the course of our working lives with our potential retirement that make everyone's retirement picture look different (job choices, savings levels, spending choices, children, etc.), is there really anyone who believes a retired person should not have access to affordable healthcare and some minimal assured income component?<br/><br/>In a country as rich as ours, isn't it essentially immoral for a child or a retired person (both frequently having no alternatives as they can not necessarily work) to forgo basic medical help because they can not afford it.  The same could be said of retirement income, which SS appropriately pays based on taxes paid into the program in the past making it somewhat meritocratic.  No retired person is getting rich on SS and Medicare will not cover everything, but surely it provides the bare minimum we should expect.<br/><br/>If privatizing was more effective (better coverage/outcome for the money), I would support it.  However, gambling an assured government program on a highly uncertain privatized one seems unreasonable.  When we look at who benefits (insurance companies &amp; stock brokers) I see why they want it, but fail to see how they make it more effective or efficient by adding a middleman too!  ",0.979
3,"""We need to rescue the country from the corporate interests that have engineered the extremities in wealth inequality and the preferences in the tax code. ""<br/>How do you think they got so powerful? Hillary fully supported repeal of Glass-Stegall and is/will be a shill for corporate interests. She and her husband and friends are culpable. The most honest and ""for the people"" is Sanders, whom the NYTs chooses to denigrate and downplay as much as possible because he is truly a force against the corporatist so buying our government.",0.9759
4,"Well, one thing that can be said about tax cuts for very rich people, from the view point of those very rich people, is that they get to keep more of the boodle, and make more on the boodle they keep, as a result of said tax cuts.  Take the Koch Brothers, whose combined net worth borders on a $100 billion dollars, and assuming a modest annual return 6% per annum return on capital (interest, diviendends, and capital gains), that means each brother starts with about no less than 2 to 3 billion dollars a year in unearned income, on top of which comes their salaries as executives for Koch Industries and service on various boards of directors.  Get rid of the estate tax, and the Kochs can pass their billions tax free to their heirs; create a flat tax and the Kochs pay only pocket change in tax for their annual income.  So the Kochs and their friends think tax cuts are the greatest thing since slice bread and make sure the whole Republican Party thinks so to! ",0.9697
5,"I believe that Mr. Edsall is incorrect when he writes that ""trade, taxes and social spending are subjects that have not yet achieved progressive consensus and retain the potential to fracture the [Democratic] party.""  The 2016 election is already shaping up as a critical contest between two diametrically opposed visions of America, particularly regarding taxes and social spending: the Republicans want to cut taxes for the wealthy and corporations and dismantle major parts of the safety net (i.e., Social Security, Medicare, Obamacare, etc.); and the Democrats want everyone to pay their ""fair share"" of taxes (which means increase taxes for the wealthy and corporations) and strengthen and secure the safety net. If the Republicans win the presidency and retain their majorities in the House and Senate then the already deleterious polarization that is tearing this country apart will reach a critical point. ",0.9674
6,"The Republicans must have a cause, a purpose, that they can sell to these major donors to get them to open their checkbooks. Hammering those who make less money is the facile course. The oligarchs look down up the workers and see them as unworthy, unwashed and uncultured cheats. They imagine that they, the rulers and owners, made a rich, successful nation on their own. They cast themselves as heroes in a drama of their own imagination, forgetting the collective contributions of the nation and the real risks of injury and death many workers took to build an economy and our nation.<br/><br/>The Great Recession of 2008 sprang in large measure from new methods to transfer wealth from the economic middle class to those with excess capital. Cheap, easy loans would, it was hoped, produce long paying, 30 yr. mortgages that would pay and pay. Then, the management class, those who work for the mega-rich, got too fancy and turned junk loans into triple A securities and the cards tumbled down. So, new ways to transfer wealth upward must, always, be found.<br/><br/>Cutting govt. spending might, at best, knock 100K off the taxes of someone taking in 10 million per yr. Never mind. A man can dream, can't he? The idea is to stop future threats to the wealthy, to ""starve the beast"" so that wealth and power continue to accrue to the most wealthy, and their progeny, for now and ever more. Then, the earthly paradise would be complete.<br/><br/>Hey, once you have everything, there are still things to fight for.",0.9628
7,"Yes, fighting the Derp of constant demands for self interested proposals which are based on dishonest analysis is key.<br/><br/>Which derp is the most important?  Well, the first thing the conservatives did when they took over the congress last month was to demand drastic reductions in inheritance taxes.  Currently, only rich people (inheritance over $500,000) pay inheritance or death taxes.<br/><br/>This is similar to rich people's constant demands for lower income taxes.  But inheritance gets less publicity, possibly because few people pay any inheritance taxes while most voters and media audiences pay income tax.<br/><br/>Thomas Jefferson outlawed extreme inheritance in Virginia because it gave too much power to the individual who inherited extreme wealth.  This has become ingrained in our culture.  We now expect all the children in a family to share the inheritance, not only the eldest son.  <br/><br/>Some societies destroy the wealth of their richest people upon death for the same reason.  The book Origins of Inequality from Harvard University Press, as well as Piketty's book on capital, give  discussions in death of concentration of wealth and the growth of inequality both 20,000 years ago and today.<br/><br/>The derpish claim that inheritance taxes are harmful is the opposite of the truth, and is possibly the most important piece of derp around.  We do not need more Koch brothers, not to mention King Georges.  <br/><br/>Go to YouTube and watch Comedy Party Platform (2 min 9 sec) to see what to do.  ",0.9624
8,"As to actual policies of JEB! administration (or Walker, etc.), they will probably be what Paul Ryan has proposed: huge tax cuts for the very wealthy (abolition of estate tax, capital gains tax, tax on dividends, reduction of corporate rate to 23%, reducing the income top rate);  austerity for non-defense spending and privatization of Government functions and employment (no investment infrastructure, public education, or research R&amp;D); repeal of environmental and public health protections; expand the U.S. role in its current Middle Eastern wars (which will probably drive up the price of oil); generally spend a lot on Defense while cutting the social insurance programs of  Social Security, Medicare, and Medicaid and repealing the Affordable Care Act; and finally appoint John Taylor or someone like Taylor who believes that real interest rates need to be higher.  Absent the ""confidence fairy"" and ""tax cut fairy"" creating some sort of bubble, this set of policies, particularly the high interest rate and war in oil producing countries policies, is not likely to set off a growth explosion, likely the opposite.   ",0.96
9,"If you are spending more than your income of tax collections, then you and/or your government have to borrow the difference.<br/><br/>Government spending only consumes that nation's economic wealth and economic capability.<br/><br/>Only private businesses wealth creation activity creates new taxable wealth, and that new and existing privately owned taxable wealth is the primary source of funds to be confiscated by governments through taxes to pay for any and all government activities.<br/><br/>Government expenditures do not create any new taxable wealth.<br/><br/>Government Contracts to private businesses to create infrastructure, weapons, social programs are also paid for by the taxpayers and do not create any new national wealth. <br/><br/>Government activities just consume the national wealth that was created by non-government employed citizens who did create new national wealth that was confiscated by the government to pay for those government activities!",0.958
10,"""The superrich are always with us (or on top of us)""<br/><br/>But, for a time, before Republicans persuaded ordinary people that the rich couldn't be taxed at 90%, any longer, lest they cease to invest. Clearly, this is the same as saying that the rich would refuse to continue to be rich, despite all evidence to the contrary. For example, in the '50's, TIME wrote that Barbara Hutton, the heiress to the Woolworth's fortune, had a tax-free annual income of $2,000,000, when that was a lot of money. She did this by investing the bulk of her inheritance into tax-free municipal bonds. Municipal bonds pay so little interest that they're usually bought only by the 1% as a tax-dodge. These days, there's no need for the rich to invest in the maintenance and repair of the national infrastructure as a way of avoiding ""punitive"" taxation. They're free of any taxation worth bothering about, to begin with. ",0.9537
11,"Dude, read my entire post before you respond. The last sentence clearly indicates a need for tax revenue, just not an income tax because in a truly free society where liberty is cherished the government has absolutely no business knowing about my finances. Just because your are willing to give your personal freedoms up to the government does not mean other citizens, which includes many democrats and republicans, are willing to cede their freedoms.  ",0.9502
12,"The article forgot a small point: the committee abortions are free under the national health system. It's not that the private abortions are illegal; they're entirely legal procedures by licensed medical staff in regulated practices. They're just not paid for by the public health system, which is to say. Y the government.<br/><br/>Maybe the author would prefer to be in neighboring countries Egypt, Saudi Arabia, Jordan, Syria, or Lebanon. Best of luck getting a government funded abortion in a high quality clinic there. For that matter, best of luck getting an insurance funded or government assistance subsidized voluntary abortion in the U.S. - those don't exist either.",0.9432
13,"Tom:<br/><br/>Although you didn't mention him in your op-ed, I noticed that a candidate named Bernie Sanders is running. He seems to have a few ideas we haven't heard for a while such as the idea that a country that is wealthy enough to spend $1.4 Trillion on the F-35 Joint Strike Fighter (that is, about $4,000 for every man, woman, and child in America) is also rich enough to provide a free public college education to all who want it. Or that a country that can spend north of $4 Trillion ($12,000 per capita) blowing up Afghanistan and Iraq is wealthy enough to also provide health care to all of its citizens.<br/><br/>He's also got some good ideas about campaign finance reform, ensuring everyone has work, preserving retirement savings, and the like.<br/><br/>Honestly, there's no reason to cry ""None of the above"" this time.",0.9349
14,"I'm well into my 80s, and what I remember from the 1930s to the present is Republicans saying over and over, we'll never see a cent of Social Security retirement. Or, our kids will never see a cent. Social Security is nothing but a Ponzi game. These sage comments notwithstanding, Social Security is still with us, is popular with most of us, and with a slight increase in the tax will be just fine.",0.9313
15,"""The conservative opposition to ACA is because ACA increases taxes on the rich to help pay for care of the non-rich and the rich do not want to pay these higher taxes.""<br/><br/>Our health insurance premiums doubled and our deductibles tripled. We are middle class people not rich. Tell us how we benefited when my wife is post menopausal and we have no children at home? ",0.9257
16,"Privilege is just a synonym for slack (as in cut me some), for benefit of the doubt. It's nothing to be ashamed of getting, unless and until you're allowed to do something shameful because you've been given more of it than you can handle. At large in society, it's something to be shared more widely. If all the young black and brown men in America were cut the same slack I am, we'd save hundreds of billions in prison spending. Sharing the privilege, unlike sharing the wealth, doesn't cost anyone a dime, while conveying similar benefits.",0.9239
17,"Jeb! Would have wealth funneled to financiers instead of funding infrastructural. Jeb! would have money compounding in dividend schemes rather than supporting social programs. Jeb! would have the one-percent get wealthier while the 99 flounders to pay mortgage and rent (collected by the one-percent). What is disturbing is that the voters believe this voodoo nonsense. Foot soldiers like Limbaugh and Hannity and O'Reilly drumbeat the message with an idiots confidence so the masses believe it.  Jeb!'s bliners will take us down his brothers path, manipulated by the oligarchs his regime will fund the one-percent and continue this massive wealth divide between the haves and the have-nots. The left needs their own foot soldiers to stand up to the right's and educate the masses on what benefits everyone. ",0.9212
18,"Public employees in this country are routinely looked down upon. The attitude is that anyone can do those jobs. Furthermore, their pay comes from taxes, and most Americans think that the less they pay in taxes, the better. The Republican Party believes that ""government is the problem,"" and they want to ""starve the beast."" Another term for public employee is public servant. Who respects a servant? Who wants to pay a servant very much? Anyone can be a servant? Teachers fall into this category. Until Americans value intellectual achievement as much as monetary success, nothing will change. And that will be a long, long time.",0.9192
19,"These seniors in the article are doing well because of social security, pensions, medicare, government jobs, unions, low-cost education, equity in their houses, etc. Future generations will not be so lucky as republicans attempt to dismantle all of these support systems that made america great. We will begin seeing seniors will enormous debt, no pensions, no equity, no savings, costly healthcare. Good luck.",0.9065
20,"It shouldn't be surprising to see that people display what academics call ""last place aversion.""  Are you a human, with human emotions?  OK, stop and reflect for 2 seconds, as that's all you need to come to the same ""revelation.""  <br/><br/>Some parts of soft-sciences academia is truly insightful, but too much is like a nine-year old spending huge amounts of time and money to learn the obvious wisdom of their elders.  Then, people write these up in these unsatisfying blogs for clicks.  I loved Freakonimics, but I hate the cottage industry that book has generated.<br/><br/>Anyway, I originally chimed in to say that the $15 federal minimum wage proposal is inane, and this blog post shows you why.  Just because Americans on the coast run up their own cost of living via zoning and excess regulations (many are good, but many are created for ugly rent-seeking behavior) - doesn't mean that they should impose a blanket labor cost for the rest of the country, where $15 might be close to the median wage.",0.9024
21,"I can understand the thrill and appeal of the sport. But I also recognize the self-centered and selfishness it represents.  My biggest objection is the cost that the taxpayer must pay to mount the search and rescue.  I hope the Park Service sends a bill to collect from the estates for those costs. If they ever legalize it, I think it only appropriate to require a pre-payment bond of search and rescue expenses before being issued a permit.  While they may accept the life and death consequences of their actions, they must also accept the financial consequences.",0.8957
22,Good for her.  I would admire her even more if she puts some of her profits from  reality shows and other income related to her change to help others in similar positions.  (or is she doing that already?),0.891
23,Good for her.  I would admire her even more if she puts some of her profits from  reality shows and other income related to her change to help others in similar positions.  (or is she doing that already?),0.891
24,"I agree with you but why should those who raise ""heartfelt objections"" be made to support this through tax payer funding?<br/>It is not unreasonable for those who oppose abortion for whatever reason to not want to pay of it - why is that not rational?",0.889
25,"Agreed, PubMed is an awesome taxpayer-funded resource for making research accessible to everyone. And, if the article IS available for free because of the journal or because the researchers paid for ""open access,"" PubMed will generally have a link to it at the top right of the screen. ",0.8834
26,"Michael, I and Sarah Palin applaud your application of common sense to the complex issues of our day - if only our dancing pet horses didn't have to pay for their own care and upkeep, then America's problems could be solved. The savings could pay for a new yacht for Mitt Romney, and workers salaries to make that yet ... if you multiple that by the number of pet dancing horses in America I am sure it is enough to fund social security and medicare through the year 2197.",0.8805
27,"No your understanding is not correct.<br/><br/>Federal payments to Puerto Rico are both direct and indirect. Social Security (including disability), Section 8 housing, food stamps, indirect such as exemption from Fed income tax, subsidized borrowing by government, subsidized borrowing for homes. The list goes on and on and yet PR still borrows to just top their incomes up a little more.<br/><br/>Greece borrowed rather than receiving subsidies as the Euro zone isn't much of a ""transfers union."" The United States is a transfers union and Puerto Rico is a huge recipient of transfers. Some, and as much as I hate to say it, myself, would like to increase subsidies but Puerto Rico is in a class all its own when it comes to receiving subsidies.<br/><br/>If subsidies and loans to Puerto Rico were similar to those made to Greece they would likely have living standards comparable to the Dominican Republic or Jamaica. Instead they are far wealthier and well off. ",0.8765
28,"In exchange for what?   Look at the distribution of spending.  It is highly concentrated in the top 3-25%--those from $110,000 to $200,000 family income.   A VAT is the only way to tax them.  The ""left wing"" Obama promised he would not tax the ""middle class"" in this rich category.  The rich naturally are against a tax that hurts them and like to claim it hurts the poor.<br/><br/>If Social Security is abolished or made progressive, the poor should come out ahead.   If the middle income are guaranteed a European health system and are relieved of health insurance premia, they come out okay, especially since employers should be taxed directly or indirectly as a replacement of the health insurance payments they would no longer pay.",0.8519
29,"Here we go again!  Wall Street's ""best and brightest"" or is it the ""masters of the universe"" have struck again.  Politicians will see to it that the banksters and hedge fund managers (aka, their campaign donors) get bailed out once again and the 99% get stuck with the tab.<br/><br/>Republicans want to privatize social security and any other government service they can get their hands on.  Beware of the GOP and Wall Street democrats.   <br/><br/>We need Bernie more than ever.",0.8478
30,"See David/acton 's comment. The Social Security Administration has it figured - you basically get equivalent amounts over the long run, no matter when you begin, and a bonus of you outlive the ""payback"" period.  Most experts recommend waiting if you can, if you expect to be alive, because if you are looking solely at the income generated, there is nowhere else you can park the money and earn *8% a year right now.",0.8473
31,How long would it take for a means tested Social Security and Medicare to be demogogued as welfare?  Social Security can be there for everyone if the FICA limits were raised to reflect today's salaries and we should be discussing Medicare for all instead of endowing health insurance companies as middlemen.  Perhaps the worlds brightest kids(?) whom we are currently educating will see through Mr. Friedman's dissembling.,0.8466
32,"Here in the USA we have recently elected the very best congressmen, congresswomen, senators, governors, presidents and other government administrations that money can buy!<br/><br/>These elected and appointed officials do, however, offer no-bid PAY TO PLAY government INFRASTRUCTURE construction contracts funded from the public treasuries and their legislative votes for sale to US citizens and to foreigners at very reasonable prices!",0.8392
33,"And, you will lose most of your Social Security benefits when you teach.  I worked for 26 years and then became a teacher for 20.  My reward, almost all of my benefits were taken back by the government.",0.8225
34,Airlines have created a cast system by treating some people like cargo. They did not build the airports provide the government funding that that helps companies develop  equipment  that they make a fortune on. They because off their treatment of the public should be regulated like a utility.,0.8225
