,comments,scores
0,"Money is worth more than miles. You can spend money anywhere, at any time. <br/><br/>I am not an embittered occasional flier. In fact, I have redeemed mileage in the last 5 years to go to Indonesia, Japan and Australia. And I'm still accruing mileage -- by flying.<br/><br/>But mileage credit cards are not worth it, except when they have a huge bonus, at least 30,000 miles, as an introductory enticement. I use credit cards that give me 1.5% back and I'm happy with that. Occasionally I encounter someone who tells me that they get 2 miles per dollar spent and theoretically that's worth more. Yeah, good luck spending that. ",0.9816
1,"There's lots of ways to use the need for a rush and help others at the same time: EMT, smoke jumpers, emergency medicine, fighter pilots, search and rescue (well that's not a ""rush"" but might have been better for them). <br/><br/>Those that admire these narcissists should admire those who use their talents to serve others in need at the same time. Not just ""show off"" and then require genuine rescuers to try to rescue them!",0.9761
2,"Having never lived in the US or flown on any US airlines, it's interesting to read the comments from American's in respect of the poor service the US airlines provide.<br/><br/>Compare that to the airlines I often fly, Emirates, Etihad and Air New Zealand, and these airlines consistently rank in the top 20, top 10 or lead awards each year in the world airline awards. They're consistently innovating and very rarely complaining about outside factors.<br/><br/>In the overall 'World's best airline' category, which takes into account service, timeliness, price, catering, affordability etc, an American airline isn't seen until you get to #26 - Virgin America. <br/><br/>It's off-topic, but interesting that in the face of continued allegations coming from the United, Delta et al, aimed at the Gulf Carriers, that the most important part of their business is being ignored - customers.<br/>Their approach to an increasingly competitive and global industry doesn't seem to be innovation, efficiency or customer-first, but rather scale-up, smother, lobby and hope. ",0.9683
3,"RJG--<br/><br/>That IS the issue.  Delta's de-valued the currency so much that a poor guy flying 50K miles a year on DL doesn't have a shot at a  better seat, upgrade, more legroom or getting a re-booking for weather or mechanical IRROPS situations.<br/><br/>The credit card miles (and those who exploit them) have completely corrupted what WAS a simple premise: ""Fly a lot with us and we'll reward your loyalty with better service and free leisure travel"".<br/><br/>Credit card miles (and other affinity programs) have destroyed the value of the currency. And, with load factors high and financial incentives to de-value further, those precious SkyMiles will turn into the modern day equivalent of Weimar Deutschmarks in 1923--  a million miles of flying will get you an upgrade from RDU to ATL on a Delta Connection Beech1900.",0.9603
4,"   Many commenters are sharing their justifications for using Uber over cabs, and insinuating that whatever benefits Uber has are intrinsic.  I doubt that.  Around here, I can get a real cab anytime I want one.  I can even hail it with my phone ( call or app ) if that's a huge deal.  I can schedule one to show tomorrow to take me to the airport, or wherever.  They will text me an update when they are on the way.<br/><br/>   Best of all, the cab that shows up isn't part of a criminal enterprise.<br/><br/>   Even if you think Uber's highly-questionable business model is the greatest thing since sliced bread, how can you support a company that does business the way they do?  Their treatment of journalists alone is despicable.",0.9564
5,"Yes, 20K Amtrak riders use the tunnels each day.  But there are another 90K or so NJ Transit riders that also use them on a daily basis. That is a big difference, no?<br/>Also, the number of riders would increase greatly if the proposed Gateway project were to be realized: more trains, more reliability, increased speed and greater safety.  All those add up to much-improved socio-economic benefits for all in the region (and the rest of the country, too).",0.9563
6,"I have never used Uber and I don't live in NY but, from what I have read, the public likes the convenience of Uber (nobody is forced to use the service) and a lot of the Uber drivers are ex medallion drivers who seem to feel they were being ripped off by the likes of Mr. Freidman and that they are better off working under the Uber model. The legal hassle between Citibank and Mr. Friedman seems pretty irrelevant... And what is Citi going to do with a bunch of repossessed medallions anyway that are losing value by the minute? :)",0.9517
7,"I guess It's the Wisdom, Stupid.<br/>Scott Walker could orbit the sun for 150 years and still be dumb as a rock.<br/><br/>Sully Sullenberger is a great guy who did his job. I guess in America right now that is enough to get you a news job, a mention on the front page of the NYT, and Clint Eastwood thinking Oscars. Everybody likes Sully Sullenberger and his calm head has won him the designation of Sane Male in America, so he might not want Eastwood messing up his reputation or asking why US Airways couldn't figure out how to have planes fly higher than migration paths of birds that have been doing that for oh, forever.  But, anyhoo, Possible Spoiler, maybe he will make calm, middle-aged females doing their jobs ""a thing"" too, and possibly code for Vote For Hillary since she too is a calm middle aged female navigating the geese who would jam the jet engines of America, like that. Clint can be unpredictable since he actually IS old and talks to chairs while being a global treasure. Oh, Hollywood.<br/><br/>Meanwhile, back at the ranch, Reince Prebus has been ""making house calls with leeches"" for quite a few election cycles now. ",0.9445
8,"The drought and job climate is hitting many small Western communities hard, in the Sierras and Cascades the ski-based and tourist-based economies have been particularly hard-hit in the past few years.  After 25+ years in ski towns, however, my husband and I are committed to staying in the mountains and raising our son in a small town with high social and community values.  In exchange, we forfeit higher salaries and amenities many of our peers take for granted.  On the other hand, like the bumper sticker says - ""My life is better than your vacation!""",0.923
9,"During my last trip to Brazil, I was in Búzios, walking around that tourist town on a Tuesday night. Down a trendy street was lots of noise and bright lights. I walked in its direction to find a Pentacostal church in full swing. So much shouting and carrying on. A Brazilian man next to me on the sidewalk said to me, ""They go there because of the air-conditioning."" Was he being cynical or sharp?<br/><br/>A few days later I was back in Rio, in a taxi, speeding passed what seemed to be miles of huge charter buses. I've never seen anything like it in the U.S. The taxi driver said, ""There's a Pentacostal event in town."" I was amazed. <br/><br/>I lived in Brazil when I was a child, and I know the people need something. But this is really just an extension of what they've always had: wishes and magic. I hope this is just a necessary phase in a sad history. <br/><br/>And then there is the beautiful, artistic, musical Brazil. Thank God.",0.9201
10,"Get off your high horse much?  Blatter (he from ""Europe and the West"") is the problem.  He will use anything as an excuse to reverse course come December.  At the mere mention of Asia and Africa (here and on other article comment boards) people love to jump all over the brown folks dragging the innocent and virtuous West down.  <br/><br/>Now maybe you can see why Blatter is so good at controlling the conversation.",0.907
11,"I am decidedly ""a car guy."" I work my truck hard but I don't let rust get the best of any vehicle I own.<br/><br/>Had you done that, the investment in a new engine would have kept your reliable truck going for many more years. So man up, get a new truck and keep the rust at bay. A faithful vehicle deserves more than regular oil changes, sir.",0.8873
12,"After the diamond, diamond preferred, platinum, gold, ruby, priority emerald, super gold plated, etc passengers have boarded first with ""priority boarding"" - there is nobody else left to board. Thus there is little benefit. ",0.8862
13,"This is the sort of garbage that gives opponents of the fast track trade deal even more political ammunition. There have been sound arguments in support of the TPA, but when we see the rabble in corporate boardrooms pull the stunt that Disney has pulled, it's awfully hard to trust anything that big corporate interests say will benefit us.",0.8835
14,"As an infrequent flier with a status somewhere between lead and copper, I am quite pleased with the fact that there are people willing to pay $1000 for a round trip from NYC to San Diego, in return for an extra few inches of legroom and a free cocktail. Thanks to their subsidy I can make the same trip in the back of the plane for $400, which barely even covers my share of the fuel cost.",0.8805
15,"Actually, one possible positive of automated cars and/or 'smart roads' is that the cars would travel much faster.  Speed is not really the problem.   It's differentials in speed and poor driving (following too closely for example).    If all cars were automated, they could be spaced closer together and travel faster.  But yes, I'm very concerned about security and privacy issues.  ",0.8713
16,"In my basement I have a box which contains ripped (how else could they possibly be?) ticket stubs from the '70s from NY Ranger games ($12 for sixth-row seats. Remember when red seats were affordable to simple people like us, NYers?), Met games at Shea, and Jet games at Shea, too. <br/><br/>This new ticketing style has also affected concerts, and I saved my stubs from Central Park shows ($5 for the best seats, $3 for the others) and other local arenas.<br/><br/>It's just weird these days when I go to any event at MSG and they beep me in with their scanner hovering over my letter-sized computer printout. <br/><br/>Bring back real tickets!!!!!",0.8667
17,"I noticed the pride in comments like ""Mom is 94 and she still drives"".  I'm 72 and I'd like to keep on walking without being picked off by someone who didn't know when to stop driving.  <br/><br/>I realize older people have a need of mobility, but knowing that someone with reduced reaction time and impaired vision is breezing along in ""control"" of a 3,000-lb vehicle is scary.<br/><br/>There comes a time when hopping into the car is just a bad idea, and people can still pass a vision test but have limited vision.  States need to look into ways of helping people meet their transportation needs so they can hand in the keys.",0.8589
18,"I've spent a lot of time figuring out what data to collect and how to analyze it. And reflecting deeply on that process can take you to some very dark places.  When you take a step back, you realize that values are implicit in the entire process. But which values should be? At some point, you realize that the values themselves can be driven by data. And the values suggested by data take you someplace very distant from where we are, someplace much darker -  closer to God I think, and that is terrifying to understand.",0.8442
19,"Rubio's first hand knowledge of economics is using the credit cards of the republican party of Florida for auto repairs, fuel, flowers, groceries and pavers for his driveway.",0.8176
20," names such as ""economy"" which might as well say ""lower class"".<br/><br/>I think ""Steerage"" would be appropriate.  Add a few cows or goats for authenticity.  I fly once every two or three years instead of two or three times a year now.  Then again, I don't go to baseball games any more when I visit the States either. Anyone got an unused stadium suite for me and my friends?   I had a great trip last year from Los Angeles to San Jose on Amtrak, though.  How long will that last, though, with the current line-up in Congress?",0.8156
21,"We say about some people that they seem to be ""an old soul.""  Such people when we meet them may actually be quite young in years, and many of those I've met have not been particularly adept in some kinds of social skills (like those involved in poker playing or hard bargaining or finessing) -- their success with others seems to come from a deeper place than ""skills.""  I think I saw Candidate Obama as such a person.  How such people bridge the gap between their perspective and actually governing -- the pragmatics of assembling people around them to implement their policies and vision and to get on board with those action plans those beyond their team -- I don't know.  Plenty of older people have ""younger"" souls and social skills better suited for getting what they want, including assembling a team that can do that.  But what such people with younger souls and such social skills seem to want is often self-serving or worse, as they have less insight.  I guess what I am saying is that age is relevant as a factor, but it's only one of many, some of which we never talk about.  We get in each candidate a package of this and that, and we try to choose the best combination of those features in the choices we have, it seems to me.<br/><br/>As for the geese, they were in the sky before we were flying planes.  Maybe someone will file suit on their behalf, for wrongful consumption by a jet engine.",0.8047
22,"Best example of traffic paralysis/overload in my neighborhood is Interstate 15 southbound toward LA backed up a few hundred miles over the Nevada border Sunday afternoon.  20 lane highway is not practical. <br/><br/>America is the new Third World with Rockets, with better food. <br/><br/>Stakes are proportional crossing the Hudson.<br/><br/>We are living in an era of negligent leadership our descendants will earn degrees writing about. ",0.802
23,"A good and sensible argument. Brought to mind a line I saw recently, attributed to Ellen DeGeneres: “Do we have to know who’s gay and who’s straight? Can’t we just love everybody and judge them by the car they drive?”",0.782
24,"Good, indeed.  If you have time, jog or walk the path around Christ Church Meadow.  It's lovely.",0.7717
25,"It is regretable that global warming became a political issue rather than a technical challenge.  It should have never happened.  I don't know who to blame but it was stupid, beyond belief.  <br/><br/>Republican President Isenhower, when he found himself between a rock and a hard place on putting the Intertate Highway System through an uncooperative State system, came up with the Defense Highway System which got him over the Constitutional challenge hurdle.<br/><br/>Likewise on Global Warming, President Obama should direct for National Security purposes two major Defense projects, <br/><br/>1) A Defense Interstate Maglev Transport  System which would result in the development of a 300 mph superconducting Maglev national logistics network for passengers &amp; freight trucks, see:  <a href=""http://www.magneticglide.com"" title=""www.magneticglide.com"" target=""_blank"">www.magneticglide.com</a> for concept, that would interconnect the major metro areas and ports of the country. 74% of the population would live within 15 miles of a Maglev station.<br/><br/>2) A Defense Maglev Launched, Space Based Electric Power Generating Satellite System to beam electric power to receiving stations on Earth for distribution on Grids. <br/><br/>This should be done as an International Project like the international space station so as to avoid it being used as a military weapon.  This same system can be used as an Asteroid Defense System &amp; as means to increase global communications.<br/><br/>These projects are described in ""Maglev America"" by the superconducting Maglev inventors, Drs. James Powell and Gordon Danby.  Available on Amazon.",0.7546
26,"We will truly have reached a ""tipping point in transit"" when policy makers and tech columnists discuss -- with the appropriate urgency -- making it possible for the growing number of people who can't afford to drive to commute to and from those areas where the jobs are without exhausting them physically and financially.  The most vital element in that discussion will of necessity be rail systems -- which incredibly receive no mention here.",0.7525
27,"I ride all the time...to work, to drinks, to dinner.<br/>Tips for the ladies:<br/>-just try it!  take note of bike lanes before your first ride<br/>-wear bike shorts underneath dresses and skirts (they are cheap and you can't see them when you're off the bike, also fit easily in most handbags)<br/>-layer up!  wear a tank for the trip and put your top layer in the basket area<br/>-you can bike in heels, flats, and platforms...clogs maybe not so much",0.7418
28,But think of the Miracle of the Marne. Could the French Army really count on Uber to ferry  troops to the front they way Paris taxis did in 1914?,0.7351
29,"I've got to say that as a customer generally of American, I was pleasantly surprised when in 2008, I was rebooked on Continental through Houston. The seat was very comfortable, service was excellent, and the crew were very pleasant. I haven't ridden on the new United, but have not found reason to stray from American, except to the Caribbean on JetBlue. When I had a singularly nightmarish trip on American the other year, they were very responsive to my complaints about problems with delays, ground staff and crew surliness. That's been my only problem with American, including flights on the new combined airline. I used to hate flying on US Airways which compared unfavorably to a crowded schoolbus. I had recent experience flying on a former US Airways flight round trip and was surprised by the improvements. I would guess that the experience is dependent on the success at merging different cultures.",0.6987
30,"Great news for Uber,<br/>But they should watch out for Ola.<br/>Regards :  Merchant Stronghold",0.6808
31,"I ask lots of people how they like their work, and some of them tell me ""not much"". I wouldn't rate an Uber driver lower if s/he told me they weren't enthusiastic about driving, and I don't see why anyone else would either. I don't think the Uber drivers I've talked to are all lying to me; they seem genuinely positive about the opportunity Uber gives them, often going into a fair amount of detail about how the flexibility works for them.<br/><br/>On the other hand, I've had a few cab drivers over the years launch into tirades about all kinds of stuff, including their unhappy lives.<br/><br/>That's my experience. What's yours?",0.6698
32,The bicycle share program in Paris is quite good too.,0.659
33,"I realize they are a huge problem now, but in the 80's I can recall many more sightings than now, I remember in  the 42St. Sixth Ave. stop one night, you could actually hear a horde of them coming down the tracks. At the Lex and 53 Station I was coming down the long escalator when a homeless guy was at the end feeding about a dozen of them, and me trying to run up the down staircase so I wouldn't have to pass them. I just can't forget that in the late 80's I used to meet a friend at the corner of library to ride the train home together, always saw a few playing in the dirt on the 42 and 5th corner everyday. And folks please beware of the 53 &amp; 7th station, always look above, because I once saw that skinny tail (with the rest of the body) hanging down while it was walking on the overhead beams.",0.6541
34,"I have found the experience flying on American, United and Delta to be so distasteful that you couldn't pay me to fly those airlines.  For domestic flights, I try to only fly JetBlue and Virgin.  For international flights, I try to fly the major airlines of my destination country, e.g., British Airways, Air France, etc.  American et al. can take their status levels and -- well, you know. ",0.6365
35,"Since 80% of all flights taken are unnecessary,  why is this news?<br/><br/>""Look honey, we can fly San Diego to Baltimore for $258 round trip""<br/><br/>""But honey, we don't know anyone in Baltimore.""<br/>"" Who cares?  Let's go!!""<br/><br/>For business travel the percentage is probably closer to 90%.",0.6052
36,"No, but you see roads and schools named after Henry Ford, a notoriously<br/>outspoken anti-Semite and friend of Adolf Hitler.",0.5719
37,"I have flown in and out of LGA for years without problems.....happy to hear that there will be a new airport, but seriously I think we've done pretty well with what we've got!  Much preferred to JFK which is truly the worst airport in the world!",0.5696
38,"Read Elon Musk's biography........ All Space X rockets and parts are sourced and manufactured in the USA for a fraction of ULA's cost. I guess ULA could buy the engines from Space X but, that would be a capitulation Boeing and Lockeed Martin are no longer relevant in launching rockets, satellites and yes, space exploration!",0.5255
39,"""We had an opportunity to put the country on the right track with the election of president Obama…""<br/><br/>HAHAHAHAHA…what a riot.   How is Marxism-lite going to ""put the country on the right track?!""   You didn't recognize a Trojan Horse when you saw it, so we got stuck with the worst president in U.S. history--not once but twice--against whom the next president will have to work doubly hard to go even half way back.  It's often been said, ""The People get the government they deserve.""  Well, that axiom proved more true than most in 2008-2016.  Now it's going to take a ""Give 'em hell, Harry"" style BUSINESSMAN to right this ship.  Good luck, Donald.  I think you can do it.",0.5187
40,By that logic I hope the cops shoot a few of the soccer moms who roll through the stop sign near my house after dropping their kids off at school.  It would sure help make the neighborhood traffic toe the line.  ,0.5106
41,"A story worth relaying from a book called ""A Cry From the Wild"" by Lissa Ruben, published 1991. The elephant involved is Eleanor, orphaned as a calf and raised to return to the wild by Daphne Sheldrick in Tsavo National Park in Kenya.<br/><br/>""Just inside the park is Simon Trevor's house. Until a few years ago, Eleanor would visit Simon regularly, insisting on turning on the taps, but forgetting to turn them off again! She would amble up to Simon and drink. One day, there were about ten people standing on his verandah. On this particular occasion, as she approached from fifty yards or so away, she visibly quickened her pace, and with her trunk out in the scenting mode, she hurried to the awaiting group. Without hesitation she went straight up to one lady standing with her hands behind her back, and probed her wrist, withdrawing her trunk a few seconds later. This lady was wearing an ivory bracelet.""",0.5045
42,They were camping at a time when Brooks Lodge and Campground had closed for the season.  It is always risky to be in bear country after their natural food sources have disappeared.  I have camped at Katmai 7 times since the mid 1990s and have had close encounters with bears but was never threatened.  ,0.4802
43,"No, the normal scenario is for the officer to ASK for the drivers license, registration and proof of insurance. He/she may actually be stopping the person as a courtesy (tail light out, etc) For a driver to initiate a move to retrieve his license, with today's trigger happy police, could be a fatal move!  Secondly, do you REALLY want your drivers license, with photo, license number, address and other personal information to be VISIBLE for anyone to see?  I think not!  A DL is kept in ones wallet/purse as form of identification, if needed, in a variety of situations. ",0.4784
44,"I disagree, our own family vacations were spent camping through the western US and Canadian parks.  Now on their own, they've continued back country hiking and camping.  <br/><br/>On the other hand, I'd like to get your reaction if you and I walked around a few neighborhoods in cities that I select.   ",0.4767
45,I quit flying Delta years ago.<br/>At he risk of being unpatriotic SAS and JAL gave me the best service in flight over all.,0.4767
46,"I doubt if it's easier and it's definitely a lot more expensive. 50lbs is around $70 for a domestic round-trip flight. UPS,USPS will be at least double that. ",0.4588
47,"AHA! so now we require that an enterprising puzzle constructor make one where the down answers use only the right-left reflectors (AHIMOTUVWXY), and the across answers use only the top-bottom reflectors (BCDEHIKOX). Crossing squares limited to H, I, O, X. AWAY, AWAY! get right on that...",0.4559
48,"An interesting statistic to find out here would be whether or not Uber has had a measurable effect on taxi drivers' income in Paris. A quick tour of google didn't discover anything, other than an article from that far-left publication, Forbes, claiming that taxi drivers' income will go up because of Uber and Lyft. <br/><br/><a href=""http://www.forbes.com/sites/timworstall/2013/12/12/how-lyft-and-uber-will-raise-taxi-drivers-incomes-not-lower-them/"" title=""http://www.forbes.com/sites/timworstall/2013/12/12/how-lyft-and-uber-will-raise-taxi-drivers-incomes-not-lower-them/"" target=""_blank"">http://www.forbes.com/sites/timworstall/2013/12/12/how-lyft-and-uber-wil...</a><br/><br/>I will never use Uber because I have friends who are cabbies and I wish to be loyal to them. But I must say, none of them report income loss that can even indirectly be traced to Uber.",0.4555
