,comments,scores
49,"The airline classes of status, are : Steerage, and Almost Steerage.  Crammed into aircraft with seats only an anorexic midget would find comfortable, subjected to self-check-in, carry your own bags, wait like cattle for security checks we now know were not providing any security, and flight cancellations without warning.  Elite because you traveled over how many thousands of miles for what ? Not having your head examined for subjecting yourself to such discomfort and humiliation.  Airlines have an excessively high opinion of what they provide to travelers, I avoid flying anywhere less than 1000 miles distant, I'd rather drive.",0.4471
50,Many I know many conservatives that say they were hit by belts and turned out to be fine...even a good person...because of it.,0.4404
51,"There are signs of sail power returning to commercial shipping. And steamships were a good example of convenience trumping performance. The clippers of the 19th century were much, much faster than the steamships that displaced them, and could travel much, much farther without visiting a harbour (to take on coal for the steam engine).",0.4404
52,Maybe they just like chopping off heads?   Would that explanation fly in the faculty lounge?,0.4329
53,Since Eric Clapton is British I don't know how it would get him off.  Then again in Crocodile Rock Elton John Sings of his Chevy and old blue jeans.  I imagine Chevy is easier to rhyme than Ford.,0.4215
54,"I remember when my dad bought the Edsel station wagon. We were all excited to be pat of auto history<br/><br/>It lost its new car scent within days. Within two months it displayed a collection of operational flaws which then lasted its entire useful life, almost like buying a go-to-work car new. It was scary that the braking was sporadic; you had to press soooooo hard. He finally gave up when the transmission fell out. Yes, it just fell and hit the pavement one day. <br/><br/>I miss that heap.",0.4033
55,"Race horses are nuts. I worked in a stable. The folks that own and train them are nuts. Jockeys are insane. Horse players die broke.<br/>I worked at Delaware Park in the sixties, attended the U of Delaware with Joe Biden.<br/>I've seen hundreds of races. Saw Kelso once.<br/>That horse was cruising the whole way. He looked like he was enjoying himself.<br/>Good animal, good trainer, good jockey.<br/>Don't get that often.",0.4019
56,"Agreed.  She mentions ""Fun"" in the opening sentence and then about 2/3 of the way through, ""this has become my favorite workout.""  So apparently SHE thinks it's fun, but I have no idea why it appeals to her so much.  My own bias:  growing up, none of my PE teachers were really very good at it.  In fifth grade, we had six weeks of track and there were no modifications or options to run slower, jog, or walk.  It turned me off from running permanently.  So when she talks about running being ""fun"" I have no idea what she means.",0.3832
57,"The writer of  this piece says: ""The frustration for Potter and other BASE advocates has been the apparent lack of consistency in park policies. It is generally legal to catch a fish but not to pick flowers. Horses are allowed on many trails, but mountain bikers are not."" I know this is nitpicking but I for one am glad that people aren't allowed to pick wild flowers. These flowers are delicate and rarely last once they are picked, so what is the point. Why can't people enjoy the sublime beauty the flowers add to the surroundings, which would explain why such a policy is in place. As for mountain bikers, I'm sure many would have the same mentality that many NYC bikers have on the city streets, that somehow they own the streets or in trails and everyone else should accommodate them. For the writer to pretend that these rules are merely capricious shows the bias he had when  he wrote about the jumpers, as if there might not be logical issues behind the ban. That is doing a disservice to the park rangers, emergency rescue workers, other park visitors, and the NY Times readers. ",0.3628
58,"On the other side of the wall, behind the replicator window, there is a whole kitchen full of third world (literally) citizens slaving their butts off. Just like those automatic Enterprise doors; what you don't see is that there's a little green alien on either side of the doorway who has to keep an eye out for when somebody's headed for the door and pull the thing open.",0.3612
59,"and while they are at it, let's restore Penn Station to the grandeur that it was and make entering New York by rail as grand as it once was.  The current rail station is a public disgrace and an embarrassment to NYC and the USA",0.3612
60,"First, thank you for your service. Second, don't presume it puts you or any other vet on a higher moral plane than the rest of us. Finally, you should know that rights, by definition, don't have to be ""earned"". They simply are.",0.3612
61,"Like a dog chasing a car, they never actually thought about what would happen if they caught it.",0.3612
62,I have a 2000 Honda Odyssey that's nice and dumb. I don't need a car with all the bells and whistles. Just give me a car that is safe and reliable. Will the car manufacturers' hear my voice?,0.34
63,"Well, enough about this; let's hear some more about Marco Rubio's four traffic tickets!",0.3382
64,"Thank you for this important distinction. And, or but, any columnist who defends Geller's First Amendment right without at least acknowledging that the ads walk right up to the line on incitement if they don't actually cross it (after all, who gets to decide on when someone has crossed) is doing a disservice to the First Amendment.  ",0.3071
65,Kinda like the auto industry and air bags.,0.2975
66,"I drive a 1998 Camry which I will keep for another 20 years no matter the cost (which has been almost nonexistence).  I will not drive internet connected cars.  Death waiting to happen.<br/><br/>I love my simple, safe, reliable car.",0.2732
67,"""the limits of rationality"", ""satisficing"" (Herbert Simon)...<br/><br/>How do you measure these things, when they are definitionally unmeasurable?<br/><br/>Are there things that cannot be measured?<br/><br/>No empty seats on transatlantic flights seems to indicate there's a ton that can be modeled/measured.",0.2387
68,If she marked on an employment application that she is African American she lied. End of story.  I don't understand how many people are defending her. Gee I identify as the Queen of England and I want to live in Buckingham Palace and be waited on hand and foot ya think that'll fly?,0.2263
69,"The discussion here seems to conflate two separate points.<br/><br/>Weighing passengers and their luggage (both checked and carry-on) precisely is a matter of physics. That it should be done is, for me, completely obvious. I would rather be rolling down the runway at take-off knowing that the pilots and the auto pilot have accurate information about the total weight of the aircraft and the minimum take-off speed required, maximum abort speed, and so on.<br/><br/>Now, as for *charging* passengers for their weight, that's tougher, and I am inclined to vote ""no."" As for whether or not I am expected to be crowded in my own seat by someone large who demands that the armrest between us be raised is an entirely different matter.",0.2263
70,Would you enjoy a ride on a faulty roller coaster?,0.2263
71,And those tiny little computer chips are known to fail now and then -  right in the middle old heavy traffic when the family is happily playing Scrabble.,0.2263
72,"Spent $2000 over five years ago to fix a known issue with my Subaru's head-gasket @ 120,000 miles.<br/><br/>Which included replacement of many of the engine's ""wear &amp; tear"" parts - e.g. seals, belts, hoses, water pump, timing belt, radiator, plugs, plug wires.<br/><br/>Still running fine at nearly 180,000 miles.<br/><br/>I agree with other posters that I'd change mechanics (even paying for a tow to someone you trust) if the nearest guy wanted $700 just to diagnose!<br/><br/>I bet closer to $1000 (at a more reasonable shop) would have fixed the problem.",0.2244
73,"If the ID card was exclusively for voting than yes it would be a poll tax.  But since it serves other purposes - driving, check cashing, travel, etc. it does not.",0.2144
74,"While wanting speed boats and expensive cars is not a crime it does not qualify Rubio to rail at those less fortunate and demand austerity when he has a ""sugar daddy"".  It does entitle Americans to regard him as a hypocrite and incapable of managing our national priorities. Not everyone is responsible.",0.1677
75,"I'm sure glad I did the Northwest Passage years ago while there was still ice.  One of my most glorious adventures.  As a card-carrying Roald Amundsen freak, I wanted to pass through the same route that he was first to traverse-- after centuries of failed English efforts  led by people who nothing of the Arctic. Just like the Englishman  Scott's doomed attempt to reach the South Pole doing every conceivable thing wrong -- while Amundsen did everything right.",0.1459
76,"I agree. I'm 5'-2"" tall, and the bicycles are too big. The wheels and frames are too big, even if I hassle with lowering the seat and handle bars.",0.128
77,"Can we talk about Razor scooters? I'm not a fan of small children scooting  on sidewalks some yards ahead of or behind their adult. I'm older, my vision and balance aren't great.  I consider them no more appropriate on a sidewalk than a bicycle or a skateboard.<br/>When was it decided that because it's a cute little kid, it's OK? Up until recently I didn't see this on sidewalks in my own downtown, but inevitably these fads drift up from NYC so now they're here. ",0.1196
78,Nuanced and critical thinking would help you make sense of this.  Not bumper stickers.,0.1027
79,"The ""cooler heads and kinder hearts"" have gotten us into this mess. I am for Trump and a lot of other people are. Watch him ride this very central issue to the White House.",0.0836
80,"Um, you might want to check the AL West standings right now.",0.0772
81,"I never heard complaints about pricing when the airlines were losing billions of dollars/year.  Now, when they are actually making a decent return given the level of capital investment, people want them investigated for price fixing.  <br/><br/>There is no law which states people are ""entitled"" to a low fare, no fee for checked baggage and a seat with extra legroom.  If one books far ahead, lower fares are possible, but if one procrastinates (emergencies such as funerals are a separate matter), then you can expect to pay a premium.   That said, one can almost be assured of a very safe flight, something most take for granted, but again, no true quality program can exist at the lowest possible price.  ",0.0378
82,The Taxi lobby,0.0258
83,What other carrier is available that doesn't do this? Please let me know so that I too can dump AT&amp;T. But I don't think another carrier exists who is not in bed with the government.,0.0032
84,"Just in case you can take it with you, I heard that Greenberg has a closet full of asbestos suitcases.",0.0
85,Try on 4 or 5 pairs?<br/>Or if you have my Fred Flinstone EEEs grab the pair of NewBalance that is in stock,0.0
86,"How asinine! What's next, a texting lane on the sidewalk? On the highway?",0.0
87,"This isn't just about commuters to NY. This is about our nation and also about the over use of highways, and personal transportation that uses entirely too much fossil fuels and tax dollars. ",0.0
88,"It does explain, however, how unscrupulous used car salesmen are able to make a living.",0.0
89,"Just to finish your story, what was the outcome of the ticket?",0.0
90,"You are so right. It's why I got up and left during the second (or was that the 4th) song ... BORING!<br/><br/>If anybody was looking for Rock~n~Roll on the 4th of July, it was In Indy @ the Stones show.",0.0
91,They are all bozos on that bus!,0.0
92,You should have seen the USAir-Cattle-Pens about 10 years ago.,0.0
93,"Personally,nwhen I think about the ""invisible hand,"" I always feel goosed.",0.0
94,"Same for hikers, why aren't you as crass about the ones that slip on the trail?",0.0
95,This and the South China sea are slippery very slippery indeed.,0.0
96,*of  runway,0.0
97,"I suppose the French doctors don't drive new Porsches, either, or live in giant mansions.",0.0
98,This is strange.<br/><br/>I haven't possessed a front plate on my BMW in 3 years of ownership in Cincinnati. Previous German cars never had an issue of never having a front plate. Ever. And I know they all see it. <br/><br/>Odd he would get pulled over.,0.0
99,"Will the name ""Trump"" appear in 10 foot letters every mile or so?",0.0
100,Not in Yosemite.,0.0
101,"If you're serious about changing the system, take a look at the Netherlands -- Groningen, in particular, which 40 years ago reorganized the city around the assumption that people will take public transportation, walk, or bike. Cars are routed around the perimeter of the city center to get from one quadrant to another. Shopkeepers said their businesses would suffer if people couldn't park cars right in front, but they not only didn't, their sales increased as people were walking in those neighborhoods rather than driving. Yes, this is on a small scale, but imagine if American cities were built around a reliable public transportation infrastructure, rather than whatever it is they're built on now. After a year in the Netherlands (without a car for the first time in my adult life), I can't imagine ever living in a place without reliable public transportation. ",-0.0183
102,"Removing the pedestrian plazas is not the solution. Those plazas are a fine step in the direction of orienting the city more towards pedestrians (and public transit) over private cars, which is as it should be.",-0.0418
103,"Use the search engine in the page. If, you are serious. ",-0.0772
104,"My God. First, he drinks water. Then, he gets some parking tickets. Now, we learn that he bought a speed boat? Does this mans depravity know no bounds? ",-0.1179
105,"They &amp; Lyft are vigilant about insurance &amp;  auto inspection being up to date. If not, the driver's accounts are locked &amp; they can't accept rides.",-0.124
106,"Self-driving cars can't be any worse than the drivers where I live.  Maybe they'll use turn signals and not cut off other drivers.  Oh, but wait...these self-driving experimental cars are Lexuses?  Toyotas?  That means they'll always be going at least 10 mph under the speed limit; will hit the brakes and slow down at green lights; will stop completely before making a turn--which they will do VERY slowly, and of course no turn signal; and they will always be in the left lane, regardless.  <br/><br/>So tell me again, what are the benefits to self-driving cars?",-0.1421
107,I think the guy is mad because he cant cross the street also i think he might be tying to tell people to look both way before crossing with the street. I agree with evan because he is paying attention to a light.    ,-0.1779
108,"I've been a rider almost all my life and I will never condone or watch flat racing.  This article just adds to the cruelty to these young animals who shouldn't be racing at the age the are in the first place!<br/>I use a crop, just a slight tap in the hind quarters gets a horse's attention with the slight nudge of your heel.  They don't need to be beaten, especially the amount of time was used in the Derby.  The horse won by a landslide.  What was the point?<br/>They are motivated by the crop and incessant whipping does inflict a sense of punishment to the animal.<br/>No horse's skin should ever be broken.  That jockey should be called before the track board and given a much bigger fine than $500,<br/>And yes, you can be sure I do not watch these races on TV or read about them in the newspaper. Some ""sport.""",-0.2003
109,"I hope the judge has an unpleasant year, and comes to see the error of her inappropriate ways. She should not be hearing drunk driving cases if this is how she behaves.",-0.2177
110,"I believe we should have an option to decline the IoT. It is a dumb idea and the novelty of showing off a Nest house to your date will get old fast, like lizard-skin pants, a water bed and a lava lamp. Stop &amp; Shop gives me the stink eye every time I purchase without using their store loyalty card. I sympathize with the clerks who probably get perks or punishment based on whom they enroll. Yes?<br/><br/>I like this author's idea but once you start asking for regulation then you know you are years too late because the cat is already out of the bag.",-0.2382
111,"Neither side is entirely in the right. It's hard to blame taxi drivers who have paid exorbitant fees for medallions for bemoaning the competition. At the same time the current system is essentially a cartel that uses thuggish tactics like traffic slowdowns to protect its monopoly, to the detriment of the riding public.And everyone is hurt when new technology isn't allowed to replace a sclerotic, antiquated, inefficient system or ride hailing.<br/><br/>Clearly, a compromise is called for. I suggest as a human alternative that Uber and any similar business that wants to operate in Paris be required to contribute to a fund that reimburses cab drivers for any reduction in the selling price of a medallion. In effect, they would have to buy into the system.",-0.2732
112,"It seems to be a business model that exploits prospective part time workers who do not have employee status nor could participate in a company plan. What could prevent a legitimate French medallion taxi driver to be an UberPop Driver?  Should there be a city law say an entry minimum limit of autos provided by Uber  taxi service. With a recent  investment of 100 million dollars by a notable investor in Uber, a question to ask is why aren’t there Uber taxis stands with a queue of Uber taxis or circling airport Uber taxis . Uber would seem to have such deep pockets. ",-0.3182
113,It is foolhardy to belief that that Hispanics are a homogeneous voting block. The separation between Cubans and other Hispanics is as wide as the the Grand Canyon.,-0.3182
114,"Mkst Europeans have NO DESIRE to live in America. What has Europe created in the last 20 yrs? All the top cars people want to drive (VW, Audi, BMW, Mercedes), the Nokia cellphines people use, the cuisine people eat, the styrles they wear - and they've done all that while providing health insurance to eveyone at lower cost than we pay and eliminating the sort of 18th century poverty you see on a drive through West Virginia.",-0.3182
115,"I adopted a racing greyhound when she was 2 years old. Unlike many of the other dogs that were up for adoption, she was in relatively good shape. Because she was not a winning racer, she would have been put down if the rescue organization had not developed a relationship with the track. Like many Greyhounds, my dog has chronic stomach problems because of the food she was fed at the track. Still others have physical problems, like microscopic muscle tears that can be painful, or behavioral issues.<br/><br/>I know there is more money in horse racing, and perhaps the horses are treated better on a day to day basis, but putting a horse down due to a broken leg that was caused by the sport itself is inexcusable.<br/><br/>Just because we as a society need something to cheer for doesn't mean we should abuse animals just so we can be entertained. The fact that the dogs/horses have no say in the matter makes it all the more important that we act responsibly. ",-0.3396
116,At least one presidential candidate has been discussing those issues -- Bernie.  Unfortunately he flies below the Times radar.,-0.34
117,Isn't one of the problems with Greece that they cant build a train to Gongzhou?,-0.4019
118,How nearsighted. Uber IS one of the corporations where greed has taken over.,-0.4019
119,And many more people falling for it. Striking how no one seems to want to touch that apparent third rail. ,-0.4173
120,"Oops.  Did you notice that the word ""automobile"" has a French sound to it?  That's right;  it's a French word.  While the Germans originated many of the raw mechanical inventions that make up an automobile it's the French who embraced it first.  Who fought against the automobile at that time?  The British.  They imposed stringent speed limits, only ""relaxing"" the limit to 20 mph in 1903 and retaining that limit until 1930. ",-0.4515
121,"Wondering if there is a connection between increasing availability of DDT for malaria control in these areas and the declining vulture population.<br/> <a href=""http://www.aljazeera.com/programmes/lifelines/2014/02/ddts-pesky-proponents-2014228126865738.html"" title=""http://www.aljazeera.com/programmes/lifelines/2014/02/ddts-pesky-proponents-2014228126865738.html"" target=""_blank"">http://www.aljazeera.com/programmes/lifelines/2014/02/ddts-pesky-propone...</a><br/><br/>It's happened before...",-0.4588
122,As your own roads fall apart from neglect called Austerity.,-0.4588
123,"A drone buzzed our campground in the Catskills (North South Lake) over the July 4 weekend.  We think the drone owners were the same people a few sites down with a camper bigger than our NYC apartment, hooked up to loud generators that ran all night long and strewn with garish looking electric light strings, and three vehicles parked alongside. Seriously, why bother going camping?",-0.4767
124,First the carriage horses. Now the rats. That DiBlasio hates animals!,-0.4926
125,"This program creates hundreds of unskilled, ignorant cyclists who ignore rules of traffic, endanger pedestrians, clog traffic, and take away the ability for people and businesses to conduct commerce via the huge amounts of space being taken up for bike docking that no one is using.  These riders are an absolute menace and the program should be disbanded with all money being put into the third-world subway system.",-0.5106
126,"When traveling overseas I book directly with the hotel. I'm a regular at several hotels in France so when my name is recognized, I always get an upgrade. That would never happen on any of those other websites. I book directly with the airlines too. It's just not worth my time and trouble to do otherwise.",-0.5213
127,"I'm sure there'll be a lot of resistance to autonomous cars, but there's one rock solid reason why we should want them: they'll take that half-asleep drunken distracted idiot in the next lane out from behind the wheel. I want an autonomous car, but what I *really* want is for everyone else to have one. You should feel the same way. ",-0.5647
128,"The anti-railroad people complain that trains ""need too many subsidies"" and ""can't compete"" with airlines. This is another example of how government subsidizes air travel at the expense of rail. The Port Authority is a bloated bureaucracy that has long outlived its usefulness. This dumb rule is another example. ",-0.596
129,"Airlines are no longer a ""service"" business. They have become freight carriers for self-loading cargo, although they provide a small section in the front of the plane for the ""elite"" who can afford an outrageous price to be treated as nearly human. Some people who can't afford that outrageous price still cling to outmoded notions of airlines providing ""service,"" and suffer cognitive dissonance when they're actually treated as freight under the modern business model. <br/><br/>Deregulation is part of the problem, but the real cause is that the majority of passengers consistently tell airlines they WANT to be self-loading cargo. They care only about finding the lowest fare, irrespective of ""service."" Airline executives got the message, and found that they could best serve customers as well as shareholders by continually degrading the quality of what they provide in the ""main cabin."" Meanwhile, ""unbundling"" every possible element of air travel and charging fees for them lets them give customers the low fares they demand while giving extra special service to shareholders. <br/><br/>Airlines can get away with those games because they know that nearly all the self-loading cargo that occupies the constantly-shrinking seats has no other choice. Most people don't have time to drive themselves across the country, or to ride tardy Amtrak or squalid Greyhound; and passenger ships no longer cross oceans. So airlines have no need to offer ""service"" beyond basic freight delivery.",-0.631
130,"The semi-professional racing cyclists and wanna-be companions racing downhill on the west driver are particularly dangerous to pedestrians and strollers. If we really speak of 'the park and the people', it would be limited to pedestrians and strollers/vehicles only for those in need of assistance.",-0.6478
131,"Three years ago I was booked to fly from NYC to Sydney on Singapore Airlines using my United Airline miles. United had recently merged with Continental and on arriving at the airport I was told that there was no reservation in my name. Apparently my reservation had been 'lost' in the merger. The first question the UA ticket agents asked me was the level of my UA membership, not 'How can we help you'. If I'd had a high-status membership I know they would have had me on a plane that night but as it was it took tears to get on a flight the following day. Not only did they not apologize, they had the nerve to accuse me of mileage fraud. I used to love flying and now I dread it. ",-0.6535
132,It is extremely easy to fall off a bike and hit your head.  Head injury is serious business.  You're a fool if you don't wear a helmet.  There may be plenty of fools around the world but that's no excuse.,-0.6546
133,The problem wasn't that they distanced themselves from Obama.  It was that they distanced themselves in the wrong direction.,-0.7003
